auth_rating,beer_abv,beer_description,beer_ibu,beer_label,beer_label_hd,beer_name,beer_slug,beer_style,bid,brewery.brewery_id,brewery.brewery_label,brewery.brewery_name,brewery.brewery_slug,brewery.brewery_type,brewery.contact.facebook,brewery.contact.twitter,brewery.contact.url,brewery.country_name,brewery.location.brewery_city,brewery.location.brewery_state,brewery.location.lat,brewery.location.lng,collaborations_with.count,collaborations_with.items,created_at,is_homebrew,is_in_production,merge_details.master_bid,merge_details.merge_date,merge_details.requested_bid,rating_count,rating_score,rating_score_below,stats.monthly_count,stats.total_count,stats.total_user_count,stats.user_count,vintage_parent.beer.beer_abv,vintage_parent.beer.beer_name,vintage_parent.beer.beer_slug,vintage_parent.beer.bid,vintage_parent.beer.type_id,vintages.count,vintages.items,weighted_rating_score,wish_list
0,0.0,(special blend),0,https://untappd.akamaized.net/site/assets/images/temp/badge-beer-default.png,,10th Anniversary Imperial Russian Stout,stone-brewing-co-10th-anniversary-imperial-russian-stout,Stout - Russian Imperial,9180,1204,https://untappd.akamaized.net/site/brewery_logos/brewery-1204_23541.jpeg,Stone Brewing,stone-brewing,Micro Brewery,http://www.facebook.com/StoneBrewingCo,StoneBrewingCo,http://www.stonebrewing.com/,United States,Escondido,CA,33.1157,-117.12,,,"Sun, 14 Nov 2010 04:00:42 +0000",0,1,9180.0,"Thu, 01 Jan 1970 00:00:00 +0000",11970.0,0,0.0,True,0,0,0,0,,,,,,0.0,[],0.0,False
0,6.0,The Red Racer winter ale is a classic recipe with a smooth balance of winter spice and Northwest-style hop flavour. The hops add a bitterness to the back of the palate while the winter spices are reminiscent of your favourite holiday treat.,40,https://untappd.akamaized.net/site/beer_logos/beer-26916_35d4d_sm.jpeg,https://untappd.akamaized.net/site/beer_logos_hd/beer-26916_5aad5_hd.jpeg,Red Racer Winter Ale,central-city-brewers-distillers-red-racer-winter-ale,Winter Ale,26916,357,https://untappd.akamaized.net/site/brewery_logos/brewery-357_cd993.jpeg,Central City Brewers + Distillers,central-city-brewers-distillers,Micro Brewery,http://www.facebook.com/centralcitybrewing,centralcitybrew,http://www.centralcitybrewing.com/,Canada,Surrey,BC,49.21,-122.864,,,"Thu, 27 Jan 2011 20:19:32 +0000",0,1,26916.0,"Thu, 01 Jan 1970 00:00:00 +0000",11971.0,180,3.41111,,8,350,221,0,,,,,,0.0,[],3.56207,False
0,8.5,Very Smooth Lager,0,https://untappd.akamaized.net/site/beer_logos/beer-SchlitzHighGravityVSLVerySmoothLager_11972.jpeg,,Schlitz High Gravity VSL,pabst-brewing-company-schlitz-high-gravity-vsl,Malt Liquor ,11972,963,https://untappd.akamaized.net/site/brewery_logos/brewery-pbr.jpg,Pabst Brewing Company,pabst-brewing-company,Macro Brewery,https://www.facebook.com/PabstBrewingCo,pabstblueribbon,http://www.pabstbrewingco.com,United States,Woodridge,IL,41.7181,-88.009,,,"Mon, 29 Nov 2010 17:17:32 +0000",0,1,,,,748,2.15943,,21,1055,876,0,,,,,,0.0,[],2.59243,False
0,5.3,,0,https://untappd.akamaized.net/site/beer_logos/beer-333PremiumExportBeer_24194.jpeg,,333 Premium Export,sabeco-333-premium-export,Lager - Pale,24194,4640,https://untappd.akamaized.net/site/brewery_logos/brewery-Sabeco_4640_bd6a5.jpeg,Sabeco,sabeco,Micro Brewery,,,http://www.sabeco.com.vn/,Vietnam,Ho chi min city,Siagon,10.8206,106.661,,,"Sat, 15 Jan 2011 00:58:29 +0000",0,1,24194.0,"Thu, 01 Jan 1970 00:00:00 +0000",11973.0,5425,2.69452,,267,7417,6263,0,,,,,,0.0,[],2.74558,False
0,5.0,"Huda is a traditional Vietnamese beer brewed and bottled in Hu?, Vietnam, by Hue Breweries Ltd. Being aromatic and refreshing with a slightly ""hoppy"" bouquet, Huda is a favorite beer among many domestic and foreign consumers.

The Huda beer has been a symbol of the Heartland for more than 25 years and its reputation for quality is a source of pride among local Huda consumers. The good quality of the beer also caused Huda to win a silver medal at the World Beer Championships in 2013.",0,https://untappd.akamaized.net/site/beer_logos/beer-HudaBeer_11974.jpeg,,Huda Beer,hue-brewery-ltd-huda-beer,Lager - North American Adjunct,11974,6585,https://untappd.akamaized.net/site/brewery_logos/brewery-6585_76540.jpeg,Hue Brewery Ltd,hue-brewery-ltd,Macro Brewery,,,,Vietnam,Hue City,,16.4872,107.595,,,"Mon, 29 Nov 2010 18:52:19 +0000",0,1,,,,2018,2.67332,,102,2803,2308,0,,,,,,0.0,[],2.80203,False
0,5.2,"Famous Ukrainian lager, brewed with old world recipes, using the finest ingredients.",0,https://untappd.akamaized.net/site/beer_logos/beer-73036_f5034_sm.jpeg,https://untappd.akamaized.net/site/beer_logos_hd/beer-73036_d54cd_hd.jpeg,Magnat (??????),obolon-obolon-magnat-magnat,Lager - Pale,73036,3260,https://untappd.akamaized.net/site/brewery_logos/brewery-3260_624c9.jpeg,Obolon (???????),obolon-obolon,Macro Brewery,https://www.facebook.com/ObolonUkraine,ObolonUkraine,http://www.obolon.ua/,Ukraine,Kiev,,60.0009,30.2938,,,"Fri, 19 Aug 2011 20:03:10 +0000",0,1,73036.0,"Tue, 14 Jan 2014 02:45:19 +0000",11975.0,775,2.85871,,19,933,887,0,,,,,,0.0,[],3.08295,False
0,4.5,,0,https://untappd.akamaized.net/site/beer_logos/beer-_11976_sm_5706d01db08e1fb1fae6a51b98aaf9.jpeg,,Stoke Dark,mccashin-s-brewery-stoke-dark,Dark Ale,11976,7140,https://untappd.akamaized.net/site/brewery_logos/brewery-McCashinsBrewery_7140.jpeg,McCashin's Brewery,mccashins-brewery,Micro Brewery,http://www.facebook.com/McCashinsBrewery,McCashins,http://www.mccashins.co.nz,New Zealand,Stoke,Nelson,-41.3187,173.226,,,"Mon, 29 Nov 2010 19:20:25 +0000",0,1,,,,1881,3.45654,,53,2524,2069,0,,,,,,0.0,[],3.48373,False
0,4.8,,0,https://untappd.akamaized.net/site/assets/images/temp/badge-beer-default.png,,AB Pale Ale,the-australian-brewery-ab-pale-ale,Pale Ale - American,114228,3262,https://untappd.akamaized.net/site/brewery_logos/brewery-3262_b5613.jpeg, Australian Brewery,australian-brewery,Micro Brewery,http://www.facebook.com/ausbrewery,AusBrewery,http://www.australianbrewery.com,Australia,Rouse Hill,NSW,-33.6745,150.913,,,"Thu, 29 Dec 2011 00:19:35 +0000",0,1,114228.0,"Sun, 19 Feb 2012 16:58:32 +0000",11977.0,0,0.0,True,0,0,0,0,,,,,,0.0,[],0.0,False
0,7.5,"Het blonde Tripel Ram?ebier (7,5%) wordt gebrouwen naar een eeuwenoud Haspengouws recept. Een tweede gisting vindt plaats in de fles, waardoor de smaak nog intenser wordt.
Om volop te kunnen genieten van de aroma's, raden we u aan dit bier te degusteren bij een temperatuur die schommelt tussen 7? en 10?. Let wel op het bodempje gist dat zich onderaan in de fles bevindt, sommige bierkenners vinden dit net lekker, andere verkiezen dit niet mee op te drinken.",0,https://untappd.akamaized.net/site/beer_logos/beer-11978_e73e7_sm.jpeg,https://untappd.akamaized.net/site/beer_logos_hd/beer-11978_5cf8a_hd.jpeg,Ram?e Tripel Blonde,brouwerij-palm-ramee-tripel-blonde,Belgian Tripel,11978,967,https://untappd.akamaized.net/site/brewery_logos/brewery-967_a8631.jpeg,Brouwerij Palm,brouwerij-palm,Macro Brewery,https://www.facebook.com/PalmBelgie/,palmbelgie,http://www.palm.be,Belgium,Steenhuffel,,50.9953,4.2835,,,"Mon, 29 Nov 2010 19:28:25 +0000",0,1,,,,3460,3.48504,,85,4205,3822,0,,,,,,0.0,[],3.49852,False
0,8.0,"The triple blond is both simple and complex. Its initial simplicity, with an easy approach that releases a sweet zest is quickly complemented by a bitterness that runs to the back of the mouth. Complex, with its raw ingredients clashing a little like cannon shots, but each tastier than the last, with alternating bitter hops and the flexibility of its malt, gives this Waterloo beer the taste of victory.",0,https://untappd.akamaized.net/site/beer_logos/beer-989595_31b7c_sm.jpeg,https://untappd.akamaized.net/site/beer_logos_hd/beer-989595_6ad0e_hd.jpeg,Waterloo Triple Blond,waterloo-brewery-mont-st-jean-waterloo-triple-blond,Belgian Tripel,989595,190031,https://untappd.akamaized.net/site/brewery_logos/brewery-190031_b7361.jpeg,Waterloo Brewery Mont-St-Jean,waterloo-brewery-montstjean,Micro Brewery,https://www.facebook.com/waterloobeers,,http://www.waterloo-beer.com/,Belgium,Waterloo,Brabant Wallon,50.6858,4.40943,,,"Tue, 24 Feb 2015 10:11:02 +0000",0,1,989595.0,"Sat, 08 Aug 2015 15:17:22 +0000",11979.0,14684,3.54328,,493,18621,16135,0,,,,,,0.0,[],3.54547,False
0,8.0,"A coffee nose is combined with a tone of roots, but with a strong, disciplined character. Its flavour develops gradually, reminiscent, if you will, of the ardor of the soldiers of the Battle of Waterloo. Strong and reassuring, it provides a conclusion that tends primarily towards the sweet at the finish, a symbol of a well-deserved treat at the end of a busy day.",0,https://untappd.akamaized.net/site/beer_logos/beer-999441_0d2fa_sm.jpeg,https://untappd.akamaized.net/site/beer_logos_hd/beer-999441_eeca0_hd.jpeg,Waterloo Strong Dark,waterloo-brewery-mont-st-jean-waterloo-strong-dark,Belgian Strong Dark Ale,999441,190031,https://untappd.akamaized.net/site/brewery_logos/brewery-190031_b7361.jpeg,Waterloo Brewery Mont-St-Jean,waterloo-brewery-montstjean,Micro Brewery,https://www.facebook.com/waterloobeers,,http://www.waterloo-beer.com/,Belgium,Waterloo,Brabant Wallon,50.6858,4.40943,,,"Thu, 05 Mar 2015 21:38:02 +0000",0,1,999441.0,"Sat, 08 Aug 2015 13:44:38 +0000",11980.0,11750,3.48096,,434,14445,12756,0,,,,,,0.0,[],3.48527,False
0,6.9,"Unlike a typical Red Ale, Believer balances a rich malt complexity with a plentiful hop presence. Notes of caramel, toffy, fig, and date ease into earthy and floral hops, making this Double Red Ale incredibly drinkable and full-flavored.",60,https://untappd.akamaized.net/site/beer_logos/beer-6411_a24f5_sm.jpeg,https://untappd.akamaized.net/site/beer_logos_hd/beer-6411_79bea_hd.jpeg,Believer ,ninkasi-brewing-company-believer,Red Ale - Imperial / Double,6411,2840,https://untappd.akamaized.net/site/brewery_logos/brewery-NinkasiBrewingCompany_2840.jpeg,Ninkasi Brewing Company,ninkasi-brewing-company,Micro Brewery,,NinkasiBrewing,http://www.ninkasibrewing.com/,United States,Eugene,OR,44.057,-123.11,,,"Sat, 09 Oct 2010 15:34:52 +0000",0,1,6411.0,"Thu, 01 Jan 1970 00:00:00 +0000",11981.0,17384,3.64643,,846,24487,19548,0,,,,,,0.0,[],3.6465,False
0,5.4,"The full complexity of the genuine Bavarian wheat beer ?great with hearty food.

Amber-mahogany colored wheat beer. Nuances of ripe bananas, clove, nutmeg and nuts create the aroma. A full-bodied and sparkling beer with a harmonious finish.
Brewed according to the original recipe of the founder of the brewery of 1872. 
The ideal companion for Bavarian food, hearty dishes, roast poark, ?Leberk?se? (meat loaf), the Bavarian ?Wei?wurst? (white sausage), marinated shrimps, camembert or olives stuffed with peppers.
",14,https://untappd.akamaized.net/site/beer_logos/beer-_11982_sm_d9f674e178e13fbfb49c049852b243.jpeg,,Schneider Weisse Original (TAP7),weisses-brauhaus-g-schneider-sohn-schneider-weisse-original-tap7,Hefeweizen,11982,1023,https://untappd.akamaized.net/site/brewery_logos/brewery-1023_589bc.jpeg,Schneider Weisse G. Schneider & Sohn,schneider-weisse-g-schneider-sohn,Micro Brewery,http://www.facebook.com/schneiderweisse,schneiderweisse,http://www.schneider-weisse.com,Germany,Kelheim,Bavaria,48.9175,11.8735,,,"Mon, 29 Nov 2010 19:57:41 +0000",0,1,,,,54211,3.73275,,1520,77844,60312,0,,,,,,0.0,[],3.73229,False
0,4.0,,0,https://untappd.akamaized.net/site/assets/images/temp/badge-beer-default.png,,John Paul Jones,sulwath-brewers-ltd-john-paul-jones,English Bitter,11983,2986,https://untappd.akamaized.net/site/brewery_logos/brewery-SulwathBrewersLtd_2986_272e8.jpeg,Sulwath Brewers Ltd,sulwath-brewers-ltd,Micro Brewery,,,http://www.sulwathbrewers.co.uk,Scotland,Castle Douglas,Kirkcudbrightshire,54.94,-3.93085,,,"Mon, 29 Nov 2010 20:29:23 +0000",0,1,,,,3,0.0,,0,5,5,0,,,,,,0.0,[],3.6149,False
0,5.0,,0,https://untappd.akamaized.net/site/beer_logos/beer-_11984_sm_0700349c50aecbcec7e8e677f73a3e.jpeg,https://untappd.akamaized.net/site/beer_logos_hd/beer-_11984_hd_319b010020c1b2f9e1fb059b37edf1.jpeg,The Black Galloway,sulwath-brewers-ltd-the-black-galloway,Porter - Other,11984,2986,https://untappd.akamaized.net/site/brewery_logos/brewery-SulwathBrewersLtd_2986_272e8.jpeg,Sulwath Brewers Ltd,sulwath-brewers-ltd,Micro Brewery,,,http://www.sulwathbrewers.co.uk,Scotland,Castle Douglas,Kirkcudbrightshire,54.94,-3.93085,,,"Mon, 29 Nov 2010 20:40:14 +0000",0,1,,,,272,3.64798,,6,358,301,0,,,,,,0.0,[],3.64951,False
