auth_rating,beer_abv,beer_description,beer_ibu,beer_label,beer_label_hd,beer_name,beer_slug,beer_style,bid,brewery.brewery_id,brewery.brewery_label,brewery.brewery_name,brewery.brewery_slug,brewery.brewery_type,brewery.contact.facebook,brewery.contact.twitter,brewery.contact.url,brewery.country_name,brewery.location.brewery_city,brewery.location.brewery_state,brewery.location.lat,brewery.location.lng,created_at,is_homebrew,is_in_production,merge_details.master_bid,merge_details.merge_date,merge_details.requested_bid,rating_count,rating_score,rating_score_below,stats.monthly_count,stats.total_count,stats.total_user_count,stats.user_count,variant_parent.beer.beer_abv,variant_parent.beer.beer_name,variant_parent.beer.beer_slug,variant_parent.beer.bid,variant_parent.beer.type_id,vintages.count,vintages.items,weighted_rating_score,wish_list
0,4.6,,0,https://untappd.akamaized.net/site/beer_logos/beer-_6537_sm_11a8ed640672d2f45c2a63259afbb3.jpeg,https://untappd.akamaized.net/site/beer_logos_hd/beer-_6537_hd_4135ab4955135b2d919df5a1fa2993.jpeg,13th Century Grut Bier,dr-fritz-briem-13th-century-grut-bier,Gruit / Ancient Herbed Ale,6537,1565,https://untappd.akamaized.net/site/assets/images/temp/badge-brewery-default.png,Dr. Fritz Briem,dr-fritz-briem,Micro Brewery,,,,Germany,Au,,48.561,11.7377,"Thu, 14 Oct 2010 14:11:33 +0000",0,1,,,,2233,3.28627,,5,2852,2668,0,,,,,,0.0,[],3.33021,False
0,0.0,,0,https://untappd.akamaized.net/site/assets/images/temp/badge-beer-default.png,,Vanilla Bean Imperial Porter,karl-strauss-brewing-company-vanilla-bean-imperial-porter,Porter - Imperial / Double,6538,1880,https://untappd.akamaized.net/site/brewery_logos/brewery-KarlStraussBrewingCompany_1880.jpeg,Karl Strauss Brewing Company,karl-strauss-brewing-company,Micro Brewery,http://www.facebook.com/pages/Karl-Strauss-Brewing-Company/142025660844,KarlStraussBeer,http://www.karlstrauss.com/,United States,San Diego,CA,32.8325,-117.232,"Thu, 14 Oct 2010 14:14:22 +0000",0,1,,,,17,3.38235,,0,27,26,0,,,,,,0.0,[],3.61554,False
0,7.5,"A Belgian style stout, is brewed with German 2 row barley, Torrified wheat and oats, balanced by a large addition of Belgian dark candi to give the Black a full and silky mouthfeel. Roasted malts give this stout its classic chocolate, toast and malty taste, and contribute to chocolate notes and a hint of roasted coffee in the aroma. The Black is fermented with a Belgian yeast strain and refermented in the bottle with the methode champenoise to make this beer truly unique.",0,https://untappd.akamaized.net/site/beer_logos/beer-Black_6539.jpeg,,Black,allagash-brewing-company-black,Belgian Strong Dark Ale,6539,24,https://untappd.akamaized.net/site/brewery_logos/brewery-24_015ad.jpeg,Allagash Brewing Company,allagash-brewing-company,Micro Brewery,https://www.facebook.com/pages/Allagash-Brewing-Company/111357972232101?ref=ts&fref=ts,allagashbrewing,http://allagash.com,United States,Portland,ME,43.7028,-70.3182,"Thu, 14 Oct 2010 14:15:22 +0000",0,1,,,,46658,3.80573,,504,65594,52506,0,,,,,,5.0,"[{'beer': {'bid': 194851, 'beer_label': 'https://untappd.akamaized.net/site/beer_logos/beer-_194851_sm_b66a47d3aaa4895cfaf3dc10179c97.jpeg', 'beer_slug': 'allagash-brewing-company-bourbon-barrel-black', 'beer_name': 'Bourbon Barrel Black', 'is_vintage': 0, 'is_variant': 1}}, {'beer': {'bid': 537767, 'beer_label': 'https://untappd.akamaized.net/site/beer_logos/beer-Black_6539.jpeg', 'beer_slug': 'allagash-brewing-company-black-2004', 'beer_name': 'Black (2004)', 'is_vintage': 1, 'is_variant': 0}}, {'beer': {'bid': 552142, 'beer_label': 'https://untappd.akamaized.net/site/beer_logos/beer-Black_6539.jpeg', 'beer_slug': 'allagash-brewing-company-black-2013', 'beer_name': 'Black (2013)', 'is_vintage': 1, 'is_variant': 0}}, {'beer': {'bid': 561802, 'beer_label': 'https://untappd.akamaized.net/site/beer_logos/beer-Black_6539.jpeg', 'beer_slug': 'allagash-brewing-company-black-2011', 'beer_name': 'Black (2011)', 'is_vintage': 1, 'is_variant': 0}}, {'beer': {'bid': 598091, 'beer_label': 'https://untappd.akamaized.net/site/beer_logos/beer-Black_6539.jpeg', 'beer_slug': 'allagash-brewing-company-black-2012', 'beer_name': 'Black (2012)', 'is_vintage': 1, 'is_variant': 0}}]",3.80472,False
0,6.2,"An amber lager with rich, fragrant malt flavors balanced by crisp, noble hops.",27,https://untappd.akamaized.net/site/beer_logos/beer-6540_f5743_sm.jpeg,https://untappd.akamaized.net/site/beer_logos_hd/beer-6540_176c6_hd.jpeg,Eliot Ness,great-lakes-brewing-company-eliot-ness,Lager - American Amber / Red,6540,3125,https://untappd.akamaized.net/site/brewery_logos/brewery-3125_cc74b.jpeg,Great Lakes Brewing Company,great-lakes-brewing-company,Micro Brewery,http://www.facebook.com/greatlakesbrewingco,GLBC_Cleveland,http://www.greatlakesbrewing.com/,United States,Cleveland,OH,41.4844,-81.7044,"Thu, 14 Oct 2010 14:16:34 +0000",0,1,,,,69487,3.58049,,1391,106571,78687,0,,,,,,5.0,"[{'beer': {'bid': 854810, 'beer_label': 'https://untappd.akamaized.net/site/beer_logos/beer-854810_4b040_sm.jpeg', 'beer_slug': 'great-lakes-brewing-company-eliot-ness-w-wakatu', 'beer_name': 'Eliot Ness W/Wakatu', 'is_vintage': 0, 'is_variant': 1}}, {'beer': {'bid': 1131888, 'beer_label': 'https://untappd.akamaized.net/site/beer_logos/beer-1131888_a8fd5_sm.jpeg', 'beer_slug': 'great-lakes-brewing-company-elliot-ness-apple-cinnamon', 'beer_name': 'Elliot Ness Apple Cinnamon', 'is_vintage': 0, 'is_variant': 1}}, {'beer': {'bid': 1132670, 'beer_label': 'https://untappd.akamaized.net/site/beer_logos/beer-1132670_d7a8f_sm.jpeg', 'beer_slug': 'great-lakes-brewing-company-eliot-ness-w-apple-and-cinnamon', 'beer_name': 'Eliot Ness (w/ Apple & Cinnamon)', 'is_vintage': 0, 'is_variant': 1}}, {'beer': {'bid': 1341703, 'beer_label': 'https://untappd.akamaized.net/site/assets/images/temp/badge-beer-default.png', 'beer_slug': 'great-lakes-brewing-company-eliot-ness-2012', 'beer_name': 'Eliot Ness (2012)', 'is_vintage': 1, 'is_variant': 0}}, {'beer': {'bid': 1418981, 'beer_label': 'https://untappd.akamaized.net/site/assets/images/temp/badge-beer-default.png', 'beer_slug': 'great-lakes-brewing-company-eliot-ness-with-rum-spice', 'beer_name': 'Eliot Ness With Rum Spice', 'is_vintage': 0, 'is_variant': 1}}]",3.58079,False
0,7.5,"Blonde Ale aged in used Chardonnay barrels from local Sonoma County wineries. It is aged for about 9 to 15 months (depending on the age of the barrel) with lots of brettanomyces, lactobacillus, and pediococcus added to each barrel. Medium bodied with hints of oak and Chardonnay, funky brett characteristics, with a nice, long sour finish.",0,https://untappd.akamaized.net/site/beer_logos/beer-russianRiverTemptation.jpg,,Temptation,russian-river-brewing-company-temptation,Sour - American Wild Ale,6541,5143,https://untappd.akamaized.net/site/brewery_logos/brewery-russianRiver.jpg,Russian River Brewing Company,russian-river-brewing-company,Micro Brewery,https://www.facebook.com/russianriverbrewing,,http://www.russianriverbrewing.com/,United States,Santa Rosa,CA,38.4418,-122.712,"Thu, 14 Oct 2010 14:17:46 +0000",0,1,,,,21355,4.24416,,68,30995,24350,0,,,,,,5.0,"[{'beer': {'bid': 209731, 'beer_label': 'https://untappd.akamaized.net/site/beer_logos/beer-_209731_888a29190aafa9070dda959c9e81.jpeg', 'beer_slug': 'russian-river-brewing-company-temptation-batch-005', 'beer_name': 'Temptation (Batch 005)', 'is_vintage': 1, 'is_variant': 0}}, {'beer': {'bid': 213216, 'beer_label': 'https://untappd.akamaized.net/site/beer_logos/beer-_213216_30190da320f677df1db75abf3bab.jpeg', 'beer_slug': 'russian-river-brewing-company-temptation-batch-003', 'beer_name': 'Temptation (Batch 003)', 'is_vintage': 1, 'is_variant': 0}}, {'beer': {'bid': 213707, 'beer_label': 'https://untappd.akamaized.net/site/beer_logos/beer-_213707_be0b06d93b3ec65220d28727551d.jpeg', 'beer_slug': 'russian-river-brewing-company-temptation-batch-004', 'beer_name': 'Temptation (Batch 004)', 'is_vintage': 1, 'is_variant': 0}}, {'beer': {'bid': 230708, 'beer_label': 'https://untappd.akamaized.net/site/beer_logos/beer-_230708_784ff49b4c869c89297f0d020a00.jpeg', 'beer_slug': 'russian-river-brewing-company-temptation-batch-006', 'beer_name': 'Temptation (Batch 006)', 'is_vintage': 1, 'is_variant': 0}}, {'beer': {'bid': 233554, 'beer_label': 'https://untappd.akamaized.net/site/beer_logos/beer-_233554_03f76e69f0443f3668d197841fce.jpeg', 'beer_slug': 'russian-river-brewing-company-temptation-batch-007', 'beer_name': 'Temptation (Batch 007)', 'is_vintage': 1, 'is_variant': 0}}]",4.23578,False
0,9.0,Belgian Style Tripel using same Abbey Yeast. Monster aromas and sweet flavors coming from the yeast and a huge amount of Belgian Candi Sugar.,30,https://untappd.akamaized.net/site/assets/images/temp/badge-beer-default.png,,Menage a Frog,issaquah-brew-house-rogue-ales-menage-a-frog,Belgian Tripel,6542,27906,https://untappd.akamaized.net/site/brewery_logos/brewery-IssaquahBrewery_27906_1ed59.jpeg,Issaquah Brew House (Rogue Ales),issaquah-brew-house-rogue-ales,Micro Brewery,,,,United States,Issaquah,WA,47.53,-122.037,"Thu, 14 Oct 2010 14:52:53 +0000",0,1,,,,1047,3.64924,,0,1297,1218,0,,,,,,0.0,[],3.64945,False
0,4.5,"A dark lager that combines a mild crispness with subtle toasty, chocolate notes to make it the perfect thirst quencher on days when there's a chill in the air. It;s a great accompaniment to hearty winter meals, or dessert by the fireside.",19,https://untappd.akamaized.net/site/beer_logos/beer-CricketsNocturne_6543.jpeg,,Cricket's Nocturne,cricket-hill-brewing-co-cricket-s-nocturne,Schwarzbier,6543,415,https://untappd.akamaized.net/site/brewery_logos/brewery-415_d4c0e.jpeg,Cricket Hill Brewing Co.,cricket-hill-brewing-co,Micro Brewery,http://www.facebook.com/CricketHillNJ,CricketHillNJ,http://www.crickethillbrewery.com/,United States,Fairfield,NJ,40.8726,-74.2964,"Fri, 15 Oct 2010 02:31:24 +0000",0,0,,,,456,3.24013,,0,684,592,0,,,,,,0.0,[],3.40436,False
0,5.0,Brewed with the best quality malts and fermented with a traditional Belgian yeast that imparts a tangy fruit and clove taste. This ale is as at home with bacon and eggs as it is with your backyard barbecue. The Abbey Monks would love this beer!,20,https://untappd.akamaized.net/site/beer_logos/beer-_6544_sm_ef8c0257d6ec85b6d63c1faeda3aa8.jpeg,https://untappd.akamaized.net/site/beer_logos_hd/beer-_6544_hd_531f463b3d2d3babe28ea0b78f87c7.jpeg,Jersey Summer Breakfast Ale,cricket-hill-brewing-co-jersey-summer-breakfast-ale,Blonde Ale - Belgian Blonde / Golden,6544,415,https://untappd.akamaized.net/site/brewery_logos/brewery-415_d4c0e.jpeg,Cricket Hill Brewing Co.,cricket-hill-brewing-co,Micro Brewery,http://www.facebook.com/CricketHillNJ,CricketHillNJ,http://www.crickethillbrewery.com/,United States,Fairfield,NJ,40.8726,-74.2964,"Fri, 15 Oct 2010 02:34:15 +0000",0,1,,,,4559,3.35644,,84,6584,5325,0,,,,,,0.0,[],3.37496,False
0,5.1,"Draft 5.1% ABV - Bottle 5.6% ABV.

Ringwood's most iconic beer was first brewed in late 1979 without a name. A competition in the local press inspired Joe Leedham from Broadstone, Dorset to come up with a suitable suggestion!

Nose:
Peppery, spicy aroma with a hint of apples.
Palate:
Luscious balance of grain and hop in the mouth. Bitter sweet finish with delicate fruit notes.

Comments:
Warm, rounded yet surprisingly delicate pale strong beer.",0,https://untappd.akamaized.net/site/beer_logos/beer-6545_93c7d_sm.jpeg,https://untappd.akamaized.net/site/beer_logos_hd/beer-6545_c2b3d_hd.jpeg,Old Thumper,ringwood-brewery-old-thumper,Extra Special / Strong Bitter,6545,2495,https://untappd.akamaized.net/site/brewery_logos/brewery-2495_6bd5b.jpeg,Ringwood Brewery,ringwood-brewery,Micro Brewery,http://www.facebook.com/ringwoodbrewery,ringwoodbrewery,http://www.ringwoodbrewery.co.uk,England,Ringwood,"Hants, BH24 3AP",50.8411,-1.78713,"Fri, 15 Oct 2010 05:11:04 +0000",0,1,,,,10165,3.4544,,232,13673,11275,0,,,,,,0.0,[],3.46014,False
0,5.0,,22,https://untappd.akamaized.net/site/beer_logos/beer-steamwhistlePilsner.jpg,,Steam Whistle Pilsner,steam-whistle-brewing-steam-whistle-pilsner,Pilsner - Other,7852,1194,https://untappd.akamaized.net/site/brewery_logos/brewery-SteamWhistleBrewing_1194.jpeg,Steam Whistle Brewing,steam-whistle-brewing,Micro Brewery,http://www.facebook.com/SteamWhistle,steamwhistle,http://www.steamwhistle.ca,Canada,Toronto,ON,43.6412,-79.3852,"Sun, 07 Nov 2010 10:40:15 +0000",0,1,7852.0,"Thu, 01 Jan 1970 00:00:00 +0000",6546.0,24755,3.45187,,854,57069,28115,0,,,,,,0.0,[],3.4543,False
0,4.8,,0,https://untappd.akamaized.net/site/beer_logos/beer-Pils_9945.jpeg,,Krombacher Pils,krombacher-gruppe-krombacher-pils,Pilsner - German,9945,1569,https://untappd.akamaized.net/site/brewery_logos/brewery-KrombacherPrivatbrauereiKreuztal_1569.jpeg,Krombacher Gruppe,krombacher-gruppe,Macro Brewery,,,http://www.krombacher-gruppe.de,Germany,Kreuztal,,50.9915,7.95659,"Fri, 19 Nov 2010 05:51:46 +0000",0,1,9945.0,"Thu, 01 Jan 1970 00:00:00 +0000",6547.0,51060,3.29749,,2032,81540,57935,0,,,,,,0.0,[],3.2996,False
0,6.2,"Refreshing, dry light summer ale with base from combo of Pilsner and Rye malts.  Rye contributes a peppery quality that marries well with aromatic lemongrass added to both the hopback and conditioning vessel.  Lemony Simcoe hops used in moderation enhance the citrus profile.",12,https://untappd.akamaized.net/site/assets/images/temp/badge-beer-default.png,,Lemongrass Rye,free-state-brewing-co-lemongrass-rye,Rye Beer,6549,4889,https://untappd.akamaized.net/site/brewery_logos/brewery-4889_1287b.jpeg,Free State Brewing Co.,free-state-brewing-co,Micro Brewery,http://www.facebook.com/freestatebrewing,FreeStateBeer,http://freestatebrewing.com/,United States,Lawrence,KS,38.9719,-95.2357,"Fri, 15 Oct 2010 09:23:18 +0000",0,1,,,,484,3.62965,,0,644,568,0,,,,,,0.0,[],3.63756,False
0,4.7,,0,https://untappd.akamaized.net/site/beer_logos/beer-_234939_sm_433b20e2ef1057592b0a080fbe19cd.jpeg,,Blue Paw Blueberry Wheat Ale,shipyard-brewing-company-blue-paw-blueberry-wheat-ale,Pale Wheat Ale - American,234939,2392,https://untappd.akamaized.net/site/brewery_logos/brewery-ShipyardBrewingCo_2392.jpeg,Shipyard Brewing Company,shipyard-brewing-company,Micro Brewery,http://www.facebook.com/ShipyardBrewing?ref=ts,shipyardbrewing,http://www.shipyard.com/,United States,Portland,ME,43.662,-70.2486,"Mon, 24 Sep 2012 15:58:04 +0000",0,1,234939.0,"Mon, 15 Apr 2013 10:04:26 +0000",6550.0,0,0.0,True,0,0,0,0,,,,,,0.0,[],0.0,False
0,7.5,"Johnny Cask has entered the building! We've retrofitted a 15 barrel tank to perfectly produce a very special cask conditioned ale (so, we have a little time to play around during winters at the Delaware coast). This beer, known as Dogfish Head 75 Minute IPA is a blend of 60 and 90 Minute IPAs with a special whole leaf cascade dry-hopping session.",75,https://untappd.akamaized.net/site/beer_logos/beer-5391_a7988_sm.jpeg,https://untappd.akamaized.net/site/beer_logos_hd/beer-5391_ef024_hd.jpeg,75 Minute IPA,dogfish-head-craft-brewery-75-minute-ipa,IPA - American,5391,459,https://untappd.akamaized.net/site/brewery_logos/brewery-459_b3e4d.jpeg,Dogfish Head Craft Brewery,dogfish-head-craft-brewery,Micro Brewery,http://www.facebook.com/dogfishheadbeer,dogfishbeer,http://www.dogfish.com/,United States,Milton,DE,38.7776,-75.3099,"Sat, 21 Aug 2010 09:26:35 +0000",0,1,5391.0,"Thu, 01 Jan 1970 00:00:00 +0000",6551.0,46804,4.01317,,229,66939,53001,0,,,,,,5.0,"[{'beer': {'bid': 22215, 'beer_label': 'https://untappd.akamaized.net/site/assets/images/temp/badge-beer-default.png', 'beer_slug': 'dogfish-head-craft-brewery-alehouse-75', 'beer_name': 'Alehouse 75', 'is_vintage': 0, 'is_variant': 1}}, {'beer': {'bid': 317123, 'beer_label': 'https://untappd.akamaized.net/site/beer_logos/beer-_317123_9f3f0cf3de72ccb4040c31140365.jpeg', 'beer_slug': 'dogfish-head-craft-brewery-75-minute-ipa-2013', 'beer_name': '75 Minute IPA (2013)', 'is_vintage': 1, 'is_variant': 0}}, {'beer': {'bid': 324296, 'beer_label': 'https://untappd.akamaized.net/site/beer_logos/beer-_324296_92b55bd6a835f32ecf7283fe3dc2.jpeg', 'beer_slug': 'dogfish-head-craft-brewery-75-minute-ipa-2012', 'beer_name': '75 Minute IPA (2012)', 'is_vintage': 1, 'is_variant': 0}}, {'beer': {'bid': 643941, 'beer_label': 'https://untappd.akamaized.net/site/beer_logos/beer-643941_2b28e_sm.jpeg', 'beer_slug': 'dogfish-head-craft-brewery-75-minute-ipa-2014', 'beer_name': '75 Minute IPA (2014)', 'is_vintage': 1, 'is_variant': 0}}, {'beer': {'bid': 1023046, 'beer_label': 'https://untappd.akamaized.net/site/beer_logos/beer-5391_a7988_sm.jpeg', 'beer_slug': 'dogfish-head-craft-brewery-75-minute-ipa-2015', 'beer_name': '75 Minute IPA (2015)', 'is_vintage': 1, 'is_variant': 0}}]",4.01082,False
0,5.2,"Rusty Red is a rich malty Red ale built on a Vienna grain bill. Hints of roast cap off a pleasant bready finish to make this beer one of the most popular tap offerings for O?so. Enjoy! A smooth malty Red Ale with hints of caramel and roast. Inspired by the beers of Vienna with a added twist of American style. ""Rusty Red, this ones for you!""",28,https://untappd.akamaized.net/site/beer_logos/beer-6552_779d2_sm.jpeg,https://untappd.akamaized.net/site/beer_logos_hd/beer-6552_65ac4_hd.jpeg,Rusty Red,o-so-brewing-company-rusty-red,Red Ale - American Amber / Red,6552,2029,https://untappd.akamaized.net/site/brewery_logos/brewery-OsoBrewingCompany_2029.jpeg,O'so Brewing Company,o-so-brewing-company,Micro Brewery,https://www.facebook.com/OsoBrewingCompany,osobrewing,http://www.osobrewing.com,United States,Plover,WI,44.453,-89.5235,"Fri, 15 Oct 2010 09:57:04 +0000",0,1,,,,5580,3.49794,,153,7807,6195,0,,,,,,0.0,[],3.50589,False
0,6.1,,0,https://untappd.akamaized.net/site/assets/images/temp/badge-beer-default.png,,Trident?s Old Spearmint Ale,watch-city-brewing-company-trident-s-old-spearmint-ale,Spiced / Herbed Beer,6554,1496,https://untappd.akamaized.net/site/brewery_logos/brewery-WatchCityBrewingCompany_1496.jpeg,Watch City Brewing Company,watch-city-brewing-company,Micro Brewery,,Hopsexplosion,http://watchcitybrew.com,United States,Waltham,MA,42.3718,-71.2367,"Fri, 15 Oct 2010 10:21:29 +0000",0,0,,,,3,0.0,,0,9,9,0,,,,,,0.0,[],3.54827,False
0,7.5,"This Brewpub Exclusive is a strong DFH interpretation on the classic Munich Lager. It was brewed by our pub manager Jason and Head Brewer Bryan in traditional fashion with German Pils, German Munich, Biscuit, and Special B malts.

The slight departures from rigid stylistic tradition include boosting the ABV just a bit and using American hops (although Warrior and Liberty both have Noble lineage).

The aroma is full of bready, nutty, malt character with just a hint of spicy hops. The blend of Lager yeasts delivers a crisp clean finish and the dry, complex malt profile shines above a smooth subtle bitterness.",24,https://untappd.akamaized.net/site/assets/images/temp/badge-beer-default.png,,Oktoberfest,dogfish-head-craft-brewery-oktoberfest,M?rzen,6555,459,https://untappd.akamaized.net/site/brewery_logos/brewery-459_b3e4d.jpeg,Dogfish Head Craft Brewery,dogfish-head-craft-brewery,Micro Brewery,http://www.facebook.com/dogfishheadbeer,dogfishbeer,http://www.dogfish.com/,United States,Milton,DE,38.7776,-75.3099,"Fri, 15 Oct 2010 10:31:16 +0000",0,1,,,,166,3.74548,,0,229,226,0,,,,,,0.0,[],3.68383,False
0,5.0,,32,https://untappd.akamaized.net/site/beer_logos/beer-HopticalIllusion_7580.jpeg,,Hoptical Illusion,flying-monkeys-craft-brewery-hoptical-illusion,Pale Ale - American,7580,1571,https://untappd.akamaized.net/site/brewery_logos/brewery-1571_b9343.jpeg,Flying Monkeys Craft Brewery,flying-monkeys-craft-brewery,Micro Brewery,http://www.facebook.com/pages/Flying-Monkeys-Craft-Brewery/108949405799023?ref=sgm,FlyingMonkeys,http://theflyingmonkeys.ca,Canada,Barrie,ON,44.3893,-79.6867,"Sat, 06 Nov 2010 10:05:24 +0000",0,1,7580.0,"Tue, 18 Oct 2011 02:59:50 +0000",6556.0,11284,3.58851,,286,17944,12483,0,,,,,,0.0,[],3.59016,False
0,8.7,"You don?t need to be royalty to enjoy Berkshire?s dark-as-night
interpretation of the traditional Russian Imperial Stout. Rich
maltiness produces hints of chocolate, licorice, toee, and ripe,
dark fruit. Its velvety texture bathes your palate in luxury,
begging to be paired with a dessert or to be enjoyed as a
nightcap. Suitable for drinking now, this fine ale also ages
beautifully in a cool, dark place?waiting patiently to transport
you to the time of the Czars.",30,https://untappd.akamaized.net/site/beer_logos/beer-37061_b9859_sm.jpeg,https://untappd.akamaized.net/site/beer_logos_hd/beer-37061_9da41_hd.jpeg,The Russian Imperial Stout,berkshire-brewing-company-b-b-c-the-russian-imperial-stout,Stout - Russian Imperial,37061,1999,https://untappd.akamaized.net/site/brewery_logos/brewery-1999_13081.jpeg,Berkshire Brewing Company (B.B.C.),berkshire-brewing-company-b-b-c,Micro Brewery,https://www.facebook.com/pages/Berkshire-Brewing-Company/283586908949,BerkshireBrewCo,http://www.berkshire-brewing.com,United States,South Deerfield,MA,42.4787,-72.6094,"Sat, 12 Mar 2011 22:03:18 +0000",0,1,37061.0,"Thu, 01 Jan 1970 00:00:00 +0000",6557.0,3268,3.82107,,57,4246,3720,0,,,,,,0.0,[],3.80649,False
0,8.8,,0,https://untappd.akamaized.net/site/assets/images/temp/badge-beer-default.png,,Lion Imperial Premium Malt Pilsner,lion-brewery-ceylon-plc-lion-imperial-premium-malt-pilsner,Pilsner - Imperial / Double,47596,791,https://untappd.akamaized.net/site/brewery_logos/brewery-791_61903.jpeg,Lion Brewery Ceylon,lion-brewery-ceylon,Macro Brewery,https://www.facebook.com/LionBeers,,http://lionbeer.com,Sri Lanka,Biyagama,,6.94393,79.9787,"Sun, 01 May 2011 09:53:34 +0000",0,1,47596.0,"Thu, 01 Jan 1970 00:00:00 +0000",6558.0,1982,3.08161,,23,2509,2308,0,,,,,,0.0,[],3.15774,False
0,10.0,"A stronger version of our Lost and Found Abbey Ale brewed to a more contemplative alcohol content. Massive in every stretch of the brewing way possible this is the sort of beer that will remind a beer drinker who considers themselves a saint that even saints stray as sinners from time to time.
Not for the faint of heart, this beer weighs in at a heavenly 12% ABV and is available in 750 ml bottles and on draft at select locations.
ABV: 12%
Availability: Late Spring Release",0,https://untappd.akamaized.net/site/beer_logos/beer-10Commandments_6559.jpeg,,10 Commandments,the-lost-abbey-10-commandments,Belgian Strong Dark Ale,6559,2712,https://untappd.akamaized.net/site/brewery_logos/brewery-2712_0b00a.jpeg,The Lost Abbey,the-lost-abbey,Micro Brewery,http://www.facebook.com/port.lostabbey,lostabbey,http://www.lostabbey.com/,United States,San Marcos,CA,33.1413,-117.15,"Fri, 15 Oct 2010 11:37:18 +0000",0,1,,,,15118,3.84077,,223,19255,17253,0,,,,,,5.0,"[{'beer': {'bid': 69573, 'beer_label': 'https://untappd.akamaized.net/site/assets/images/temp/badge-beer-default.png', 'beer_slug': 'the-lost-abbey-10-commandments-2008', 'beer_name': '10 Commandments (2008)', 'is_vintage': 1, 'is_variant': 0}}, {'beer': {'bid': 117755, 'beer_label': 'https://untappd.akamaized.net/site/assets/images/temp/badge-beer-default.png', 'beer_slug': 'the-lost-abbey-10-commandments-2009', 'beer_name': '10 Commandments (2009)', 'is_vintage': 1, 'is_variant': 0}}, {'beer': {'bid': 169537, 'beer_label': 'https://untappd.akamaized.net/site/assets/images/temp/badge-beer-default.png', 'beer_slug': 'the-lost-abbey-10-commandments-2010', 'beer_name': '10 Commandments (2010)', 'is_vintage': 1, 'is_variant': 0}}, {'beer': {'bid': 268835, 'beer_label': 'https://untappd.akamaized.net/site/assets/images/temp/badge-beer-default.png', 'beer_slug': 'the-lost-abbey-10-commandments-2007', 'beer_name': '10 Commandments (2007)', 'is_vintage': 1, 'is_variant': 0}}, {'beer': {'bid': 289512, 'beer_label': 'https://untappd.akamaized.net/site/assets/images/temp/badge-beer-default.png', 'beer_slug': 'the-lost-abbey-10-commandments-2011', 'beer_name': '10 Commandments (2011)', 'is_vintage': 1, 'is_variant': 0}}]",3.837,False
0,4.5,,0,https://untappd.akamaized.net/site/beer_logos/beer-BackdraftBrown_6560.jpeg,,Backdraft Brown,hook-ladder-brewing-company-backdraft-brown,Brown Ale - American,6560,669,https://untappd.akamaized.net/site/brewery_logos/brewery-HookLadderBrewingCompany_669.jpeg,Hook & Ladder Brewing Company,hook-ladder-brewing-company,Micro Brewery,,,hookandladderbeer.com,United States,Silver Spring,MD,38.9984,-77.0303,"Fri, 15 Oct 2010 11:49:38 +0000",0,1,,,,316,3.09968,,0,504,444,0,,,,,,0.0,[],3.37011,False
0,5.25,"Red Sky is an Irish style Red Ale, malt dominant and brewed with roasted barley to give it a deep red color. This brew features a robust and roasted malt flavor with subtle notes of sweet caramel.",23,https://untappd.akamaized.net/site/beer_logos/beer-6561_7d582_sm.jpeg,https://untappd.akamaized.net/site/beer_logos_hd/beer-6561_f822f_hd.jpeg,Red Sky Irish Ale,frankenmuth-brewery-red-sky-irish-ale,Red Ale - Irish,6561,9706,https://untappd.akamaized.net/site/brewery_logos/brewery-9706_d03a8.jpeg,Frankenmuth Brewery,frankenmuth-brewery,Micro Brewery,http://www.facebook.com/frankenmuthbrewery,FB1862,http://www.frankenmuthbrewery.com/,United States,Frankenmuth,MI,43.331,-83.7379,"Fri, 15 Oct 2010 12:01:45 +0000",0,1,,,,1805,3.4885,,17,2464,2075,0,,,,,,0.0,[],3.51204,False
