auth_rating,beer_abv,beer_description,beer_ibu,beer_label,beer_label_hd,beer_name,beer_slug,beer_style,bid,brewery.brewery_id,brewery.brewery_label,brewery.brewery_name,brewery.brewery_slug,brewery.brewery_type,brewery.contact.facebook,brewery.contact.twitter,brewery.contact.url,brewery.country_name,brewery.location.brewery_city,brewery.location.brewery_state,brewery.location.lat,brewery.location.lng,created_at,is_homebrew,is_in_production,merge_details.master_bid,merge_details.merge_date,merge_details.requested_bid,rating_count,rating_score,rating_score_below,stats.monthly_count,stats.total_count,stats.total_user_count,stats.user_count,vintage_parent.beer.beer_abv,vintage_parent.beer.beer_name,vintage_parent.beer.beer_slug,vintage_parent.beer.bid,vintage_parent.beer.type_id,vintages.count,vintages.items,weighted_rating_score,wish_list
0,5.4,"Also sold as Cubanero Fuerte.
Bucanero brings the mystery and passion of Cuba in a golden beer, with a vigourous and robust flavour. Our ancient and secret production process combines the finest selection of hops, water and malt.",0,https://untappd.akamaized.net/site/beer_logos/beer-2689_baddc_sm.jpeg,https://untappd.akamaized.net/site/beer_logos_hd/beer-2689_cb52e_hd.jpeg,Bucanero Fuerte / Cubanero Fuerte,cerveceria-bucanero-bucanero-fuerte-cubanero-fuerte,Lager - North American Adjunct,2689,365,https://untappd.akamaized.net/site/brewery_logos/brewery-CerveceriaBucanero_365.jpeg,Cerveceria Bucanero,cerveceria-bucanero,Macro Brewery,https://www.facebook.com/cerveceriabucanero.holguin?fref=ts,,http://www.cerveceriabucanero.com,Cuba,Ciudad de la Habana,,23.0541,-82.3452,"Sat, 21 Aug 2010 09:26:35 +0000",0,1,2689.0,"Thu, 01 Jan 1970 00:00:00 +0000",19363.0,8489,2.92325,,364,10991,9684,0,,,,,,0.0,[],2.94849,False
0,4.5,"Gold Leaf Lager harkens back to the days when refreshing beers were made 100% from malted barley. Gold Leaf Lager is pale gold, light to medium bodied with subtle fresh bready notes, and a clean crisp finish.  Crisp, Clean, Bready.",17,https://untappd.akamaized.net/site/beer_logos/beer-19364_039a4_sm.jpeg,https://untappd.akamaized.net/site/beer_logos_hd/beer-19364_1a3b6_hd.jpeg,Gold Leaf Lager,devils-backbone-brewing-company-gold-leaf-lager,Lager - Helles,19364,4939,https://untappd.akamaized.net/site/brewery_logos/brewery-DevilsBackboneBrewingCompany_4939.jpeg,Devils Backbone Brewing Company,devils-backbone-brewing-company,Micro Brewery,http://www.facebook.com/devilsbackbonebrewingcompany,dbbrewingco,http://www.dbbrewingcompany.com,United States,Roseland,VA,37.8705,-78.9189,"Fri, 31 Dec 2010 04:27:28 +0000",0,1,,,,10999,3.38419,,278,15119,12431,0,,,,,,0.0,[],3.39139,False
0,4.7,,0,https://untappd.akamaized.net/site/assets/images/temp/badge-beer-default.png,,Wintergreen Weiss,devils-backbone-brewing-company-wintergreen-weiss,Hefeweizen,19365,4939,https://untappd.akamaized.net/site/brewery_logos/brewery-DevilsBackboneBrewingCompany_4939.jpeg,Devils Backbone Brewing Company,devils-backbone-brewing-company,Micro Brewery,http://www.facebook.com/devilsbackbonebrewingcompany,dbbrewingco,http://www.dbbrewingcompany.com,United States,Roseland,VA,37.8705,-78.9189,"Fri, 31 Dec 2010 04:31:06 +0000",0,1,,,,420,3.55179,,0,606,546,0,,,,,,0.0,[],3.57793,False
0,0.0,,0,https://untappd.akamaized.net/site/assets/images/temp/badge-beer-default.png,,Bourbon Barrel Brown,gray-s-brewing-company-bourbon-barrel-brown,Brown Ale - American,19366,599,https://untappd.akamaized.net/site/brewery_logos/brewery-GraysBrewingCompany_599.jpeg,Gray's Brewing Company (WI),grays-brewing-company-wi,Micro Brewery,https://www.facebook.com/pages/Gray-Brewing-Co/118782008173686,,http://www.graybrewing.com/,United States,Janesville,WI,42.6795,-89.0506,"Fri, 31 Dec 2010 04:31:38 +0000",0,1,,,,6,0.0,,0,22,8,0,,,,,,0.0,[],3.57805,False
0,5.2,"This Irish Style Ale is a special blend of four types of malted barley and three varieties of hops. It is a medium-bodied ale showing off a deep reddish amber color and thick, tan bubbly head. The aroma is sweet and light followed by moderate caramel-malt flavors with a light roasty finish.",32,https://untappd.akamaized.net/site/beer_logos/beer-27748_971d5_sm.jpeg,https://untappd.akamaized.net/site/beer_logos_hd/beer-27748_fc686_hd.jpeg,Busted Knuckle Irish Ale,gray-s-brewing-company-wi-busted-knuckle-irish-ale,Red Ale - Irish,27748,599,https://untappd.akamaized.net/site/brewery_logos/brewery-GraysBrewingCompany_599.jpeg,Gray's Brewing Company (WI),grays-brewing-company-wi,Micro Brewery,https://www.facebook.com/pages/Gray-Brewing-Co/118782008173686,,http://www.graybrewing.com/,United States,Janesville,WI,42.6795,-89.0506,"Mon, 31 Jan 2011 01:32:34 +0000",0,1,27748.0,"Wed, 14 Mar 2012 05:43:05 +0000",19367.0,4075,3.34748,,72,5445,4567,0,,,,,,0.0,[],3.36861,False
0,6.5,"In 2006 CBSA introduced Bucanero Max, a unique premium beer that delicately balances power and finesse. At 6.5% alc./vol. Bucanero Max delivers additional strength without sacrificing the robust and vigorous flavour of Bucanero that Cubans know and love. Our secret brewing process combines the finest selection of hops, water and malted barley. ",0,https://untappd.akamaized.net/site/beer_logos/beer-_19368_sm_c7721c7b825411f56be048c1801461.jpeg,,Cerveza Bucanero Max,cerveceria-bucanero-cerveza-bucanero-max,Lager - Pale,19368,365,https://untappd.akamaized.net/site/brewery_logos/brewery-CerveceriaBucanero_365.jpeg,Cerveceria Bucanero,cerveceria-bucanero,Macro Brewery,https://www.facebook.com/cerveceriabucanero.holguin?fref=ts,,http://www.cerveceriabucanero.com,Cuba,Ciudad de la Habana,,23.0541,-82.3452,"Fri, 31 Dec 2010 04:33:09 +0000",0,1,,,,53,3.00943,,5,92,87,0,,,,,,0.0,[],3.55618,False
0,5.0,"A sweet, very light, golden ale made with fresh Maine blueberries to produce a big, blueberry aroma.",35,https://untappd.akamaized.net/site/beer_logos/beer-_22526_19f5d2e51d99df3ece267fbbf47d.jpeg,,Blue,beer-works-boston-salem-hingham-lowell-framingham-blue,Fruit Beer,22526,158,https://untappd.akamaized.net/site/brewery_logos/brewery-BeerWorks_158.jpeg,"Beer Works (Boston, Salem, Hingham, Lowell, Framingham)",beer-works-boston-salem-hingham-lowell-framingham,Micro Brewery,,beer_works,http://www.beerworks.net,United States,Boston,MA,42.347,-71.0988,"Sat, 08 Jan 2011 01:50:31 +0000",0,1,22526.0,"Thu, 01 Jan 1970 00:00:00 +0000",19369.0,5207,3.67337,,124,7200,5999,0,,,,,,0.0,[],3.67213,False
0,8.0,"A Baltic-style porter that blends a strong English porter with a Germanic lager approach, fairly robust ? this strong black lager has notes of chocolate and coffee with hints of caramelized sugar.  Black, Roast, Chocolate.

Our Trail Blazers stray from the beaten path into a world of robust and daring beers featuring bigger, bolder flavors for fueling your spirit of adventure.

Imagine yourself stepping out of the pilot house onto the pitching deck of a merchant ship plunging through the frigid Baltic Sea night. Squinting against the grey black horizon you spy in the distance the odd sparkle and glimmer; the far away lights of the Baltic port of Danzig are bidding you welcome. Tonight you will feast on dark rye bread and smoked pork sausage, all washed down by the famous strong black lager of the region, the Baltic-style Porter.",28,https://untappd.akamaized.net/site/beer_logos/beer-19370_2a680_sm.jpeg,https://untappd.akamaized.net/site/beer_logos_hd/beer-19370_fab3b_hd.jpeg,Danzig Baltic-Style Porter,devils-backbone-brewing-company-danzig-baltic-style-porter,Porter - Baltic,19370,4939,https://untappd.akamaized.net/site/brewery_logos/brewery-DevilsBackboneBrewingCompany_4939.jpeg,Devils Backbone Brewing Company,devils-backbone-brewing-company,Micro Brewery,http://www.facebook.com/devilsbackbonebrewingcompany,dbbrewingco,http://www.dbbrewingcompany.com,United States,Roseland,VA,37.8705,-78.9189,"Fri, 31 Dec 2010 04:34:37 +0000",0,1,,,,6505,3.86218,,258,8568,7216,0,,,,,,2.0,"[{'beer': {'bid': 335084, 'beer_label': 'https://untappd.akamaized.net/site/assets/images/temp/badge-beer-default.png', 'beer_slug': 'devils-backbone-brewing-company-cocoa-danzig-baltic-porter', 'beer_name': 'Cocoa Danzig Baltic Porter', 'is_vintage': 0, 'is_variant': 1}}, {'beer': {'bid': 713787, 'beer_label': 'https://untappd.akamaized.net/site/assets/images/temp/badge-beer-default.png', 'beer_slug': 'devils-backbone-brewing-company-woodaged-danzig', 'beer_name': 'Woodaged Danzig', 'is_vintage': 0, 'is_variant': 1}}]",3.85272,False
0,7.5,"Meet Abby, Azrael?s darker twin. This Belgian beauty is mysteriously alluring with a sultry flavor combination of brown sugar, plum and spices in a dark burgundy hue. Abby has a deep, rich flavor, and a serious strength but like her sister, hides behind a deceptively light fruity finish. On the surface she?s the sweetest girl you?ll ever meet, but one taste you?ll be trapped in her darkly alluring web.",18,https://untappd.akamaized.net/site/beer_logos/beer-303060_c681b_sm.jpeg,https://untappd.akamaized.net/site/beer_logos_hd/beer-303060_d9b13_hd.jpeg,Dark Abby,devils-backbone-brewing-company-dark-abby,Belgian Dubbel,303060,4939,https://untappd.akamaized.net/site/brewery_logos/brewery-DevilsBackboneBrewingCompany_4939.jpeg,Devils Backbone Brewing Company,devils-backbone-brewing-company,Micro Brewery,http://www.facebook.com/devilsbackbonebrewingcompany,dbbrewingco,http://www.dbbrewingcompany.com,United States,Roseland,VA,37.8705,-78.9189,"Thu, 31 Jan 2013 19:33:03 +0000",0,0,303060.0,"Fri, 08 Mar 2013 09:35:40 +0000",19371.0,5966,3.57052,,4,8569,6605,0,,,,,,0.0,[],3.57445,False
0,4.5,"Gold Medal winner SIBA Award, Classic traditional stout. Complex taste with a rich and full body. Crisp with a full bouquet of spices, fruit and floral aromas. Black is a stout for the true connoisseur.",0,https://untappd.akamaized.net/site/beer_logos/beer-166935_68cbe_sm.jpeg,https://untappd.akamaized.net/site/beer_logos_hd/beer-166935_801a7_hd.jpeg,Lancaster Black,lancaster-brewery-lancaster-black,Stout - Other,166935,3730,https://untappd.akamaized.net/site/brewery_logos/brewery-LancasterBrewery_3730.jpeg,Lancaster Brewery,lancaster-brewery,Micro Brewery,,lancasterale,http://www.lancasterbrewery.co.uk,England,Lancaster,,54.0424,-2.7815,"Tue, 01 May 2012 18:46:48 +0000",0,1,166935.0,"Wed, 11 Jul 2012 20:08:05 +0000",19372.0,1552,3.5298,,67,2066,1743,0,,,,,,0.0,[],3.54969,False
0,0.0,,0,https://untappd.akamaized.net/site/assets/images/temp/badge-beer-default.png,,Bourbon Barrel Scotch Ale,old-boys-brewhouse-bourbon-barrel-scotch-ale,Scottish Ale,19373,5292,https://untappd.akamaized.net/site/brewery_logos/brewery-OldBoysBrewhouse_5292.jpeg,Old Boys' Brewhouse,old-boys-brewhouse,Micro Brewery,http://www.facebook.com/oldboysbrewhouse,oldboysbrew,http://oldboysbrewhouse.com/,United States,Spring Lake,MI,43.077,-86.2122,"Fri, 31 Dec 2010 04:39:47 +0000",0,1,,,,13,3.90385,,0,16,16,0,,,,,,0.0,[],3.63459,False
0,4.8,,0,https://untappd.akamaized.net/site/assets/images/temp/badge-beer-default.png,,Hoppy Wheat Pils,devils-backbone-brewing-company-hoppy-wheat-pils,Pilsner - Other,19374,4939,https://untappd.akamaized.net/site/brewery_logos/brewery-DevilsBackboneBrewingCompany_4939.jpeg,Devils Backbone Brewing Company,devils-backbone-brewing-company,Micro Brewery,http://www.facebook.com/devilsbackbonebrewingcompany,dbbrewingco,http://www.dbbrewingcompany.com,United States,Roseland,VA,37.8705,-78.9189,"Fri, 31 Dec 2010 04:41:33 +0000",0,1,,,,19,3.55263,,0,25,25,0,,,,,,0.0,[],3.6301,False
0,0.0,,0,https://untappd.akamaized.net/site/assets/images/temp/badge-beer-default.png,,Toffee Stout,old-boys-brewhouse-toffee-stout,Stout - Other,19375,5292,https://untappd.akamaized.net/site/brewery_logos/brewery-OldBoysBrewhouse_5292.jpeg,Old Boys' Brewhouse,old-boys-brewhouse,Micro Brewery,http://www.facebook.com/oldboysbrewhouse,oldboysbrew,http://oldboysbrewhouse.com/,United States,Spring Lake,MI,43.077,-86.2122,"Fri, 31 Dec 2010 04:42:40 +0000",0,1,,,,2,0.0,,0,5,5,0,,,,,,0.0,[],3.57065,False
0,8.0,"The Kilt Flasher is a hearty Scottish ale with a rich, warming complexity perfect for the onset of winter. Brown with ruby highlights, it?s an ale packed with toffee and toasted malt flavors. Much like the early Scottish settlers of the Virginia Highlands, it has a robustness that stands up to anything. Enjoy a pint today and expose yourself to great beer.  Brown, Robust, Toffee.",20,https://untappd.akamaized.net/site/beer_logos/beer-19376_24a7e_sm.jpeg,https://untappd.akamaized.net/site/beer_logos_hd/beer-19376_2b7a2_hd.jpeg,Kilt Flasher,devils-backbone-brewing-company-kilt-flasher,Scotch Ale / Wee Heavy,19376,4939,https://untappd.akamaized.net/site/brewery_logos/brewery-DevilsBackboneBrewingCompany_4939.jpeg,Devils Backbone Brewing Company,devils-backbone-brewing-company,Micro Brewery,http://www.facebook.com/devilsbackbonebrewingcompany,dbbrewingco,http://www.dbbrewingcompany.com,United States,Roseland,VA,37.8705,-78.9189,"Fri, 31 Dec 2010 04:44:44 +0000",0,1,,,,11161,3.70648,,145,15748,12376,0,,,,,,4.0,"[{'beer': {'bid': 1042418, 'beer_label': 'https://untappd.akamaized.net/site/beer_logos/beer-19376_24a7e_sm.jpeg', 'beer_slug': 'devils-backbone-brewing-company-kilt-flasher-2013', 'beer_name': 'Kilt Flasher (2013)', 'is_vintage': 1, 'is_variant': 0}}, {'beer': {'bid': 1343482, 'beer_label': 'https://untappd.akamaized.net/site/beer_logos/beer-19376_24a7e_sm.jpeg', 'beer_slug': 'devils-backbone-brewing-company-kilt-flasher-2015', 'beer_name': 'Kilt Flasher (2015)', 'is_vintage': 1, 'is_variant': 0}}, {'beer': {'bid': 1680836, 'beer_label': 'https://untappd.akamaized.net/site/beer_logos/beer-19376_24a7e_sm.jpeg', 'beer_slug': 'devils-backbone-brewing-company-kilt-flasher-2012', 'beer_name': 'Kilt Flasher (2012)', 'is_vintage': 1, 'is_variant': 0}}, {'beer': {'bid': 1796983, 'beer_label': 'https://untappd.akamaized.net/site/beer_logos/beer-19376_24a7e_sm.jpeg', 'beer_slug': 'devils-backbone-brewing-company-kilt-flasher-2016', 'beer_name': 'Kilt Flasher (2016)', 'is_vintage': 1, 'is_variant': 0}}]",3.705,False
0,5.5,"Named after Kelley Square right here in Worcester. This infamous traffic jam is named after WW1 veteran and local hero Cornelius Kelley. The Kolsch style is one of the lesser known German Ales. Made with 100% authentic ingredients including Kolsch yeast from our friends at Gardner Ale House. Light golden in color with light malt aroma, background fruitiness and hints of sulfur. Soft malt flavor is complimented by light fruitiness that is washed away with noble hop bitterness and a slightly dry finish. Very comparable to Pilsner or other European Lagers in most aspects.",24,https://untappd.akamaized.net/site/beer_logos/beer-_112542_sm_012838d365552c3e5e26dfe04dc3d9.jpeg,,Kelley Square K?lsch,wormtown-brewery-kelley-square-kolsch,K?lsch,112542,2302,https://untappd.akamaized.net/site/brewery_logos/brewery-2302_17efc.jpeg,Wormtown Brewery,wormtown-brewery,Micro Brewery,https://www.facebook.com/wormtownbrewery,WormtownBrewery,http://wormtownbrewery.com,United States,Worcester,MA,42.2635,-71.7914,"Sat, 24 Dec 2011 13:07:57 +0000",0,1,112542.0,"Thu, 12 Jan 2012 15:38:10 +0000",19377.0,6,0.0,,0,12,9,0,,,,,,0.0,[],3.50239,False
0,7.3,"You?ll have heard that looks can be deceiving. Well, McEwan?s Champion Ale is Exhibit A in proving that statement true. 

First impressions are of a sweet and fruity beer. But this delicate taste belies its power. As you fully get to know its intense flavours you?ll realise this is a very strong, dark and traditional ale. 

William McEwan would have been proud of it.",0,https://untappd.akamaized.net/site/beer_logos/beer-19378_ce5c0_sm.jpeg,https://untappd.akamaized.net/site/beer_logos_hd/beer-19378_32b75_hd.jpeg,McEwan's Champion,charles-wells-brewery-mcewan-s-champion,Scotch Ale / Wee Heavy,19378,1348,https://untappd.akamaized.net/site/brewery_logos/brewery-1348_d2dfe.jpeg,Charles Wells Brewery,charles-wells-brewery,Micro Brewery,https://www.facebook.com/WellsBrewery,WellsBrewery,http://www.charleswells.co.uk,England,Bedford,Bedfordshire,52.1328,-0.48235,"Fri, 31 Dec 2010 04:56:22 +0000",0,1,,,,4563,3.45874,,173,6681,4968,0,,,,,,0.0,[],3.47078,False
0,8.4,,109,https://untappd.akamaized.net/site/assets/images/temp/badge-beer-default.png,,Kennel King Imperial IPA,old-boys-brewhouse-kennel-king-imperial-ipa,IPA - Imperial / Double,73424,5292,https://untappd.akamaized.net/site/brewery_logos/brewery-OldBoysBrewhouse_5292.jpeg,Old Boys' Brewhouse,old-boys-brewhouse,Micro Brewery,http://www.facebook.com/oldboysbrewhouse,oldboysbrew,http://oldboysbrewhouse.com/,United States,Spring Lake,MI,43.077,-86.2122,"Sat, 20 Aug 2011 17:52:03 +0000",0,1,73424.0,"Tue, 19 Nov 2013 02:58:16 +0000",19379.0,554,3.75361,,1,758,626,0,,,,,,0.0,[],3.71714,False
0,5.1,"Dark lager with a fine yeast culture is an unpasteurized beer brewed from four types of malt, with a distinctive full taste and a fine bitterness. Its special flavour makes it unique on the Czech beer market. From Bernard?s family brewery portfolio this unfiltered beer is the most recognized in Czech and foreign degustation competitions.",24,https://untappd.akamaized.net/site/beer_logos/beer-11677_9c436_sm.jpeg,https://untappd.akamaized.net/site/beer_logos_hd/beer-11677_be694_hd.jpeg,Bernard ?ern? le??k (Dark Lager),bernard-family-brewery-rodinny-pivovar-bernard-a-s-bernard-cerny-lezak-dark-lager,Schwarzbier,11677,3831,https://untappd.akamaized.net/site/brewery_logos/brewery-3831_b3675.jpeg,Bernard Family Brewery/ Rodinn? pivovar Bernard a.s.,bernard-family-brewery-rodinny-pivovar-bernard-as,Micro Brewery,http://www.facebook.com/Bernard.cz,,http://www.bernard.cz,Czech Republic,Humpolec,,49.54,15.3598,"Sun, 28 Nov 2010 07:59:28 +0000",0,1,11677.0,"Thu, 01 Jan 1970 00:00:00 +0000",19380.0,8476,3.47142,,284,10965,9371,0,,,,,,0.0,[],3.47765,False
0,5.2,"A pale amber lager with a thick head, characterized with a well-balanced full taste and excellent relish. Ideal for special occasions and parties.

Sv?tl? le??k jantarov? barvy s hustou p?nou, vyv??enou plnou chut? a dobr?m ??zem. Ide?ln? pro speci?ln? p??le?itost i posezen? s p??teli.",0,https://untappd.akamaized.net/site/beer_logos/beer-225201_d5205_sm.jpeg,https://untappd.akamaized.net/site/beer_logos_hd/beer-225201_000d9_hd.jpeg,Holba Premium,holba-holba-premium,Pilsner - Czech,19381,5298,https://untappd.akamaized.net/site/brewery_logos/brewery-5298_07c21.jpeg,Holba,holba,Micro Brewery,https://www.facebook.com/PivovarHolba/,,http://www.holba.cz/,Czech Republic,Hanu?ovice,,50.0699,16.9277,"Fri, 31 Dec 2010 05:03:26 +0000",0,1,,,,3306,3.01611,,105,4418,3635,0,,,,,,0.0,[],3.06972,False
0,4.4,,0,https://untappd.akamaized.net/site/assets/images/temp/badge-beer-default.png,,Pub Ale,devils-backbone-brewing-company-pub-ale,Pale Ale - English,19382,4939,https://untappd.akamaized.net/site/brewery_logos/brewery-DevilsBackboneBrewingCompany_4939.jpeg,Devils Backbone Brewing Company,devils-backbone-brewing-company,Micro Brewery,http://www.facebook.com/devilsbackbonebrewingcompany,dbbrewingco,http://www.dbbrewingcompany.com,United States,Roseland,VA,37.8705,-78.9189,"Fri, 31 Dec 2010 05:04:54 +0000",0,1,,,,84,3.30655,,0,98,97,0,,,,,,0.0,[],3.54332,False
0,3.4,"A kettle-soured cherry beer with a brown color and light body, this beer was fermented with sweet and tart cherries and then infused with toasted oak to create a complex, flavorful elixir.",17,https://untappd.akamaized.net/site/assets/images/temp/badge-beer-default.png,,Low Hanging Fruit,devils-backbone-brewing-company-low-hanging-fruit,Saison / Farmhouse Ale,19383,4939,https://untappd.akamaized.net/site/brewery_logos/brewery-DevilsBackboneBrewingCompany_4939.jpeg,Devils Backbone Brewing Company,devils-backbone-brewing-company,Micro Brewery,http://www.facebook.com/devilsbackbonebrewingcompany,dbbrewingco,http://www.dbbrewingcompany.com,United States,Roseland,VA,37.8705,-78.9189,"Fri, 31 Dec 2010 05:08:56 +0000",0,1,,,,299,3.64381,,0,388,356,0,,,,,,0.0,[],3.64698,False
0,11.0,"We throw 75 pounds of tart Door County Cherries into each oak barrel with a rich Imperial Stout then age it for six months to create this savoy delight. Cheers! 
**2006 Great American Beer Festival Gold Medal Winner **
",48,https://untappd.akamaized.net/site/beer_logos/beer-19384_2bc84_sm.jpeg,https://untappd.akamaized.net/site/beer_logos_hd/beer-19384_eaa1d_hd.jpeg,Brewer's Reserve Bourbon Barrel Cherry Stout,central-waters-brewing-company-brewer-s-reserve-bourbon-barrel-cherry-stout,Stout - American Imperial / Double,19384,358,https://untappd.akamaized.net/site/brewery_logos/brewery-358_e71fc.jpeg,Central Waters Brewing Company,central-waters-brewing-company,Micro Brewery,https://www.facebook.com/CWBrewing,cwbrewing,http://www.centralwaters.com/,United States,Amherst,WI,44.4419,-89.2797,"Fri, 31 Dec 2010 05:11:10 +0000",0,1,,,,4770,3.94916,,73,8680,6531,0,,,,,,5.0,"[{'beer': {'bid': 154358, 'beer_label': 'https://untappd.akamaized.net/site/beer_logos/beer-154358_bd2d2_sm.jpeg', 'beer_slug': 'central-waters-brewing-company-brewer-s-reserve-bourbon-barrel-cherry-stout-2012', 'beer_name': ""Brewer's Reserve Bourbon Barrel Cherry Stout (2012)"", 'is_vintage': 1, 'is_variant': 0}}, {'beer': {'bid': 282544, 'beer_label': 'https://untappd.akamaized.net/site/beer_logos/beer-282544_fcbdf_sm.jpeg', 'beer_slug': 'central-waters-brewing-company-brewer-s-reserve-bourbon-barrel-cherry-stout-2011', 'beer_name': ""Brewer's Reserve Bourbon Barrel Cherry Stout (2011)"", 'is_vintage': 1, 'is_variant': 0}}, {'beer': {'bid': 288733, 'beer_label': 'https://untappd.akamaized.net/site/beer_logos/beer-288733_6eeb9_sm.jpeg', 'beer_slug': 'central-waters-brewing-company-brewer-s-reserve-bourbon-barrel-cherry-stout-2010', 'beer_name': ""Brewer's Reserve Bourbon Barrel Cherry Stout (2010)"", 'is_vintage': 1, 'is_variant': 0}}, {'beer': {'bid': 304891, 'beer_label': 'https://untappd.akamaized.net/site/beer_logos/beer-304891_9594f_sm.jpeg', 'beer_slug': 'central-waters-brewing-company-brewer-s-reserve-bourbon-barrel-cherry-stout-2013', 'beer_name': ""Brewer's Reserve Bourbon Barrel Cherry Stout (2013)"", 'is_vintage': 1, 'is_variant': 0}}, {'beer': {'bid': 311839, 'beer_label': 'https://untappd.akamaized.net/site/beer_logos/beer-311839_21007_sm.jpeg', 'beer_slug': 'central-waters-brewing-company-brewer-s-reserve-bourbon-barrel-cherry-stout-2006', 'beer_name': ""Brewer's Reserve Bourbon Barrel Cherry Stout (2006)"", 'is_vintage': 1, 'is_variant': 0}}]",3.93124,False
0,5.3,"This smooth dark brown ale has a slightly sweet malt character that is delicately balanced by the addition of holiday spices. OG: 12.2, BUs: 25",0,https://untappd.akamaized.net/site/assets/images/temp/badge-beer-default.png,,Holiday Spice Ale,john-harvard-s-brew-house-holiday-spice-ale,Winter Ale,108192,16871,https://untappd.akamaized.net/site/brewery_logos/brewery-johnharvardsbrewhouse_16871.jpeg,John Harvard's Brew House,john-harvard-s-brew-house,Brew Pub,http://www.facebook.com/pages/John-Harvards-Brew-House-Cambridge/107215242668910,JHBrewer_Riley,http://www.johnharvards.com,United States,Cambridge,MA,42.3724,-71.1193,"Sun, 11 Dec 2011 17:30:15 +0000",0,1,108192.0,"Mon, 09 Jan 2012 08:51:07 +0000",19385.0,42,3.77381,,0,53,49,0,,,,,,0.0,[],3.63445,False
0,8.5,,0,https://untappd.akamaized.net/site/beer_logos/beer-WinterAle_19386.jpeg,,Winter Ale,nogne-o-winter-ale,Winter Ale,19386,923,https://untappd.akamaized.net/site/brewery_logos/brewery-923_1cde4.jpeg,N?gne ?,nogne-o,Micro Brewery,http://www.facebook.com/nogneo,nogneo,http://www.nogne-o.com/,Norway,Grimstad,,58.406,8.63723,"Fri, 31 Dec 2010 05:20:50 +0000",0,1,,,,2175,3.7292,,12,2790,2583,0,,,,,,0.0,[],3.71957,False
0,0.0,,0,https://untappd.akamaized.net/site/assets/images/temp/badge-beer-default.png,,One Hop Imperial Brown,square-one-brewery-one-hop-imperial-brown,Brown Ale - Imperial / Double,19387,3509,https://untappd.akamaized.net/site/brewery_logos/brewery-SquareOneBrewery_3509.jpeg,Square One Brewery,square-one-brewery,Micro Brewery,,,http://www.squareonebrewery.com,United States,St. Louis,MO,38.6169,-90.2111,"Fri, 31 Dec 2010 05:22:21 +0000",0,1,,,,0,0.0,,0,6,5,0,,,,,,0.0,[],3.63046,False
0,5.0,,0,https://untappd.akamaized.net/site/beer_logos/beer-_19388_sm_8e7ea2f48606bf28d809029bd429b0.jpeg,,Golden Horseshoe,great-lakes-brewery-golden-horseshoe,Lager - Pale,19388,9841,https://untappd.akamaized.net/site/brewery_logos/brewery-greatlakesbrewery_9841.jpeg,Great Lakes Brewery ,great-lakes-brewery,Micro Brewery,https://www.facebook.com/GreatLakesBeer?fref=ts,greatlakesbeer,http://www.greatlakesbeer.com/,Canada,Etobicoke,ON,43.6225,-79.505,"Fri, 31 Dec 2010 05:25:03 +0000",0,1,,,,687,3.2187,,11,1012,811,0,,,,,,0.0,[],3.35159,False
0,5.8,,0,https://untappd.akamaized.net/site/assets/images/temp/badge-beer-default.png,,Fat Bottom IPA,odd-side-ales-fat-bottom-ipa,IPA - American,19389,5300,https://untappd.akamaized.net/site/brewery_logos/brewery-oddsideales_5300.jpeg,Odd Side Ales,odd-side-ales,Micro Brewery,http://www.facebook.com/pages/Odd-Side-Ales/168663362478,,http://oddsideales.com/,United States,Grand Haven,MI,43.065,-86.2327,"Fri, 31 Dec 2010 05:25:12 +0000",0,1,,,,314,3.47691,,1,439,379,0,,,,,,0.0,[],3.56264,False
0,4.0,,0,https://untappd.akamaized.net/site/assets/images/temp/badge-beer-default.png,,Herby Pepperhop,odd-side-ales-herby-pepperhop,Spiced / Herbed Beer,19390,5300,https://untappd.akamaized.net/site/brewery_logos/brewery-oddsideales_5300.jpeg,Odd Side Ales,odd-side-ales,Micro Brewery,http://www.facebook.com/pages/Odd-Side-Ales/168663362478,,http://oddsideales.com/,United States,Grand Haven,MI,43.065,-86.2327,"Fri, 31 Dec 2010 05:27:15 +0000",0,1,,,,73,3.30667,,0,142,99,0,,,,,,0.0,[],3.52485,False
