auth_rating,beer_abv,beer_description,beer_ibu,beer_label,beer_label_hd,beer_name,beer_slug,beer_style,bid,brewery.brewery_id,brewery.brewery_label,brewery.brewery_name,brewery.brewery_slug,brewery.brewery_type,brewery.contact.facebook,brewery.contact.twitter,brewery.contact.url,brewery.country_name,brewery.location.brewery_city,brewery.location.brewery_state,brewery.location.lat,brewery.location.lng,created_at,is_homebrew,is_in_production,merge_details.master_bid,merge_details.merge_date,merge_details.requested_bid,rating_count,rating_score,rating_score_below,stats.monthly_count,stats.total_count,stats.total_user_count,stats.user_count,vintage_parent.beer.beer_abv,vintage_parent.beer.beer_name,vintage_parent.beer.beer_slug,vintage_parent.beer.bid,vintage_parent.beer.type_id,vintages.count,vintages.items,weighted_rating_score,wish_list
0,7.5,"Jim (1954-1998) is the name by which our Uncle was best known. Hill Farmstead Brewery rests upon the land that was once home to him and his four siblings. In his honor, we barrel aged our Black IPA (James) in a French Oak Pinot Noir barrel for four months and dry hopped the beer with Simcoe. Naturally carbonated and hand bottled, this is one of only 300 bottles.",0,https://untappd.akamaized.net/site/beer_logos/beer-19391_63ea4_sm.jpeg,https://untappd.akamaized.net/site/beer_logos_hd/beer-19391_9a066_hd.jpeg,Jim,hill-farmstead-brewery-jim,IPA - Black / Cascadian Dark Ale,19391,2562,https://untappd.akamaized.net/site/brewery_logos/brewery-2562_3179d.jpeg,Hill Farmstead Brewery,hill-farmstead-brewery,Micro Brewery,http://www.facebook.com/hillfarmstead,HillFarmstead,http://www.hillfarmstead.com,United States,Greensboro,VT,44.6067,-72.2634,"Fri, 31 Dec 2010 05:28:08 +0000",0,1,,,,75,3.98,,4,156,139,0,,,,,,0.0,[],3.71564,False
0,0.0,,0,https://untappd.akamaized.net/site/assets/images/temp/badge-beer-default.png,,Candy Cane Red,odd-side-ales-candy-cane-red,Spiced / Herbed Beer,19392,5300,https://untappd.akamaized.net/site/brewery_logos/brewery-oddsideales_5300.jpeg,Odd Side Ales,odd-side-ales,Micro Brewery,http://www.facebook.com/pages/Odd-Side-Ales/168663362478,,http://oddsideales.com/,United States,Grand Haven,MI,43.065,-86.2327,"Fri, 31 Dec 2010 05:34:57 +0000",0,1,,,,0,0.0,,0,1,1,0,,,,,,0.0,[],3.59537,False
0,4.4,"Deep copper hue with a rich, caramel aroma and subtle hop perfume. Assertively bitter finish balancing the residual malt-sweetness.",30,https://untappd.akamaized.net/site/beer_logos/beer-19393_d3479_sm.jpeg,https://untappd.akamaized.net/site/beer_logos_hd/beer-19393_6cd48_hd.jpeg,Freetail Ale,freetail-brewing-co-freetail-ale,Red Ale - American Amber / Red,19393,3020,https://untappd.akamaized.net/site/brewery_logos/brewery-3020_ea1ed.jpeg,Freetail Brewing Co.,freetail-brewing-co,Micro Brewery,http://www.facebook.com/pages/Freetail-Brewing-Co/57028762312?ref=nf,freetailbrewing,http://www.freetailbrewing.com,United States,San Antonio,TX,29.6016,-98.5613,"Fri, 31 Dec 2010 05:39:03 +0000",0,1,,,,1939,3.49368,,11,2597,2228,0,,,,,,0.0,[],3.51505,False
0,6.0,"American version of an India Pale Ale. Hopped extensively with Pacific Northwest Cascade, Citra and Australian summer hops. ",51,https://untappd.akamaized.net/site/assets/images/temp/badge-beer-default.png,,Padre Pale Ale,padre-island-brewing-company-padre-pale-ale,IPA - American,19394,5301,https://untappd.akamaized.net/site/brewery_logos/brewery-PadreIslandBrewingCompany_5301.jpeg,Padre Island Brewing Company,padre-island-brewing-company,Micro Brewery,,,http://www.pibrewingcompany.com/Padre_Island_Brewing_Company_Home.html,United States,South Padre Island,TX,26.1094,-97.1686,"Fri, 31 Dec 2010 05:40:34 +0000",0,1,,,,800,3.29344,,16,1014,889,0,,,,,,0.0,[],3.3921,False
0,5.6,"Lightly hopped, smooth golden-straw colored. The closet we brew to your favorite domestic (not that we are aiming low!).",22,https://untappd.akamaized.net/site/assets/images/temp/badge-beer-default.png,,South Padre Island Blonde,padre-island-brewing-company-south-padre-island-blonde,Blonde Ale,118549,5301,https://untappd.akamaized.net/site/brewery_logos/brewery-PadreIslandBrewingCompany_5301.jpeg,Padre Island Brewing Company,padre-island-brewing-company,Micro Brewery,,,http://www.pibrewingcompany.com/Padre_Island_Brewing_Company_Home.html,United States,South Padre Island,TX,26.1094,-97.1686,"Tue, 10 Jan 2012 19:06:45 +0000",0,1,118549.0,"Sun, 24 Jun 2012 11:24:11 +0000",19395.0,657,3.17922,,13,827,739,0,,,,,,0.0,[],3.32877,False
0,0.0,,0,https://untappd.akamaized.net/site/assets/images/temp/badge-beer-default.png,,The Rabid Jackalope,odd-side-ales-the-rabid-jackalope,Red Ale - American Amber / Red,19396,5300,https://untappd.akamaized.net/site/brewery_logos/brewery-oddsideales_5300.jpeg,Odd Side Ales,odd-side-ales,Micro Brewery,http://www.facebook.com/pages/Odd-Side-Ales/168663362478,,http://oddsideales.com/,United States,Grand Haven,MI,43.065,-86.2327,"Fri, 31 Dec 2010 05:45:33 +0000",0,1,,,,12,3.625,,0,20,17,0,,,,,,0.0,[],3.59686,False
0,6.8,,0,https://untappd.akamaized.net/site/assets/images/temp/badge-beer-default.png,,Drie Caprice,iron-hill-brewery-restaurant-drie-caprice,Belgian Strong Golden Ale,122355,2585,https://untappd.akamaized.net/site/brewery_logos/brewery-IronHillBreweryRestaurant_2585.jpeg,Iron Hill Brewery & Restaurant,iron-hill-brewery-restaurant,Brew Pub,https://www.facebook.com/IronHillBrewery/,ironhillbrewery,http://www.ironhillbrewery.com/,United States,Wilmington,DE,39.753,-75.5776,"Sat, 21 Jan 2012 10:40:51 +0000",0,1,122355.0,"Wed, 15 Aug 2012 18:23:38 +0000",19397.0,0,0.0,True,0,21,18,0,,,,,,0.0,[],0.0,False
0,5.0,"Quidi Vidi Honey Brown ale is created with a precise combination of Chocolate Malt and Crystal Malts, then embellished with the richness of honey and gentle hopping. A mild and wonderfully smooth ale that pours a golden brown with a hint of sweet honey scent to excite your nose. ",0,https://untappd.akamaized.net/site/beer_logos/beer-HoneyBrown_19398.jpeg,,Honey Brown,quidi-vidi-brewing-company-honey-brown,Brown Ale - American,19398,4501,https://untappd.akamaized.net/site/brewery_logos/brewery-4501_ed975.jpeg,Quidi Vidi Brewing Company,quidi-vidi-brewing-company,Micro Brewery,https://www.facebook.com/quidividibrewery/,QuidiVidiBeer,http://www.quidividibrewery.ca,Canada,St. John?s,NL,47.5816,-52.6778,"Fri, 31 Dec 2010 05:52:49 +0000",0,1,,,,693,3.31133,,10,1052,797,0,,,,,,0.0,[],3.41511,False
0,5.2,,0,https://untappd.akamaized.net/site/beer_logos/beer-youngsDoubleChocolateStout.jpg,,Young?s Double Chocolate Stout,wells-youngs-brewing-co-youngs-double-chocolate-stout,Stout - Milk / Sweet,8110,1348,https://untappd.akamaized.net/site/brewery_logos/brewery-1348_d2dfe.jpeg,Charles Wells Brewery,charles-wells-brewery,Micro Brewery,https://www.facebook.com/WellsBrewery,WellsBrewery,http://www.charleswells.co.uk,England,Bedford,Bedfordshire,52.1328,-0.48235,"Tue, 09 Nov 2010 02:42:47 +0000",0,1,8110.0,"Thu, 01 Jan 1970 00:00:00 +0000",19399.0,0,0.0,True,0,0,0,0,,,,,,0.0,[],0.0,False
0,8.5,"Oepn yuor mnid. Use a craobwr if you msut. Snice 1997, Arorgnat Basartd Ale has denemdad taht tyrnianacl micredioty rleax its girp of opprobrium on our ciollectve couniescosnss. Few pessoss the ruiereqd isinght or detph of piversceptve to crdiet the Liuqid Arorgnace for initatgsing the rlveoituon in tsate taht it has. Hevweor, taht?s pfecertly fnie, as our hlurecaen erffots in thirstung the larlegy unlliwing wolrd farorwd rquereis no exrtneal vaditilaon. We ralieze it?s hmaun nautre to bleeive taht pregorss trowads getreanss is one?s own ieda.

The mree fcat taht yuo?re hdoinlg tihs bttloe in yuor hnad ianidctes taht yuo?re pyiang antteiton, wihch ideitammley stes you arpat form the msseas. It aslo mkaes you one Lukcy Basartd. Hewover, lcuk faovrs the blod... and the arorgnat. The trmiraivute of Arorgnat Basartd Ale, OEKAD Arorgnat Basartd Ale and Dbolue Basartd Ale are all in paly in this cvue? de Basartd you now hlod, and wihle it is idneed a Lukcy Basartd, lcuk had ntohing to do wtih it.

Taody, wihle nueomrus iendicrlby dinistcitve chcoies are now alavaible, msot popele sitll fucos tiehr attntieon uopn msas mdiea?s isscenatnly banal ehco cheambr, keenpig thier hdeas frimly buerid in the maross of mecridioty. To beark thurogh tihs cophocany, to gsarp enitghnelnemt anmog the mnid-nmubnig culettr, rerequis itnent. Coinscous itnent. For mnay, this aictve piticipataron in the wolrd is unomfacbtorle. Prerrifeng inasted for oethrs to mkae teihr chcoies for tehm ? be it a shioutng pindut or a toelievisn ciommecral ? sheeple apccet the cmmoitozdied nrom wioutht thoghut. And to thsoe we say: ?Setp asdie, and get the hlel out of our way.?",0,https://untappd.akamaized.net/site/beer_logos/beer-_10125_b2487a2d85de3e44ebd36a8adafa.jpeg,,Lukcy Basartd Ale,arrogant-bastard-brewing-co-lukcy-basartd-ale,Strong Ale - American,10125,234399,https://untappd.akamaized.net/site/brewery_logos/brewery-234399_0c2d9.jpeg,Arrogant Brewing,arrogant-bastard-brewing,Micro Brewery,https://www.facebook.com/arrogantbastardale,ArrogantBastard,http://arrogantbastard.com,United States,Escondido,CA,33.116,-117.12,"Sat, 20 Nov 2010 05:07:04 +0000",0,1,10125.0,"Thu, 01 Jan 1970 00:00:00 +0000",19400.0,30427,3.92513,,267,39789,34590,0,,,,,,5.0,"[{'beer': {'bid': 256461, 'beer_label': 'https://untappd.akamaized.net/site/beer_logos/beer-_256461_7742e3a8f080a9424cf56970be4f.jpeg', 'beer_slug': 'arrogant-bastard-brewing-co-lukcy-basartd-ale-2012', 'beer_name': 'Lukcy Basartd Ale (2012)', 'is_vintage': 1, 'is_variant': 0}}, {'beer': {'bid': 259306, 'beer_label': 'https://untappd.akamaized.net/site/beer_logos/beer-_259306_0a31ce99537ce49ddb8282fe262b.jpeg', 'beer_slug': 'arrogant-bastard-brewing-co-lukcy-basartd-ale-2010', 'beer_name': 'Lukcy Basartd Ale (2010)', 'is_vintage': 1, 'is_variant': 0}}, {'beer': {'bid': 850847, 'beer_label': 'https://untappd.akamaized.net/site/beer_logos/beer-_10125_b2487a2d85de3e44ebd36a8adafa.jpeg', 'beer_slug': 'arrogant-bastard-brewing-co-lukcy-basartd-ale-2014', 'beer_name': 'Lukcy Basartd Ale (2014)', 'is_vintage': 1, 'is_variant': 0}}, {'beer': {'bid': 867175, 'beer_label': 'https://untappd.akamaized.net/site/assets/images/temp/badge-beer-default.png', 'beer_slug': 'arrogant-bastard-brewing-co-lukcy-basartd-ale-w-oak', 'beer_name': 'Lukcy Basartd Ale (w/ Oak)', 'is_vintage': 0, 'is_variant': 1}}, {'beer': {'bid': 990925, 'beer_label': 'https://untappd.akamaized.net/site/beer_logos/beer-_10125_b2487a2d85de3e44ebd36a8adafa.jpeg', 'beer_slug': 'arrogant-bastard-brewing-co-lukcy-basartd-ale-2013', 'beer_name': 'Lukcy Basartd Ale (2013)', 'is_vintage': 1, 'is_variant': 0}}]",3.92241,False
0,4.7,'Two Brothers' as we call it at the Brewery after Skip and Walter Yahn who were the original investors in our little pub. A golden Session IPA packed with citrusy American hop flavor.,61,https://untappd.akamaized.net/site/beer_logos/beer-19401_f00b0_sm.jpeg,https://untappd.akamaized.net/site/beer_logos_hd/beer-19401_a0354_hd.jpeg,Two Brothers Session IPA,ellicottville-brewing-company-two-brothers-session-ipa,IPA - Session / India Session Ale,19401,3180,https://untappd.akamaized.net/site/brewery_logos/brewery-3180_54f6c.jpeg,Ellicottville Brewing Company,ellicottville-brewing-company,Micro Brewery,https://www.facebook.com/EllicottvilleBrewing,EBCwny,http://www.ellicottvillebrewing.com,United States,Ellicottville,NY,42.2751,-78.6704,"Fri, 31 Dec 2010 05:57:25 +0000",0,1,,,,4090,3.45776,,376,5708,4613,0,,,,,,0.0,[],3.47117,False
0,11.0,"Wood Ya Honey is a wheat wine style ale brewed with generous amounts of local wild flower honey. We aged this beer in bourbon barrels for 10 months, elevating the rich caramel and honey character to luscious heights. Dripping honey comb, marzipan, and raisin come together for a decadent rich experience. Pour into your favorite snifter, let warm, sip, and allow your belly to surrender to the comforting embrace of craft.",0,https://untappd.akamaized.net/site/beer_logos/beer-19402_306f1_sm.jpeg,https://untappd.akamaized.net/site/beer_logos_hd/beer-19402_e8148_hd.jpeg,Wood Ya Honey,jackie-o-s-pub-and-brewery-wood-ya-honey,Wheat Wine,19402,5083,https://untappd.akamaized.net/site/brewery_logos/brewery-JackieOsPubBrewery_5083.jpeg,Jackie O's Pub & Brewery,jackie-o-s-pub-brewery,Brew Pub,http://www.facebook.com/JackieOsBrewery,jackieosbrewery,http://www.jackieos.com,United States,Athens,OH,39.3276,-82.1023,"Fri, 31 Dec 2010 05:58:41 +0000",0,1,,,,3448,4.072,,60,4583,3858,0,,,,,,4.0,"[{'beer': {'bid': 1176391, 'beer_label': 'https://untappd.akamaized.net/site/assets/images/temp/badge-beer-default.png', 'beer_slug': 'jackie-o-s-pub-and-brewery-wood-ya-honey-2010', 'beer_name': 'Wood Ya Honey (2010)', 'is_vintage': 1, 'is_variant': 0}}, {'beer': {'bid': 1190496, 'beer_label': 'https://untappd.akamaized.net/site/assets/images/temp/badge-beer-default.png', 'beer_slug': 'jackie-o-s-pub-brewery-wood-ya-honey-2015', 'beer_name': 'Wood Ya Honey (2015)', 'is_vintage': 1, 'is_variant': 0}}, {'beer': {'bid': 1340079, 'beer_label': 'https://untappd.akamaized.net/site/assets/images/temp/badge-beer-default.png', 'beer_slug': 'jackie-o-s-pub-brewery-wood-ya-honey-nutz', 'beer_name': 'Wood Ya Honey NUTZ', 'is_vintage': 0, 'is_variant': 1}}, {'beer': {'bid': 1869165, 'beer_label': 'https://untappd.akamaized.net/site/assets/images/temp/badge-beer-default.png', 'beer_slug': 'jackie-o-s-pub-and-brewery-wood-ya-honey-2016', 'beer_name': 'Wood Ya Honey (2016)', 'is_vintage': 1, 'is_variant': 0}}]",4.03778,False
0,8.0,"A dark red Christmas ale, remarkably hoppy for a French ""rousse.""",0,https://untappd.akamaized.net/site/beer_logos/beer-LaCalabrune_19403.jpeg,,La Calabrune,brasserie-des-vignes-la-calabrune,Winter Ale,19403,5302,https://untappd.akamaized.net/site/brewery_logos/brewery-BrasseriedesVignes_5302.jpeg,Brasserie des Vignes,brasserie-des-vignes,Micro Brewery,,BrasserieVignes,www.brasseriedesvignes.blogspot.com,France,Graulhet,Tarn,43.7658,1.99397,"Fri, 31 Dec 2010 06:01:06 +0000",0,1,,,,27,3.00926,,3,46,44,0,,,,,,0.0,[],3.59886,False
0,0.0,,0,https://untappd.akamaized.net/site/assets/images/temp/badge-beer-default.png,,Fudge Brownie Coffee Stout,odd-side-ales-fudge-brownie-coffee-stout,Stout - Other,19404,5300,https://untappd.akamaized.net/site/brewery_logos/brewery-oddsideales_5300.jpeg,Odd Side Ales,odd-side-ales,Micro Brewery,http://www.facebook.com/pages/Odd-Side-Ales/168663362478,,http://oddsideales.com/,United States,Grand Haven,MI,43.065,-86.2327,"Fri, 31 Dec 2010 06:01:48 +0000",0,1,,,,0,0.0,,0,1,1,0,,,,,,0.0,[],3.59537,False
0,0.0,,0,https://untappd.akamaized.net/site/assets/images/temp/badge-beer-default.png,,Blueberry Coffee Stout,odd-side-ales-blueberry-coffee-stout,Stout - Other,19405,5300,https://untappd.akamaized.net/site/brewery_logos/brewery-oddsideales_5300.jpeg,Odd Side Ales,odd-side-ales,Micro Brewery,http://www.facebook.com/pages/Odd-Side-Ales/168663362478,,http://oddsideales.com/,United States,Grand Haven,MI,43.065,-86.2327,"Fri, 31 Dec 2010 06:03:53 +0000",0,1,,,,3,0.0,,0,4,4,0,,,,,,0.0,[],3.58204,False
