0,10.0,"Known as Monk?s Brew in the U.S.

Monk?s Elixir is a heavy dark Belgian ale inspired by the Trappist monasteries of Rochefort and Westvleteren. The beer style, characterized by its high content of alcohol, distinguishes itself by its dominant yeast character, delicious malt background and balanced hop notes.",0,https://untappd.akamaized.net/site/beer_logos/beer-MonksElixirMonksBrew_25293.jpeg,,Monk's Elixir,mikkeller-monk-s-elixir,Belgian Quad,25293,2813,https://untappd.akamaized.net/site/brewery_logos/brewery-2813_649c4.jpeg,Mikkeller,mikkeller,Micro Brewery,http://www.facebook.com/mikkeller,MikkellerBeer,http://www.mikkeller.dk,Denmark,Copenhagen,,55.6731,12.5589,,,"Wed, 19 Jan 2011 06:02:28 +0000",0,1,25293.0,"Thu, 01 Jan 1970 00:00:00 +0000",12039.0,4539,3.89959,,39,5760,5218,0,,,,,,,,,,,0.0,[],3.88388,False
0,6.0,"A copper colored ale. The base beer is simple but very traditionally English, being brewed with 100% Maris Otter variety malted barley and 100% whole Golding hops. A hint of the unusual side lies in the name because it is brewed with a selection of whole spices ...whole spices, not extracts. The latter include coriander and nutmeg.",0,https://untappd.akamaized.net/site/beer_logos/beer-_13000_efcfd5ca693d8dd39d72aa01702a.jpeg,,Pickled Santa,ridgeway-brewing-pickled-santa,Winter Ale,13000,1056,https://untappd.akamaized.net/site/brewery_logos/brewery-1056_2c706.jpeg,Ridgeway Brewing,ridgeway-brewing,Micro Brewery,,RidgewayBrewery,http://www.ridgewaybrewery.co.uk/,England,,"South Stoke, Oxfordshire",51.5463,-1.13512,,,"Sun, 05 Dec 2010 12:37:04 +0000",0,1,13000.0,"Thu, 12 Jan 2012 15:35:49 +0000",12040.0,1280,3.06328,,1,1579,1509,0,,,,,,,,,,,0.0,[],3.17664,False
0,5.4,Brewed with pure glacial mineral water with an old world recipe we bring you a wonderful pilsener.,0,https://untappd.akamaized.net/site/beer_logos/beer-12041_762ed_sm.jpeg,https://untappd.akamaized.net/site/beer_logos_hd/beer-12041_4b719_hd.jpeg,Fat Boy,fat-boy-beverage-company-fat-boy,Pilsner - Other,12041,3275,https://untappd.akamaized.net/site/brewery_logos/brewery-3275_a8bdf.jpeg,Fat Boy Beverage Company,fat-boy-beverage-company,Micro Brewery,,,,United States,Oak Creek,WI,42.8669,-87.943,,,"Tue, 30 Nov 2010 10:32:19 +0000",0,1,,,,26,2.22115,,0,40,38,0,,,,,,,,,,,0.0,[],3.53794,False
0,0.0,"Munich, Vienna and caramel malts combine to provide a rich malt aroma.  Will ?nish clean and dry with no fruity esters.  Vienna Lager is moderately hopped.",0,https://untappd.akamaized.net/site/assets/images/temp/badge-beer-default.png,,Vienna Lager,kinne-springs-vienna-lager,Lager - Vienna,12042,3268,https://untappd.akamaized.net/site/assets/images/temp/badge-brewery-default.png,Kinne Springs,kinne-springs,Home Brewery,,,,United States,,,0.0,0.0,,,"Tue, 30 Nov 2010 10:35:02 +0000",1,1,,,,1,0.0,,0,21,3,0,,,,,,,,,,,0.0,[],2.524,False
0,0.0,,0,https://untappd.akamaized.net/site/assets/images/temp/badge-beer-default.png,,Hop Head,county-durham-brewing-hop-head,IPA - American,12043,1563,https://untappd.akamaized.net/site/brewery_logos/brewery-CountyDurhamBrewing_1563.jpeg,County Durham Brewing,county-durham-brewing,Micro Brewery,,,,Canada,Pickering,ON,43.8268,-79.0555,,,"Tue, 30 Nov 2010 10:35:44 +0000",0,1,,,,153,3.36928,,0,215,173,0,,,,,,,,,,,0.0,[],3.55057,False
0,5.0,"The strikingly authentic English-style pale ale is brewed with all-English malts and a pound-and-a-half of Pacific Northwest hops per barrel. It is medium-bodied, crisp and well-balanced with a flavor profile featuring subtle notes of caramel, toffee and toasted malt, counterbalanced by the ideal level of hop bitterness. The delicate herbal hop finish is produced by Goldings whole leaf hops.",16,https://untappd.akamaized.net/site/beer_logos/beer-AnglersAle_12044.jpeg,,Angler's Ale,arcadia-brewing-company-arcadia-ales-angler-s-ale,Pale Ale - English,12044,47,https://untappd.akamaized.net/site/brewery_logos/brewery-47_b355b.jpeg,Arcadia Brewing Company (Arcadia Ales),arcadia-brewing-company-arcadia-ales,Micro Brewery,http://www.facebook.com/arcadiaales,ArcadiaAles,http://www.arcadiaales.com/,United States,Kalamazoo,MI,42.2953,-85.5713,,,"Tue, 30 Nov 2010 10:36:12 +0000",0,1,,,,4033,3.31211,,27,5519,4639,0,,,,,,,,,,,0.0,[],3.336,False
0,6.0,"Whilst we would not recommend having this at breakfast with your bacon and eggs, our Coffee Beer is made with real coffee and has a caffeine hit to match. The natural flavors of the beans selected and hand roasted by our friends at the Union Coffee Roasters go well with the roast barley in the beer to give a silky-smooth drink with distinct chocolate and vanilla notes.",0,https://untappd.akamaized.net/site/beer_logos/beer-_12045_sm_8b969a391b925f4811b1bd38428527.jpeg,https://untappd.akamaized.net/site/beer_logos_hd/beer-_12045_hd_bfc94dd8c2646868c9df62d32e2180.jpeg,Coffee Porter,meantime-brewing-company-coffee-porter,Porter - American,12045,844,https://untappd.akamaized.net/site/brewery_logos/brewery-meantimebrewingcompany_844.jpeg,Meantime Brewing Company,meantime-brewing-company,Macro Brewery,http://www.facebook.com/meantimebrewing,MeantimeBrewing,http://www.meantimebrewing.com,England,"Greenwich, London","Greater London, SE10 0AR",51.4894,0.0083409,,,"Tue, 30 Nov 2010 10:38:13 +0000",0,1,,,,6566,3.63185,,27,7987,7391,0,,,,,,,,,,,0.0,[],3.6327,False
0,8.1,,0,https://untappd.akamaized.net/site/assets/images/temp/badge-beer-default.png,,Winter Warmer,key-largo-brewery-winter-warmer,Winter Warmer,12046,3120,https://untappd.akamaized.net/site/assets/images/temp/badge-brewery-default.png,Key Largo Brewery,key-largo-brewery,Home Brewery,,,http://mckenna.tv/brew/,United States,Newark,DE,39.6849,-75.6478,,,"Tue, 30 Nov 2010 10:59:38 +0000",1,1,,,,0,0.0,,0,28,2,0,,,,,,,,,,,0.0,[],3.786,False
0,0.0,,0,https://untappd.akamaized.net/site/assets/images/temp/badge-beer-default.png,,Fenian Red,clocktower-brew-pub-fenian-red,Red Ale - Irish,12047,2536,https://untappd.akamaized.net/site/brewery_logos/brewery-2536_12d3f.jpeg,Clocktower Brew Pub,clocktower-brew-pub,Brew Pub,https://www.facebook.com/TheClocktowerBrewPub,the_clocktower,http://clocktower.ca/,Canada,Ottawa,ON,45.4084,-75.6911,,,"Tue, 30 Nov 2010 11:00:24 +0000",0,1,,,,6,0.0,,0,11,11,0,,,,,,,,,,,0.0,[],3.53844,False
0,11.0,"A beer brewed on the shortest and darkest day of the year.

This monstrous beer with layers and layers of flavor: smoke, vanilla, licorice and sweet malts is what you need to cope with the dark and cold season. Best enjoyed in front of the fireplace while a winter storm is trying to knock down your house.",50,https://untappd.akamaized.net/site/beer_logos/beer-Sunturnbrew_57462.jpeg,,Sunturnbrew,nogne-o-sunturnbrew,Smoked Beer,57462,923,https://untappd.akamaized.net/site/brewery_logos/brewery-923_1cde4.jpeg,N?gne ?,nogne-o,Micro Brewery,http://www.facebook.com/nogneo,nogneo,http://www.nogne-o.com/,Norway,Grimstad,,58.406,8.63723,,,"Mon, 13 Jun 2011 22:25:15 +0000",0,1,57462.0,"Thu, 01 Jan 1970 00:00:00 +0000",12048.0,5042,3.60735,,81,6380,5598,0,,,,,,,,,,,5.0,"[{'beer': {'bid': 926513, 'beer_label': 'https://untappd.akamaized.net/site/beer_logos/beer-926513_2e2cd_sm.jpeg', 'beer_slug': 'nogne-o-sunturnbrew-2013', 'beer_name': 'Sunturnbrew (2013)', 'is_vintage': 1, 'is_variant': 0}}, {'beer': {'bid': 1012087, 'beer_label': 'https://untappd.akamaized.net/site/beer_logos/beer-1012087_eee77_sm.jpeg', 'beer_slug': 'nogne-o-sunturnbrew-2009', 'beer_name': 'Sunturnbrew (2009)', 'is_vintage': 1, 'is_variant': 0}}, {'beer': {'bid': 1012091, 'beer_label': 'https://untappd.akamaized.net/site/beer_logos/beer-1012091_b6713_sm.jpeg', 'beer_slug': 'nogne-o-sunturnbrew-2010', 'beer_name': 'Sunturnbrew (2010)', 'is_vintage': 1, 'is_variant': 0}}, {'beer': {'bid': 1012093, 'beer_label': 'https://untappd.akamaized.net/site/beer_logos/beer-1012093_1280a_sm.jpeg', 'beer_slug': 'nogne-o-sunturnbrew-2011', 'beer_name': 'Sunturnbrew (2011)', 'is_vintage': 1, 'is_variant': 0}}, {'beer': {'bid': 1012123, 'beer_label': 'https://untappd.akamaized.net/site/beer_logos/beer-1012123_3c568_sm.jpeg', 'beer_slug': 'nogne-o-sunturnbrew-2012', 'beer_name': 'Sunturnbrew (2012)', 'is_vintage': 1, 'is_variant': 0}}]",3.60984,False
0,5.8,"A complex, roasty porter with a bittersweet, chocolate-coffee taste and bold hop presence.",37,https://untappd.akamaized.net/site/beer_logos/beer-12049_a098a_sm.jpeg,https://untappd.akamaized.net/site/beer_logos_hd/beer-12049_200fb_hd.jpeg,Edmund Fitzgerald,great-lakes-brewing-company-edmund-fitzgerald,Porter - American,12049,3125,https://untappd.akamaized.net/site/brewery_logos/brewery-3125_cc74b.jpeg,Great Lakes Brewing Company,great-lakes-brewing-company,Micro Brewery,http://www.facebook.com/greatlakesbrewingco,GLBC_Cleveland,http://www.greatlakesbrewing.com/,United States,Cleveland,OH,41.4844,-81.7044,,,"Tue, 30 Nov 2010 11:21:31 +0000",0,1,,,,101184,3.80439,,2120,176191,113257,0,,,,,,,,,,,5.0,"[{'beer': {'bid': 769393, 'beer_label': 'https://untappd.akamaized.net/site/beer_logos/beer-769393_88cc0_sm.jpeg', 'beer_slug': 'great-lakes-brewing-company-edmund-fitzgerald-2006', 'beer_name': 'Edmund Fitzgerald (2006)', 'is_vintage': 1, 'is_variant': 0}}, {'beer': {'bid': 806262, 'beer_label': 'https://untappd.akamaized.net/site/beer_logos/beer-806262_b20f6_sm.jpeg', 'beer_slug': 'great-lakes-brewing-company-edmund-fitzgerald-2014', 'beer_name': 'Edmund Fitzgerald (2014)', 'is_vintage': 1, 'is_variant': 0}}, {'beer': {'bid': 838801, 'beer_label': 'https://untappd.akamaized.net/site/assets/images/temp/badge-beer-default.png', 'beer_slug': 'great-lakes-brewing-company-edmund-fitzgerald-w-cocoa-nibs-and-poblano-peppers', 'beer_name': 'Edmund Fitzgerald (w/ Cocoa Nibs & Poblano Peppers)', 'is_vintage': 0, 'is_variant': 1}}, {'beer': {'bid': 847662, 'beer_label': 'https://untappd.akamaized.net/site/beer_logos/beer-847662_78ec6_sm.jpeg', 'beer_slug': 'great-lakes-brewing-company-edmund-fitzgerald-w-hazelnut-bourbon-chips', 'beer_name': 'Edmund Fitzgerald (w/ Hazelnut Bourbon Chips)', 'is_vintage': 0, 'is_variant': 1}}, {'beer': {'bid': 908229, 'beer_label': 'https://untappd.akamaized.net/site/beer_logos/beer-908229_3c83c_sm.jpeg', 'beer_slug': 'great-lakes-brewing-company-mole-fitzmas', 'beer_name': 'Mole Fitzmas', 'is_vintage': 0, 'is_variant': 1}}]",3.80393,False
0,8.0,"English-Style Old Ale is brewed at The Schlafly Tap Room on 21st Street for Culinaria, a Schnucks market. This ale is a collaborative effort by the brewers of Schlafly Beer and our friends at Schnucks to celebrate the ongoing revival in the City of St. Louis. The Schlafly Tap Room opened in 1991 and was one of the first efforts of the modern revival. Culinaria, opened in 2009 on 9th Street, brings a fine food and beverage market back to Downtown St. Louis.

English-style Old Ale is a rich, amber-colored ale that pairs well with a wide variety of meats, cheeses, and desserts. Traditionally brewed in the winter months, an Old Ale is quite dark but not as dark as a stout. It is a celebration of English brewing tradition.",40,https://untappd.akamaized.net/site/beer_logos/beer-_273373_4da197f489dd7736b0a1800c904e.jpeg,,English-Style Old Ale (Holiday Ale),schlafly-the-saint-louis-brewery-english-style-old-ale-holiday-ale,Old Ale,273373,1092,https://untappd.akamaized.net/site/brewery_logos/brewery-schlaflybeerthesaintlouisbrewery_1092.jpeg,Schlafly - The Saint Louis Brewery,schlafly-the-saint-louis-brewery,Micro Brewery,http://www.facebook.com/schlaflybeer,schlafly,http://www.schlafly.com,United States,Saint Louis,MO,38.633,-90.2098,,,"Mon, 03 Dec 2012 20:49:10 +0000",0,0,273373.0,"Wed, 05 Dec 2012 21:39:09 +0000",12050.0,597,3.6541,,3,864,725,0,,,,,,,,,,,2.0,"[{'beer': {'bid': 1388288, 'beer_label': 'https://untappd.akamaized.net/site/assets/images/temp/badge-beer-default.png', 'beer_slug': 'schlafly-the-saint-louis-brewery-holiday-ale-2009', 'beer_name': 'Holiday Ale (2009)', 'is_vintage': 1, 'is_variant': 0}}, {'beer': {'bid': 1388289, 'beer_label': 'https://untappd.akamaized.net/site/assets/images/temp/badge-beer-default.png', 'beer_slug': 'schlafly-the-saint-louis-brewery-holiday-ale-2010', 'beer_name': 'Holiday Ale (2010)', 'is_vintage': 1, 'is_variant': 0}}]",3.65295,False
0,7.25,"An American Strong Ale, this beer has deep, rich, malt complexity with hints of toffee, caramel and lightly toasted barley.  Hops are plentiful as well, giving this beer enough bite and flavor to balance the big malt profile.  Enjoy this beer on those chilly autumn nights or a cold winter day.",85,https://untappd.akamaized.net/site/beer_logos/beer-486352_73f01_sm.jpeg,https://untappd.akamaized.net/site/beer_logos_hd/beer-486352_5b413_hd.jpeg,2013 Winterfest,sockeye-brewing-2013-winterfest,Strong Ale - American,486352,3276,https://untappd.akamaized.net/site/brewery_logos/brewery-sockeyebrewing_3276.jpeg,Sockeye Brewing,sockeye-brewing,Micro Brewery,http://www.facebook.com/pages/Sockeye-Brewing/298680642419,SockeyeBrew,http://www.sockeyebrew.com/,United States,Boise,ID,43.6206,-116.338,,,"Fri, 25 Oct 2013 00:11:59 +0000",0,0,486352.0,"Thu, 21 Nov 2013 18:52:57 +0000",12052.0,355,3.51972,,0,530,402,0,,,,,,,,,,,,,3.56947,False
0,8.4,"This years seasonal offering is a crisp and hoppy brew. Its delightful taste and full body are enhanced by natural, earthy warmth. It's a celebration of all that winter brings. ""Sure to keep you warm on those long cold winter nights.""",90,https://untappd.akamaized.net/site/beer_logos/beer-_12052_78cac67afe43ec49469b8173931b.jpeg,,Winterfest,sockeye-brewing-winterfest,Strong Ale - American,12052,3276,https://untappd.akamaized.net/site/brewery_logos/brewery-sockeyebrewing_3276.jpeg,Sockeye Brewing,sockeye-brewing,Micro Brewery,http://www.facebook.com/pages/Sockeye-Brewing/298680642419,SockeyeBrew,http://www.sockeyebrew.com/,United States,Boise,ID,43.6206,-116.338,,,"Tue, 30 Nov 2010 11:35:18 +0000",0,1,12052.0,"Thu, 01 Jan 1970 00:00:00 +0000",12053.0,0,0.0,True,0,0,0,0,,,,,,,,,,,0.0,[],0.0,False
0,6.0,"The intense flavors of dark-roasted malt in Boulevard?s rendition of the classic English porter are perfectly balanced by a generous and complex hop character. Bully! Porter?s robust nature makes it the ideal companion to a variety of foods, from seafood to chocolate.",49,https://untappd.akamaized.net/site/beer_logos/beer-_12054_sm_43d3f8c363456e88a403e581cb9c2a.jpeg,,Bully! Porter,boulevard-brewing-co-bully-porter,Porter - American,12054,1514,https://untappd.akamaized.net/site/brewery_logos/brewery-1514_2003e.jpeg,Boulevard Brewing Co.,boulevard-brewing-co,Micro Brewery,http://www.facebook.com/Boulevard,Boulevard_Beer,http://www.boulevard.com/,United States,Kansas City,MO,39.0812,-94.5954,,,"Tue, 30 Nov 2010 11:38:54 +0000",0,1,,,,14945,3.46221,,216,21059,16923,0,,,,,,,,,,,0.0,[],3.466,False
0,7.5,,0,https://untappd.akamaized.net/site/assets/images/temp/badge-beer-default.png,,Holiday Cheer,lompoc-brewing-holiday-cheer,Porter - Other,12055,1629,https://untappd.akamaized.net/site/brewery_logos/brewery-LompocBrewing_1629.jpeg,Lompoc Brewing,lompoc-brewing,Micro Brewery,http://www.facebook.com/LompocBrewing?ref=ts,lompocbeer,http://www.lompocbrewing.com/,United States,Portland,OR,45.5344,-122.699,,,"Tue, 30 Nov 2010 11:39:05 +0000",0,1,,,,66,3.5303,,0,87,77,0,,,,,,,,,,,0.0,[],3.59459,False
0,5.8,"A light and refreshing blend of malt and hops! Brewed with Crystal hops malted wheat, malted rye, allspice, and tangerine peel. ",0,https://untappd.akamaized.net/site/beer_logos/beer-Blitzen_12056.jpeg,,Blitzen,lompoc-brewing-blitzen,Spiced / Herbed Beer,12056,1629,https://untappd.akamaized.net/site/brewery_logos/brewery-LompocBrewing_1629.jpeg,Lompoc Brewing,lompoc-brewing,Micro Brewery,http://www.facebook.com/LompocBrewing?ref=ts,lompocbeer,http://www.lompocbrewing.com/,United States,Portland,OR,45.5344,-122.699,,,"Tue, 30 Nov 2010 11:43:57 +0000",0,1,,,,233,3.42167,,0,278,260,0,,,,,,,,,,,0.0,[],3.55102,False
0,9.2,"Brewers Reserve is a special ale highlighting our pioneering history and the innovative spirit that has carried us through all these years. Is is a marriage of our three most acclaimed ales: Oak-aged Bigfoot, Celebration Ale, and fresh Pale Ale blended together and generously dry-hopped. Come join us in celebrating thirty years with this most special brew. Drink it now, or save it for a future anniversary of your own.",0,https://untappd.akamaized.net/site/beer_logos/beer-30thAnniversaryOurBrewersReserveGrandCru_9847.jpeg,,30th Anniversary - Our Brewers Reserve Grand Cru,sierra-nevada-brewing-co-30th-anniversary-our-brewers-reserve-grand-cru,Strong Ale - American,9847,1142,https://untappd.akamaized.net/site/brewery_logos/brewery-1142_f241d.jpeg,Sierra Nevada Brewing Co.,sierra-nevada-brewing-co,Micro Brewery,http://www.facebook.com/sierranevadabeer,SierraNevada,http://www.sierranevada.com/,United States,Chico,CA,39.7242,-121.815,,,"Thu, 18 Nov 2010 16:10:16 +0000",0,0,9847.0,"Thu, 01 Jan 1970 00:00:00 +0000",12057.0,3019,4.05101,,12,4632,4024,0,,,,,,,,,,,2.0,"[{'beer': {'bid': 750058, 'beer_label': 'https://untappd.akamaized.net/site/assets/images/temp/badge-beer-default.png', 'beer_slug': 'sierra-nevada-brewing-co-our-brewers-reserve-2011', 'beer_name': 'Our Brewers Reserve (2011)', 'is_vintage': 1, 'is_variant': 0}}, {'beer': {'bid': 1055695, 'beer_label': 'https://untappd.akamaized.net/site/assets/images/temp/badge-beer-default.png', 'beer_slug': 'sierra-nevada-brewing-co-our-brewers-reserve-2010', 'beer_name': 'Our Brewers Reserve (2010)', 'is_vintage': 1, 'is_variant': 0}}]",4.01419,False
0,5.8,"Maerzen is a unique, fresh, dark brown Bavarian lager that has a malty ?bread taste? flavor. It is well balanced with a fresh hop finish.",0,https://untappd.akamaized.net/site/beer_logos/beer-Maerzen_12058.jpeg,,Maerzen,covington-brewhouse-maerzen,M?rzen,12058,2614,https://untappd.akamaized.net/site/brewery_logos/brewery-covingtonbrewhouse_2614.jpeg,Covington Brewhouse,covington-brewhouse,Micro Brewery,http://www.facebook.com/pages/Covington-Brewhouse/384176487896,CovingtonBrew,http://www.covingtonbrewhouse.com,United States,Covington,LA,30.4776,-90.097,,,"Tue, 30 Nov 2010 11:52:23 +0000",0,1,,,,77,3.17208,,0,180,115,0,,,,,,,,,,,0.0,[],3.5534,False
0,7.2,,45,https://untappd.akamaized.net/site/beer_logos/beer-SinebrychoffPorter_12059.jpeg,,Sinebrychoff Porter,sinebrychoff-sinebrychoff-porter,Porter - Baltic,12059,961,https://untappd.akamaized.net/site/brewery_logos/brewery-OySinebrychoffCarlsbergGroup_961.jpeg,Sinebrychoff,sinebrychoff,Macro Brewery,https://www.facebook.com/Sinebrychoff1819/,Sinebrychoff,http://www.sinebrychoff.fi,Finland,Kerava,,60.3813,25.1095,,,"Tue, 30 Nov 2010 11:54:29 +0000",0,1,,,,9116,3.58129,,242,13001,10182,0,,,,,,,,,,,5.0,"[{'beer': {'bid': 130703, 'beer_label': 'https://untappd.akamaized.net/site/assets/images/temp/badge-beer-default.png', 'beer_slug': 'sinebrychoff-porter-1998', 'beer_name': 'Porter (1998)', 'is_vintage': 1, 'is_variant': 0}}, {'beer': {'bid': 130705, 'beer_label': 'https://untappd.akamaized.net/site/assets/images/temp/badge-beer-default.png', 'beer_slug': 'sinebrychoff-porter-2011', 'beer_name': 'Porter (2011)', 'is_vintage': 1, 'is_variant': 0}}, {'beer': {'bid': 272350, 'beer_label': 'https://untappd.akamaized.net/site/assets/images/temp/badge-beer-default.png', 'beer_slug': 'sinebrychoff-carlsberg-group-porter-1996', 'beer_name': 'Porter (1996)', 'is_vintage': 1, 'is_variant': 0}}, {'beer': {'bid': 674449, 'beer_label': 'https://untappd.akamaized.net/site/assets/images/temp/badge-beer-default.png', 'beer_slug': 'sinebrychoff-sinebrychoff-porter-2014', 'beer_name': 'Sinebrychoff Porter (2014)', 'is_vintage': 1, 'is_variant': 0}}, {'beer': {'bid': 945007, 'beer_label': 'https://untappd.akamaized.net/site/assets/images/temp/badge-beer-default.png', 'beer_slug': 'sinebrychoff-porter-2000', 'beer_name': 'Porter (2000)', 'is_vintage': 1, 'is_variant': 0}}]",3.58355,False
0,5.8,"Way up north in the hustle bustle of Austin, our Capitol's brewers did a collaboration beer called ""Hop School"" for Austin Beer Week. We wanted to play too, so we took the recipe and put a San Antonio twist on it.",52,https://untappd.akamaized.net/site/beer_logos/beer-12060_sm.jpeg,https://untappd.akamaized.net/site/beer_logos_hd/beer-_12060_hd_966331abd27f5e3fd16994c89a9f1a.jpeg,Keepin' It Lame IPA,freetail-brewing-co-keepin-it-lame-ipa,IPA - American,12060,3020,https://untappd.akamaized.net/site/brewery_logos/brewery-3020_ea1ed.jpeg,Freetail Brewing Co.,freetail-brewing-co,Micro Brewery,http://www.facebook.com/pages/Freetail-Brewing-Co/57028762312?ref=nf,freetailbrewing,http://www.freetailbrewing.com,United States,San Antonio,TX,29.6016,-98.5613,,,"Tue, 30 Nov 2010 11:54:46 +0000",0,0,,,,0,0.0,,0,3,2,0,,,,,,,,,,,0.0,[],3.59537,False
0,0.0,"Espresso milk stout with some rye, quinoa, cinnamon, fennel seed, juniper, fresh rosemary and fresh lavender.",0,https://untappd.akamaized.net/site/assets/images/temp/badge-beer-default.png,,Espresso Milk Stout,folksy-brews-espresso-milk-stout,Other,12061,2731,https://untappd.akamaized.net/site/assets/images/temp/badge-brewery-default.png,Folksy Brews,folksy-brews,Home Brewery,,,,United States,,,0.0,0.0,,,"Tue, 30 Nov 2010 12:01:25 +0000",1,1,,,,0,0.0,,0,4,1,0,,,,,,,,,,,0.0,[],3.786,False
0,9.7,,0,https://untappd.akamaized.net/site/beer_logos/beer-2010OldTavernRat_12062.jpeg,,Old Tavern Rat (2010),lompoc-brewing-old-tavern-rat-2010,Barleywine - American,12062,1629,https://untappd.akamaized.net/site/brewery_logos/brewery-LompocBrewing_1629.jpeg,Lompoc Brewing,lompoc-brewing,Micro Brewery,http://www.facebook.com/LompocBrewing?ref=ts,lompocbeer,http://www.lompocbrewing.com/,United States,Portland,OR,45.5344,-122.699,,,"Tue, 30 Nov 2010 12:05:23 +0000",0,0,,,,4,0.0,,0,4,4,0,,,,,,9.4,Old Tavern Rat,lompoc-brewing-old-tavern-rat,400931.0,7.0,,,3.53284,False
0,4.6,"A ""double hopped"" (dry hopped) unique American lager based on traditional European Pilsners with a crisp refreshing body and lots of taste. We add hops in the kettle and then again before finishing for aromatic quality.",15,https://untappd.akamaized.net/site/beer_logos/beer-BlackStarDoubleHoppedGoldenLager_12063.jpeg,,Black Star Double Hopped Golden Lager,great-northern-brewing-company-montana-black-star-double-hopped-golden-lager,Lager - Pale,12063,3277,https://untappd.akamaized.net/site/brewery_logos/brewery-greatNorthernBrewing.jpg,Great Northern Brewing Company (Montana),great-northern-brewing-company-montana,Micro Brewery,http://www.facebook.com/greatnorthernbrewing,GrtNorthernBrew,http://www.greatnorthernbrewing.com,United States,Whitefish,MT,48.4123,-114.337,,,"Tue, 30 Nov 2010 12:05:50 +0000",0,0,,,,1171,2.90051,,0,2143,1550,0,,,,,,,,,,,0.0,[],3.05502,False
0,7.2,,45,https://untappd.akamaized.net/site/beer_logos/beer-SinebrychoffPorter_12059.jpeg,,Sinebrychoff Porter,sinebrychoff-sinebrychoff-porter,Porter - Baltic,12059,961,https://untappd.akamaized.net/site/brewery_logos/brewery-OySinebrychoffCarlsbergGroup_961.jpeg,Sinebrychoff,sinebrychoff,Macro Brewery,https://www.facebook.com/Sinebrychoff1819/,Sinebrychoff,http://www.sinebrychoff.fi,Finland,Kerava,,60.3813,25.1095,,,"Tue, 30 Nov 2010 11:54:29 +0000",0,1,12059.0,"Tue, 04 Sep 2012 08:27:52 +0000",12064.0,9116,3.58129,,242,13001,10182,0,,,,,,,,,,,5.0,"[{'beer': {'bid': 130703, 'beer_label': 'https://untappd.akamaized.net/site/assets/images/temp/badge-beer-default.png', 'beer_slug': 'sinebrychoff-porter-1998', 'beer_name': 'Porter (1998)', 'is_vintage': 1, 'is_variant': 0}}, {'beer': {'bid': 130705, 'beer_label': 'https://untappd.akamaized.net/site/assets/images/temp/badge-beer-default.png', 'beer_slug': 'sinebrychoff-porter-2011', 'beer_name': 'Porter (2011)', 'is_vintage': 1, 'is_variant': 0}}, {'beer': {'bid': 272350, 'beer_label': 'https://untappd.akamaized.net/site/assets/images/temp/badge-beer-default.png', 'beer_slug': 'sinebrychoff-carlsberg-group-porter-1996', 'beer_name': 'Porter (1996)', 'is_vintage': 1, 'is_variant': 0}}, {'beer': {'bid': 674449, 'beer_label': 'https://untappd.akamaized.net/site/assets/images/temp/badge-beer-default.png', 'beer_slug': 'sinebrychoff-sinebrychoff-porter-2014', 'beer_name': 'Sinebrychoff Porter (2014)', 'is_vintage': 1, 'is_variant': 0}}, {'beer': {'bid': 945007, 'beer_label': 'https://untappd.akamaized.net/site/assets/images/temp/badge-beer-default.png', 'beer_slug': 'sinebrychoff-porter-2000', 'beer_name': 'Porter (2000)', 'is_vintage': 1, 'is_variant': 0}}]",3.58355,False
0,7.5,Caraway ftw!,0,https://untappd.akamaized.net/site/assets/images/temp/badge-beer-default.png,,Rye Dry Stout,mad-haven-rye-dry-stout,Stout - American,12065,2443,https://untappd.akamaized.net/site/assets/images/temp/badge-brewery-default.png,Mad Haven,mad-haven,Home Brewery,,,,United States,,,0.0,0.0,,,"Tue, 30 Nov 2010 12:23:01 +0000",1,1,,,,0,0.0,,0,7,4,0,,,,,,,,,,,0.0,[],3.786,False
0,5.0,"The Native Lager is brewed with the finest German malts, German hops and a classic Germain yeast strain which produces and exceptionally smooth tasting golden lager. Not too light and not too heavy this beer finishes with absolutely NO aftertaste. Cool and refreshing yet flavorful... enjoy one anytime you want to feel like a Native.",0,https://untappd.akamaized.net/site/beer_logos/beer-199074_33984_sm.jpeg,https://untappd.akamaized.net/site/beer_logos_hd/beer-199074_a33b7_hd.jpeg,Florida Native Lager,florida-beer-company-florida-native-lager,Lager - Pale,199074,535,https://untappd.akamaized.net/site/brewery_logos/brewery-FloridaBeerCompany_535.jpeg,Florida Beer Company,florida-beer-company,Micro Brewery,http://www.facebook.com/FloridaBeerCompany,FLORIDABEER,http://www.floridabeer.com,United States,Cape Canaveral,FL,28.3994,-80.6097,,,"Thu, 12 Jul 2012 17:56:57 +0000",0,1,199074.0,"Mon, 22 Dec 2014 17:29:20 +0000",12066.0,2836,3.26349,,33,3546,3242,0,,,,,,,,,,,0.0,[],3.30121,False
