auth_rating,beer_abv,beer_description,beer_ibu,beer_label,beer_label_hd,beer_name,beer_slug,beer_style,bid,brewery.brewery_id,brewery.brewery_label,brewery.brewery_name,brewery.brewery_slug,brewery.brewery_type,brewery.contact.facebook,brewery.contact.twitter,brewery.contact.url,brewery.country_name,brewery.location.brewery_city,brewery.location.brewery_state,brewery.location.lat,brewery.location.lng,created_at,is_homebrew,is_in_production,merge_details.master_bid,merge_details.merge_date,merge_details.requested_bid,rating_count,rating_score,rating_score_below,stats.monthly_count,stats.total_count,stats.total_user_count,stats.user_count,vintage_parent.beer.beer_abv,vintage_parent.beer.beer_name,vintage_parent.beer.beer_slug,vintage_parent.beer.bid,vintage_parent.beer.type_id,vintages.count,vintages.items,weighted_rating_score,wish_list
0,6.5,"Pale Ale, Maris Otter, Carapils, and Carastan malts. Cascade and Centennial hops. Clean and crisp with loads of floral and tropical fruit aromas and flavors.",52,https://untappd.akamaized.net/site/beer_logos/beer-46697_736f0_sm.jpeg,https://untappd.akamaized.net/site/beer_logos_hd/beer-46697_0e4dc_hd.jpeg,Flying Aces,third-base-brewery-flying-aces,Pale Ale - American,46697,10104,https://untappd.akamaized.net/site/brewery_logos/brewery-10104_cf4e6.jpeg,Third Base Brewery,third-base-brewery,Brew Pub,https://www.facebook.com/#!/pages/Third-Base-Brewery/392653431252,3rdBaseBrewery,http://www.Thirdbasebrew.com/,United States,Cedar Rapids,IA,42.0352,-91.6398,"Wed, 27 Apr 2011 23:35:00 +0000",0,1,46697.0,"Tue, 21 May 2013 21:03:53 +0000",19334.0,593,3.51307,,17,1416,683,0,,,,,,0.0,[],3.55988,False
0,5.0,,0,https://untappd.akamaized.net/site/beer_logos/beer-14893_3676b_sm.jpeg,https://untappd.akamaized.net/site/beer_logos_hd/beer-14893_4d6a0_hd.jpeg,Leo Beer,boon-rawd-brewery-leo-beer,Lager - Pale,14893,152,https://untappd.akamaized.net/site/brewery_logos/brewery-BoonRawdBrewery_152.jpeg,Boon Rawd Brewery,boon-rawd-brewery,Micro Brewery,https://www.facebook.com/SINGHAofficial,singhaclub,http://www.boonrawd.co.th/,Thailand,10300 Bangkok,,13.787,100.515,"Thu, 16 Dec 2010 00:16:23 +0000",0,1,14893.0,"Thu, 01 Jan 1970 00:00:00 +0000",19335.0,14910,2.73462,,656,22268,16886,0,,,,,,0.0,[],2.75299,False
0,6.6,"Flavor grenade of American hops! With pronounced hop flavor and aroma this IPA is deliciously citrusy from tons of Cascade, Centennial, Simcoe and Amarillo hops. Full flavored, hoppy, well balanced American IPA.",0,https://untappd.akamaized.net/site/assets/images/temp/badge-beer-default.png,,Southpaw IPA,original-gravity-brewing-company-southpaw-ipa,IPA - American,19336,3993,https://untappd.akamaized.net/site/brewery_logos/brewery-OriginalGravity_3993.jpeg,Original Gravity Brewing Company,original-gravity-brewing-company,Micro Brewery,www.facebook.com/pages/Original-Gravity-Brewing-Co/60651198392,,www.ogbrewing.com,United States,Milan,MI,42.0841,-83.6752,"Fri, 31 Dec 2010 02:07:07 +0000",0,1,,,,1692,3.67228,,41,3024,1914,0,,,,,,0.0,[],3.66902,False
0,8.5,"Appearance
Ruby red in colour with a creamy, warm-white head.

Flavour 
Fruity aroma. A soft, full taste that develops into a lightly sweet, hoppy aftertaste.
",58,https://untappd.akamaized.net/site/beer_logos/beer-_26181_adcf907d92595e7a98f571da4d10.jpeg,,Charles Quint Rouge Rubis / Keizer Karel Robijn Rood,brouwerij-haacht-charles-quint-rouge-rubis-keizer-karel-robijn-rood,Belgian Strong Dark Ale,26181,3426,https://untappd.akamaized.net/site/brewery_logos/brewery-brouwerijhaacht_3426.jpeg,Brouwerij Haacht Brasserie,brouwerij-haacht-brasserie,Micro Brewery,http://www.facebook.com/pages/Brouwerij-Haacht/157177797680090,,http://www.haacht.com,Belgium,Boortmeerbeek,,50.9645,4.60835,"Sun, 23 Jan 2011 13:12:33 +0000",0,1,26181.0,"Thu, 01 Jan 1970 00:00:00 +0000",19337.0,9062,3.47818,,430,11512,9902,0,,,,,,0.0,[],3.4838,False
0,0.0,,0,https://untappd.akamaized.net/site/beer_logos/beer-_14122_e2d619cd90a25bcd0e64a7acf897.jpeg,,Rye American Strong Ale,schlafly-the-saint-louis-brewery-rye-american-strong-ale,Rye Beer,14122,1092,https://untappd.akamaized.net/site/brewery_logos/brewery-schlaflybeerthesaintlouisbrewery_1092.jpeg,Schlafly - The Saint Louis Brewery,schlafly-the-saint-louis-brewery,Micro Brewery,http://www.facebook.com/schlaflybeer,schlafly,http://www.schlafly.com,United States,Saint Louis,MO,38.633,-90.2098,"Sat, 11 Dec 2010 08:52:16 +0000",0,0,14122.0,"Thu, 28 Jun 2012 02:15:01 +0000",19338.0,3,0.0,,0,16,16,0,,,,,,0.0,[],3.55737,False
0,9.5,,0,https://untappd.akamaized.net/site/assets/images/temp/badge-beer-default.png,,Sticke'y Monkey,victory-brewing-company-sticke-y-monkey,Sour - Ale,19608,1326,https://untappd.akamaized.net/site/brewery_logos/brewery-1326_6ca88.jpeg,Victory Brewing Company,victory-brewing-company,Micro Brewery,https://www.facebook.com/victorybeer,VictoryBeer,http://victorybeer.com/,United States,Downingtown,PA,40.0061,-75.6942,"Fri, 31 Dec 2010 13:23:04 +0000",0,1,19608.0,"Sun, 23 Oct 2011 17:20:18 +0000",19339.0,0,0.0,True,0,20,18,0,,,,,,0.0,[],0.0,False
0,5.5,,0,https://untappd.akamaized.net/site/assets/images/temp/badge-beer-default.png,,Pilot Series American Wheat,cigar-city-brewing-pilot-series-american-wheat,Pale Wheat Ale - American,19340,379,https://untappd.akamaized.net/site/brewery_logos/brewery-379_e6ae7.jpeg,Cigar City Brewing,cigar-city-brewing,Micro Brewery,http://www.facebook.com/cigarcitybeer,CigarCityBeer,http://cigarcitybrewing.com/,United States,Tampa,FL,27.959,-82.5092,"Fri, 31 Dec 2010 02:25:42 +0000",0,1,,,,7,0.0,,0,9,9,0,,,,,,0.0,[],3.54068,False
0,0.0,,0,https://untappd.akamaized.net/site/assets/images/temp/badge-beer-default.png,,Hey Guy Rye,ellicottville-brewing-company-hey-guy-rye,Rye Beer,19341,3180,https://untappd.akamaized.net/site/brewery_logos/brewery-3180_54f6c.jpeg,Ellicottville Brewing Company,ellicottville-brewing-company,Micro Brewery,https://www.facebook.com/EllicottvilleBrewing,EBCwny,http://www.ellicottvillebrewing.com,United States,Ellicottville,NY,42.2751,-78.6704,"Fri, 31 Dec 2010 02:33:51 +0000",0,1,,,,7,0.0,,0,16,16,0,,,,,,0.0,[],3.54173,False
0,5.5,"Notre bi?re de soif par excellence, notre Pale Ale Am?ricaine, houblonn?e avec les vari?t?s Centennial, Amarillo et Cascade, offre un bouquet irr?sistible, floral et citronn?. Blonde, s?che, d?salt?rante et g?n?reusement houblonn?e!",60,https://untappd.akamaized.net/site/beer_logos/beer-PaleAleAmericaine_28068.jpeg,,Pale Ale Americaine,brasserie-dunham-pale-ale-americaine,Pale Ale - American,28068,5289,https://untappd.akamaized.net/site/brewery_logos/brewery-BrasserieDunham_5289.jpeg,Brasserie Dunham,brasserie-dunham,Micro Brewery,https://www.facebook.com/brasseriedunham1,BrasserieDunham,http://www.brasseriedunham.com/,Canada,Dunham,QC,45.1298,-72.8007,"Wed, 02 Feb 2011 02:32:10 +0000",0,1,28068.0,"Tue, 25 Oct 2011 06:45:32 +0000",19342.0,1468,3.62381,,30,2353,1608,0,,,,,,0.0,[],3.62847,False
0,6.0,"Minerva Imperial Stout, our pride craft beer is a full bodied, dark color, aroma and flavor of cocoa and coffee, sweet stout style Ale type fermentation. The friendly and round flavor Minerva Imperial Stout marries perfectly with sweet flavors like chocolate truffles or the duck confit with light garlic mayonnaise, so it is excellent for red meats in general.
",0,https://untappd.akamaized.net/site/beer_logos/beer-_17793_sm_22cbc4fd0db961c194f340255e041d.jpeg,https://untappd.akamaized.net/site/beer_logos_hd/beer-_17793_hd_b5216658b62a5a6c63938444c20f8f.jpeg,Minerva Stout Imperial,cerveceria-minerva-minerva-stout-imperial,Stout - Other,17793,2061,https://untappd.akamaized.net/site/brewery_logos/brewery-Minerva_2061.jpeg,Cervecer?a Minerva ,cerveceria-minerva,Micro Brewery,http://www.facebook.com/CerveceriaMinerva,Cerveza_Minerva,http://www.cervezaminerva.mx/,Mexico,Zapopan,Jalisco,20.6193,-103.43,"Sun, 26 Dec 2010 23:59:11 +0000",0,1,17793.0,"Mon, 24 Oct 2011 03:10:13 +0000",19343.0,2817,3.61679,,98,5194,3275,0,,,,,,0.0,[],3.62012,False
0,10.4,"Black Metal Imperial Stout, a.k.a. Suds of Northern Darkness, a.k.a. Iron Sword, a.k.a. El Martillo del Muerte. Black Metal is a cruel and punishing beer fermented by the sheer force of its awesome will. We are pretty sure that Kreator wrote the song ?Impossible Brutality? about this beer while drinking it during their Extreme Aggression Tour.",0,https://untappd.akamaized.net/site/beer_logos/beer-BlackMetal_16019.jpeg,,Black Metal,jester-king-craft-brewery-black-metal,Stout - Russian Imperial,16019,5291,https://untappd.akamaized.net/site/brewery_logos/brewery-JesterKingCraftBrewery_5291.jpeg,Jester King Brewery,jester-king-brewery,Micro Brewery,https://www.facebook.com/JesterKingBrewery,jesterkingbeer,http://www.jesterkingbrewery.com/,United States,Austin,TX,30.2323,-97.9998,"Wed, 22 Dec 2010 08:28:58 +0000",0,0,16019.0,"Thu, 01 Jan 1970 00:00:00 +0000",19344.0,0,0.0,True,0,0,0,0,,,,,,0.0,[],0.0,False
0,4.8,"An authentic German-style golden ale. Lower mash and fermentation temperatures, a percentage of wheat malt in the grain bill and German Hallertau hops all contribute to the refreshing flavor of this light beer.  ",22,https://untappd.akamaized.net/site/assets/images/temp/badge-beer-default.png,,Connor's Kolsch,old-boys-brewhouse-connor-s-kolsch,K?lsch,19345,5292,https://untappd.akamaized.net/site/brewery_logos/brewery-OldBoysBrewhouse_5292.jpeg,Old Boys' Brewhouse,old-boys-brewhouse,Micro Brewery,http://www.facebook.com/oldboysbrewhouse,oldboysbrew,http://oldboysbrewhouse.com/,United States,Spring Lake,MI,43.077,-86.2122,"Fri, 31 Dec 2010 03:45:26 +0000",0,1,,,,301,3.29983,,4,370,342,0,,,,,,0.0,[],3.47653,False
0,8.5,,66,https://untappd.akamaized.net/site/beer_logos/beer-19346_15407_sm.jpeg,https://untappd.akamaized.net/site/beer_logos_hd/beer-19346_27fcb_hd.jpeg,Piek & Ballen,brouwerij-de-molen-piek-ballen,Spiced / Herbed Beer,19346,3367,https://untappd.akamaized.net/site/brewery_logos/brewery-3367_c1d5d.jpeg,Brouwerij De Molen,brouwerij-de-molen,Micro Brewery,http://www.facebook.com/BierbrouwerijDeMolen,molenbier,http://www.brouwerijdemolen.nl,Netherlands,Bodegraven,Zuid Holland,52.0857,4.74211,"Fri, 31 Dec 2010 03:45:47 +0000",0,0,,,,16,3.35938,,0,22,19,0,,,,,,0.0,[],3.61647,False
0,5.0,"Minerva Vienna is a bottom-fermented beer and red amber, has a faint nutty aroma and clean caramel. When you taste it and savor its distinctive soft sweetness from malt aroma. The termination is durable and mouthfeel is maltose. It is recommended to serve this beer to 6 or 8 degrees. To avail develop less foam cooler and warmer less consistent foam. Serve with sweet and sour dishes as marinated and Minerva Vienna beer refreshes the feelings generated by such dishes, also enhances the flavor of fish and vegetables.
",0,https://untappd.akamaized.net/site/beer_logos/beer-_7873_sm_074a50dfe81aee8ae53b68175fcfc7.jpeg,https://untappd.akamaized.net/site/beer_logos_hd/beer-_7873_hd_4fa7ecb8baedff59f9445ad3000966.jpeg,Minerva Viena Oscura,cerveceria-minerva-minerva-viena-oscura,Lager - Vienna,7873,2061,https://untappd.akamaized.net/site/brewery_logos/brewery-Minerva_2061.jpeg,Cervecer?a Minerva ,cerveceria-minerva,Micro Brewery,http://www.facebook.com/CerveceriaMinerva,Cerveza_Minerva,http://www.cervezaminerva.mx/,Mexico,Zapopan,Jalisco,20.6193,-103.43,"Sun, 07 Nov 2010 11:44:43 +0000",0,1,7873.0,"Mon, 24 Oct 2011 03:10:07 +0000",19347.0,1310,3.35095,,40,1982,1546,0,,,,,,0.0,[],3.4076,False
0,5.0,"Colonial Minerva is a bright golden colored beer with malty flavor low style and touches of citrus type fermentation Kolsch Ale, made with designation of origin in the German city Cologne. To achieve the great body that this beer boasts, is incorporated into the mixture of wheat malt and extends the dwell time after fermentation. It is recommended to serve this beer in glasses Strange (long thin glasses 20 cl) at temperatures around 10 C. Traditionally it is customary to accompany German dishes like Halve Hahn (rye bread with butter and Dutch cheese) or meats such as Blootwoosch (blood sausage).
",0,https://untappd.akamaized.net/site/beer_logos/beer-_19348_sm_bd56eb4f3ee649a79270db63543eab.jpeg,https://untappd.akamaized.net/site/beer_logos_hd/beer-_19348_hd_a1e165889534509c5e4f2d403a58bd.jpeg,Minerva Colonial Clara,cerveceria-minerva-minerva-colonial-clara,K?lsch,19348,2061,https://untappd.akamaized.net/site/brewery_logos/brewery-Minerva_2061.jpeg,Cervecer?a Minerva ,cerveceria-minerva,Micro Brewery,http://www.facebook.com/CerveceriaMinerva,Cerveza_Minerva,http://www.cervezaminerva.mx/,Mexico,Zapopan,Jalisco,20.6193,-103.43,"Fri, 31 Dec 2010 03:57:49 +0000",0,1,,,,1339,3.29369,,54,2009,1580,0,,,,,,0.0,[],3.35996,False
0,5.0,"Colonial Minerva is a bright golden colored beer with malty flavor low style and touches of citrus type fermentation Kolsch Ale, made with designation of origin in the German city Cologne. To achieve the great body that this beer boasts, is incorporated into the mixture of wheat malt and extends the dwell time after fermentation. It is recommended to serve this beer in glasses Strange (long thin glasses 20 cl) at temperatures around 10 C. Traditionally it is customary to accompany German dishes like Halve Hahn (rye bread with butter and Dutch cheese) or meats such as Blootwoosch (blood sausage).
",0,https://untappd.akamaized.net/site/beer_logos/beer-_19348_sm_bd56eb4f3ee649a79270db63543eab.jpeg,https://untappd.akamaized.net/site/beer_logos_hd/beer-_19348_hd_a1e165889534509c5e4f2d403a58bd.jpeg,Minerva Colonial Clara,cerveceria-minerva-minerva-colonial-clara,K?lsch,19348,2061,https://untappd.akamaized.net/site/brewery_logos/brewery-Minerva_2061.jpeg,Cervecer?a Minerva ,cerveceria-minerva,Micro Brewery,http://www.facebook.com/CerveceriaMinerva,Cerveza_Minerva,http://www.cervezaminerva.mx/,Mexico,Zapopan,Jalisco,20.6193,-103.43,"Fri, 31 Dec 2010 03:57:49 +0000",0,1,19348.0,"Mon, 24 Oct 2011 03:11:20 +0000",19349.0,1339,3.29369,,54,2009,1580,0,,,,,,0.0,[],3.35996,False
0,9.7,Bourbon Barrel Aged Mad Cow,30,https://untappd.akamaized.net/site/beer_logos/beer-BourbonBarrelAgedMadCow_15868.jpeg,,Very Mad Cow,revolution-brewing-company-very-mad-cow,Stout - Milk / Sweet,15868,2605,https://untappd.akamaized.net/site/brewery_logos/brewery-RevolutionBrewingCompany_2605.jpeg,Revolution Brewing Company,revolution-brewing-company,Micro Brewery,http://www.facebook.com/pages/Revolution-Brewing/225870585280,revbrewchicago,http://revbrew.com,United States,Chicago,IL,41.9235,-87.6982,"Tue, 21 Dec 2010 10:24:26 +0000",0,1,15868.0,"Thu, 03 Nov 2011 19:04:29 +0000",19350.0,7960,4.09469,,37,10590,8903,0,,,,,,4.0,"[{'beer': {'bid': 583308, 'beer_label': 'https://untappd.akamaized.net/site/assets/images/temp/badge-beer-default.png', 'beer_slug': 'revolution-brewing-company-very-mad-cow-2012', 'beer_name': 'Very Mad Cow (2012)', 'is_vintage': 1, 'is_variant': 0}}, {'beer': {'bid': 923873, 'beer_label': 'https://untappd.akamaized.net/site/assets/images/temp/badge-beer-default.png', 'beer_slug': 'revolution-brewing-company-very-mad-cow-2013', 'beer_name': 'Very Mad Cow (2013)', 'is_vintage': 1, 'is_variant': 0}}, {'beer': {'bid': 959145, 'beer_label': 'https://untappd.akamaized.net/site/assets/images/temp/badge-beer-default.png', 'beer_slug': 'revolution-brewing-company-very-mad-cow-2015', 'beer_name': 'Very Mad Cow (2015)', 'is_vintage': 1, 'is_variant': 0}}, {'beer': {'bid': 1397242, 'beer_label': 'https://untappd.akamaized.net/site/assets/images/temp/badge-beer-default.png', 'beer_slug': 'revolution-brewing-company-very-mad-cow-2016', 'beer_name': 'Very Mad Cow (2016)', 'is_vintage': 1, 'is_variant': 0}}]",4.07832,False
0,6.0,"Brewed with all the TLC a hop-head has to offer, this bold ale tantalizes the taste buds of the serious hop lover with its pronounced bitterness and citrusy finish. Generous amounts of Cascade and Warrior hops added at the end of the kettle boil and dry-hopped in the fermenter contribute a fresh, crisp hop flavor and aroma. ",75,https://untappd.akamaized.net/site/assets/images/temp/badge-beer-default.png,,Dogtail IPA,old-boys-brewhouse-dogtail-ipa,IPA - American,19351,5292,https://untappd.akamaized.net/site/brewery_logos/brewery-OldBoysBrewhouse_5292.jpeg,Old Boys' Brewhouse,old-boys-brewhouse,Micro Brewery,http://www.facebook.com/oldboysbrewhouse,oldboysbrew,http://oldboysbrewhouse.com/,United States,Spring Lake,MI,43.077,-86.2122,"Fri, 31 Dec 2010 04:04:45 +0000",0,1,,,,618,3.536,,10,883,693,0,,,,,,0.0,[],3.57397,False
0,4.8,"Medium in body and unique in its flavor complexity. We use a combination caramel, victory, and chocolate malts to give this tasty brew a toasted, nutty flavor. ",25,https://untappd.akamaized.net/site/assets/images/temp/badge-beer-default.png,,Old Boy's Brown Ale,old-boys-brewhouse-old-boy-s-brown-ale,Brown Ale - American,19352,5292,https://untappd.akamaized.net/site/brewery_logos/brewery-OldBoysBrewhouse_5292.jpeg,Old Boys' Brewhouse,old-boys-brewhouse,Micro Brewery,http://www.facebook.com/oldboysbrewhouse,oldboysbrew,http://oldboysbrewhouse.com/,United States,Spring Lake,MI,43.077,-86.2122,"Fri, 31 Dec 2010 04:05:15 +0000",0,1,,,,402,3.45833,,6,510,449,0,,,,,,0.0,[],3.54141,False
0,4.8,"Medium in body and unique in its flavor complexity. We use a combination caramel, victory, and chocolate malts to give this tasty brew a toasted, nutty flavor. ",25,https://untappd.akamaized.net/site/assets/images/temp/badge-beer-default.png,,Old Boy's Brown Ale,old-boys-brewhouse-old-boy-s-brown-ale,Brown Ale - American,19352,5292,https://untappd.akamaized.net/site/brewery_logos/brewery-OldBoysBrewhouse_5292.jpeg,Old Boys' Brewhouse,old-boys-brewhouse,Micro Brewery,http://www.facebook.com/oldboysbrewhouse,oldboysbrew,http://oldboysbrewhouse.com/,United States,Spring Lake,MI,43.077,-86.2122,"Fri, 31 Dec 2010 04:05:15 +0000",0,1,19352.0,"Tue, 19 Nov 2013 02:52:39 +0000",19353.0,402,3.45833,,6,510,449,0,,,,,,0.0,[],3.54141,False
0,4.3,"Our Winter Wonder is brewed in the German lager style known as Schwarzbier. This beer originated as a warm fermented-style ale in central Germany before cold fermenting lager yeasts were introduced. This malty winter seasonal, though dark in color, is relatively light bodied and has a dry and refreshing finish. A careful combination of the world's finest caramel, pale and black malts give Winter Wonder its delicious roasted flavors and aromas, reminiscent of chocolate, coffee and dried fruit.",0,https://untappd.akamaized.net/site/beer_logos/beer-_19354_f74bb7db7bf4f0cc03a5a5bc3e99.jpeg,,Winter Wonder,carolina-brewery-winter-wonder,Schwarzbier,19354,350,https://untappd.akamaized.net/site/brewery_logos/brewery-350_f8939.jpeg,Carolina Brewery,carolina-brewery,Micro Brewery,http://www.facebook.com/carolinabrewery,carolinabrewery,http://www.carolinabrewery.com/,United States,Pittsboro,NC,35.7436,-79.1648,"Fri, 31 Dec 2010 04:09:11 +0000",0,1,,,,182,3.45192,,1,235,213,0,,,,,,0.0,[],3.57639,False
0,5.4,"An authentic Bavarian-style ?Kristall Weizen? filtered wheat beer. The unique flavor created by the yeast has made this ale a summer favorite in the beer world.
Available April-September.",20,https://untappd.akamaized.net/site/beer_logos/beer-19355_451e3_sm.jpeg,https://untappd.akamaized.net/site/beer_logos_hd/beer-19355_6d6e5_hd.jpeg,Rockfish Wheat,blue-mountain-brewery-rockfish-wheat,Kristallweizen ,19355,4156,https://untappd.akamaized.net/site/brewery_logos/brewery-4156_c9b38.jpeg,Blue Mountain Brewery,blue-mountain-brewery,Micro Brewery,http://www.facebook.com/bluemountainbrewery,bluemtnbrewery,http://www.bluemountainbrewery.com/,United States,Afton,VA,38.016,-78.8225,"Fri, 31 Dec 2010 04:13:07 +0000",0,1,,,,4199,3.45183,,202,5536,4777,0,,,,,,0.0,[],3.46531,False
0,7.7,"A truly spiritual ale, Evil 8? will blur the lines of what you think you know about American beer.  Brewed in the Belgian Abbey style using caramelized Biscuit malt, Goldings hops and a unique strain of brewers? yeast.
Available January-April.",50,https://untappd.akamaized.net/site/beer_logos/beer-19356_ff72e_sm.jpeg,https://untappd.akamaized.net/site/beer_logos_hd/beer-19356_bacaf_hd.jpeg,Evil 8,blue-mountain-brewery-evil-8,Belgian Dubbel,19356,4156,https://untappd.akamaized.net/site/brewery_logos/brewery-4156_c9b38.jpeg,Blue Mountain Brewery,blue-mountain-brewery,Micro Brewery,http://www.facebook.com/bluemountainbrewery,bluemtnbrewery,http://www.bluemountainbrewery.com/,United States,Afton,VA,38.016,-78.8225,"Fri, 31 Dec 2010 04:15:36 +0000",0,1,,,,5142,3.54069,,209,6739,5744,0,,,,,,0.0,[],3.54687,False
0,6.82,"This English Pale Ale is a robust, full bodies beer. It has a moderate caramel flavor with a slight chocolate essence that brings out the sharp English hop flavor. ",0,https://untappd.akamaized.net/site/beer_logos/beer-OldePelican_19357.jpeg,,Olde Pelican,orlando-brewing-olde-pelican,Pale Ale - English,19357,5295,https://untappd.akamaized.net/site/brewery_logos/brewery-5295_38447.jpeg,Orlando Brewing,orlando-brewing,Micro Brewery,https://www.facebook.com/orlandobrewing?ref=hl,orlandobrewing,http://www.orlandobrewing.com,United States,Orlando,FL,28.5265,-81.3829,"Fri, 31 Dec 2010 04:16:29 +0000",0,1,,,,1826,3.42812,,30,2288,2117,0,,,,,,0.0,[],3.46001,False
0,9.0,,0,https://untappd.akamaized.net/site/beer_logos/beer-LaVacheFolleDoubleIPACentennial_19624.jpeg,,La Vache Folle: Centennial Double IPA,microbrasserie-charlevoix-la-vache-folle-centennial-double-ipa,IPA - Imperial / Double,19624,3103,https://untappd.akamaized.net/site/brewery_logos/brewery-3103_3cf52.jpeg,Microbrasserie Charlevoix,microbrasserie-charlevoix,Micro Brewery,http://www.facebook.com/microbrasseriecharlevoix,microbrasserie,http://www.microbrasserie.com/,Canada,Baie-Saint-Paul,QC,47.4424,-70.5041,"Fri, 31 Dec 2010 13:41:06 +0000",0,1,19624.0,"Thu, 01 Jan 1970 00:00:00 +0000",19358.0,18,3.75,,1,57,51,0,,,,,,0.0,[],3.65637,False
0,9.3,"The beer pours a brilliant gold with high carbonation and a fluffy white head. The aromas start with tropical fruit, spicy pepper, and bubble gum. The taste opens with light malt and a honey-like sweetness tempered by mint and peppery flavors. The beer transitions to herbal hoppy notes and a slightly nutty finish redolent of chestnuts. The finish is warming and dry, with a slight lingering bitterness. ",18,https://untappd.akamaized.net/site/beer_logos/beer-_19359_sm_40977588f651b14b06c35e855738b2.jpeg,,St. Vrain Tripel Ale,left-hand-brewing-company-st-vrain-tripel-ale,Belgian Tripel,19359,779,https://untappd.akamaized.net/site/brewery_logos/brewery-779_9fb2f.jpeg,Left Hand Brewing Company,left-hand-brewing-company,Micro Brewery,http://www.facebook.com/LeftHandBrewing,LeftHandBrewing,http://www.lefthandbrewing.com,United States,Longmont,CO,40.1586,-105.116,"Fri, 31 Dec 2010 04:20:20 +0000",0,1,,,,6288,3.76686,,222,7701,7071,0,,,,,,3.0,"[{'beer': {'bid': 1167720, 'beer_label': 'https://untappd.akamaized.net/site/assets/images/temp/badge-beer-default.png', 'beer_slug': 'left-hand-brewing-company-st-vrain-tripel-ale-2006', 'beer_name': 'St. Vrain Tripel Ale (2006)', 'is_vintage': 1, 'is_variant': 0}}, {'beer': {'bid': 1252882, 'beer_label': 'https://untappd.akamaized.net/site/assets/images/temp/badge-beer-default.png', 'beer_slug': 'left-hand-brewing-company-st-vrain-tripel-ale-2013', 'beer_name': 'St. Vrain Tripel Ale (2013)', 'is_vintage': 1, 'is_variant': 0}}, {'beer': {'bid': 1483464, 'beer_label': 'https://untappd.akamaized.net/site/assets/images/temp/badge-beer-default.png', 'beer_slug': 'left-hand-brewing-company-st-vrain-tripel-ale-2009', 'beer_name': 'St. Vrain Tripel Ale (2009)', 'is_vintage': 1, 'is_variant': 0}}]",3.76149,False
0,4.7,Organic. Numbered 85.000 bottles made. 4.7%,25,https://untappd.akamaized.net/site/assets/images/temp/badge-beer-default.png,,Lapin Kulta Tuisku,hartwall-lapin-kulta-tuisku,Spiced / Herbed Beer,19360,3264,https://untappd.akamaized.net/site/brewery_logos/brewery-3264_f7ef1.jpeg,Hartwall,hartwall,Macro Brewery,https://www.facebook.com/Hartwall1836/,Hartwall,http://www.hartwall.fi/,Finland,Helsinki,,60.238,24.8527,"Fri, 31 Dec 2010 04:20:31 +0000",0,1,,,,47,3.10638,,0,81,78,0,,,,,,0.0,[],3.57735,False
0,5.4,"The return of an old favorite! Rover?s Waggin' Red offers a rich copper color and a wealth of malty and caramel flavors. English First Gold hops provide balance and a pleasant, lasting finish to this delicious ale. ",30,https://untappd.akamaized.net/site/assets/images/temp/badge-beer-default.png,,Rover's Waggin Red,old-boys-brewhouse-rover-s-waggin-red,Other,19361,5292,https://untappd.akamaized.net/site/brewery_logos/brewery-OldBoysBrewhouse_5292.jpeg,Old Boys' Brewhouse,old-boys-brewhouse,Micro Brewery,http://www.facebook.com/oldboysbrewhouse,oldboysbrew,http://oldboysbrewhouse.com/,United States,Spring Lake,MI,43.077,-86.2122,"Fri, 31 Dec 2010 04:20:59 +0000",0,1,,,,18,3.30556,,0,29,24,0,,,,,,0.0,[],3.57572,False
0,0.0,,0,https://untappd.akamaized.net/site/assets/images/temp/badge-beer-default.png,,Apple Harvest Ale,old-boys-brewhouse-apple-harvest-ale,Belgian Tripel,86171,5292,https://untappd.akamaized.net/site/brewery_logos/brewery-OldBoysBrewhouse_5292.jpeg,Old Boys' Brewhouse,old-boys-brewhouse,Micro Brewery,http://www.facebook.com/oldboysbrewhouse,oldboysbrew,http://oldboysbrewhouse.com/,United States,Spring Lake,MI,43.077,-86.2122,"Sun, 09 Oct 2011 08:43:43 +0000",0,1,86171.0,"Tue, 19 Nov 2013 02:58:06 +0000",19362.0,6,0.0,,0,11,9,0,,,,,,0.0,[],3.50239,False
