auth_rating,beer_abv,beer_description,beer_ibu,beer_label,beer_label_hd,beer_name,beer_slug,beer_style,bid,brewery.brewery_id,brewery.brewery_label,brewery.brewery_name,brewery.brewery_slug,brewery.brewery_type,brewery.contact.facebook,brewery.contact.twitter,brewery.contact.url,brewery.country_name,brewery.location.brewery_city,brewery.location.brewery_state,brewery.location.lat,brewery.location.lng,collaborations_with.count,collaborations_with.items,created_at,is_homebrew,is_in_production,merge_details.master_bid,merge_details.merge_date,merge_details.requested_bid,rating_count,rating_score,rating_score_below,stats.monthly_count,stats.total_count,stats.total_user_count,stats.user_count,vintage_parent.beer.beer_abv,vintage_parent.beer.beer_name,vintage_parent.beer.beer_slug,vintage_parent.beer.bid,vintage_parent.beer.type_id,vintages.count,vintages.items,weighted_rating_score,wish_list
0,5.3,,0,https://untappd.akamaized.net/site/beer_logos/beer-ParagonApricotBlonde_7615.jpeg,,Paragon Apricot Blonde,dry-dock-brewing-co-paragon-apricot-blonde,Fruit Beer,7615,1551,https://untappd.akamaized.net/site/brewery_logos/brewery-1551_e4a28.jpeg,Dry Dock Brewing Company,dry-dock-brewing-company,Micro Brewery,http://www.facebook.com/DryDockBrewing,DryDockBrewing,http://www.drydockbrewing.com,United States,Aurora,CO,39.653,-104.812,,,"Sat, 06 Nov 2010 11:38:30 +0000",0,1,7615.0,"Fri, 06 Jan 2012 04:39:23 +0000",6495.0,0,0.0,True,0,0,0,0,,,,,,0.0,[],0.0,False
0,4.5,"Smithwick's is a clear beer with a rich ruby color and creamy head. Clean and delicate aroma with different individual notes: from the top fermentation by the Smithwick yeast come aromatic esters creating a fruity aroma. The Aroma Hops added late in the boil contribute clean fresh floral notes. Ale Malt contributes aroma hints of biscuit and caramel. 
Refreshing and clean taste with a gentle balance of bitterness from the hops added early in the boil, sweet/malty notes from the ale malt, and hints of roast/coffee from the roasted barley.  ",0,https://untappd.akamaized.net/site/beer_logos/beer-13388_02315_sm.jpeg,https://untappd.akamaized.net/site/beer_logos_hd/beer-13388_38d12_hd.jpeg,Smithwick's,guinness-smithwick-s,Red Ale - Irish,13388,49,https://untappd.akamaized.net/site/brewery_logos/brewery-49_a03fc.jpeg,Guinness,guinness,Macro Brewery,https://www.facebook.com/guinness,GuinnessIreland,http://www.guinness.com,Ireland,Dublin 8,,53.3177,-6.24094,,,"Tue, 07 Dec 2010 16:45:31 +0000",0,1,13388.0,"Thu, 01 Jan 1970 00:00:00 +0000",6496.0,171413,3.5201,,3833,318500,197583,0,,,,,,0.0,[],3.52034,False
0,5.1,"Named as a tribute to our good friends (and bad ass bike makers) at Fireman Texas Cruzer and because it was the fourth year-round beer we created, Firemans #4 is our most popular and best-selling beer to date. With an ever-drinkable balance of smooth malt and zesty hops, this refreshing blonde is perfect on a hot day or paired with spicy food. It?s no wonder why so many Texans love it. Take one for a spin at a watering hole near you and, if you?re looking for an awesome bike, we invite you to check out Firemans Texas Cruzer at firemansbikes.com.",23,https://untappd.akamaized.net/site/beer_logos/beer-6497_fbed6_sm.jpeg,https://untappd.akamaized.net/site/beer_logos_hd/beer-6497_fa54b_hd.jpeg,Firemans #4,real-ale-brewing-company-firemans-4,Blonde Ale,6497,1044,https://untappd.akamaized.net/site/brewery_logos/brewery-1044_fcb79.jpeg,Real Ale Brewing Company,real-ale-brewing-company,Micro Brewery,https://www.facebook.com/pages/Real-Ale-Brewing-Company/85360426538,RealAleBrewing,http://www.realalebrewing.com/,United States,Blanco,TX,30.1133,-98.4128,,,"Tue, 12 Oct 2010 18:28:23 +0000",0,1,,,,39901,3.468,,861,72659,46128,0,,,,,,5.0,"[{'beer': {'bid': 327003, 'beer_label': 'https://untappd.akamaized.net/site/assets/images/temp/badge-beer-default.png', 'beer_slug': 'real-ale-brewing-company-firemans-4-w-columbus-hops', 'beer_name': 'Firemans #4 (w/ Columbus Hops)', 'is_vintage': 0, 'is_variant': 1}}, {'beer': {'bid': 364300, 'beer_label': 'https://untappd.akamaized.net/site/assets/images/temp/badge-beer-default.png', 'beer_slug': 'real-ale-brewing-company-fireman-s-4-w-zythos-hops', 'beer_name': ""Fireman's #4 (w/ Zythos Hops)"", 'is_vintage': 0, 'is_variant': 1}}, {'beer': {'bid': 476440, 'beer_label': 'https://untappd.akamaized.net/site/assets/images/temp/badge-beer-default.png', 'beer_slug': 'real-ale-brewing-company-fireman-s-4-w-mosaic-hops', 'beer_name': ""Fireman's #4 (w/ Mosaic Hops)"", 'is_vintage': 0, 'is_variant': 1}}, {'beer': {'bid': 593209, 'beer_label': 'https://untappd.akamaized.net/site/assets/images/temp/badge-beer-default.png', 'beer_slug': 'real-ale-brewing-company-fireman-s-4-w-apollo-hops', 'beer_name': ""Fireman's #4 (w/ Apollo Hops)"", 'is_vintage': 0, 'is_variant': 1}}, {'beer': {'bid': 1889148, 'beer_label': 'https://untappd.akamaized.net/site/assets/images/temp/badge-beer-default.png', 'beer_slug': 'real-ale-brewing-company-firemans-4-w-lemondrop-meridian-eureka-dry-hop', 'beer_name': 'Firemans #4 (w/ Lemondrop, Meridian, Eureka Dry Hop)', 'is_vintage': 0, 'is_variant': 1}}]",3.46939,False
0,5.3,"Loosen your lederhosen. Our full-bodied OKTO Festival Ale is inspired by Bavarian Oktoberfest, and we pay fitting tribute with its distinctive malt flavors, mild floral character and crisp clean finish. Prost! To the land of the Prost!",28,https://untappd.akamaized.net/site/beer_logos/beer-_72240_sm_948f07d5b575c9e662f1fdc25a72e2.jpeg,https://untappd.akamaized.net/site/beer_logos_hd/beer-_72240_hd_37620c390f2cdedd3529f3b8d18212.jpeg,Okto Festival Ale,widmer-brothers-brewing-okto-festival-ale,M?rzen,72240,3028,https://untappd.akamaized.net/site/brewery_logos/brewery-3028_fdb36.jpeg,Widmer Brothers Brewing,widmer-brothers-brewing,Micro Brewery,http://www.facebook.com/WidmerBrothersBrewing,widmerbrothers,http://www.widmerbrothers.com,United States,Portland,OR,45.541,-122.676,,,"Mon, 15 Aug 2011 20:53:39 +0000",0,1,72240.0,"Thu, 01 Jan 1970 00:00:00 +0000",6498.0,17214,3.35404,,5,24529,19320,0,,,,,,0.0,[],3.35923,False
0,4.1,"A subtle blonde ale... golden, refreshing with a hint of citrus.",12,https://untappd.akamaized.net/site/assets/images/temp/badge-beer-default.png,,Tick Tock Ale,watch-city-brewing-company-tick-tock-ale,Blonde Ale,6499,1496,https://untappd.akamaized.net/site/brewery_logos/brewery-WatchCityBrewingCompany_1496.jpeg,Watch City Brewing Company,watch-city-brewing-company,Micro Brewery,,Hopsexplosion,http://watchcitybrew.com,United States,Waltham,MA,42.3718,-71.2367,,,"Wed, 13 Oct 2010 09:34:46 +0000",0,0,,,,46,3.29348,,0,71,68,0,,,,,,0.0,[],3.54431,False
0,4.7,"Renowned for its golden color, distinctive creamy head, smooth body and easy drinking character, Boddingtons is a medium-bodied pale ale. It has a creamy, malty and slightly sweet flavor and features a clean, pleasant aftertaste.",0,https://untappd.akamaized.net/site/assets/images/temp/badge-beer-default.png,,Boddingtons Pub Ale,,Other,14932,148,https://untappd.akamaized.net/site/brewery_logos/brewery-BoddingtonsBreweryInBev_148.jpeg,Boddington's Brewery,boddingtons-brewery,Macro Brewery,https://www.facebook.com/abinbev,abinbevnews,http://www.ab-inbev.co.uk,England,Shamlesbury,Lancashire,53.7622,-2.6113,,,"Thu, 16 Dec 2010 08:53:46 +0000",0,1,14932.0,"Thu, 01 Jan 1970 00:00:00 +0000",6500.0,0,0.0,True,0,0,0,0,,,,,,0.0,[],0.0,False
0,18.0,"We wondered what would happen if a monstrous pumpkin ale, plump full of spicy gourdiness, were aged in fine fresh rum barrels to add suggestions of delicate oak and candied molasses. Rumpkin is what happened! This first member of the Annual Barrel-Aged Series was brewed with roasted pumpkins from a local Boulder County farm, and spiced with nutmeg, cinnamon, and ginger.",0,https://untappd.akamaized.net/site/beer_logos/beer-Rumpkin_6501.jpeg,,Rumpkin,avery-brewing-company-rumpkin,Pumpkin / Yam Beer,6501,62,https://untappd.akamaized.net/site/brewery_logos/brewery-avery.jpg,Avery Brewing Co.,avery-brewing-co,Micro Brewery,https://www.facebook.com/AveryBrewingCo,AveryBrewingCo,http://www.averybrewing.com/,United States,Boulder,CO,40.0625,-105.205,,,"Wed, 13 Oct 2010 11:00:23 +0000",0,1,,,,19998,4.09063,,159,25279,22474,0,,,,,,5.0,"[{'beer': {'bid': 106414, 'beer_label': 'https://untappd.akamaized.net/site/beer_logos/beer-Rumpkin2011_106414.jpeg', 'beer_slug': 'avery-brewing-company-rumpkin-2011', 'beer_name': 'Rumpkin (2011)', 'is_vintage': 1, 'is_variant': 0}}, {'beer': {'bid': 238072, 'beer_label': 'https://untappd.akamaized.net/site/beer_logos/beer-Rumpkin_6501.jpeg', 'beer_slug': 'avery-brewing-company-rumpkin-2012', 'beer_name': 'Rumpkin (2012)', 'is_vintage': 1, 'is_variant': 0}}, {'beer': {'bid': 447320, 'beer_label': 'https://untappd.akamaized.net/site/beer_logos/beer-Rumpkin_6501.jpeg', 'beer_slug': 'avery-brewing-company-rumpkin-2013', 'beer_name': 'Rumpkin (2013)', 'is_vintage': 1, 'is_variant': 0}}, {'beer': {'bid': 759946, 'beer_label': 'https://untappd.akamaized.net/site/beer_logos/beer-Rumpkin_6501.jpeg', 'beer_slug': 'avery-brewing-company-rumpkin-2010', 'beer_name': 'Rumpkin (2010)', 'is_vintage': 1, 'is_variant': 0}}, {'beer': {'bid': 827989, 'beer_label': 'https://untappd.akamaized.net/site/beer_logos/beer-Rumpkin_6501.jpeg', 'beer_slug': 'avery-brewing-company-rumpkin-2014', 'beer_name': 'Rumpkin (2014)', 'is_vintage': 1, 'is_variant': 0}}]",4.08401,False
0,6.5,"Avery IPA features a citrusy, floral bouquet and a rich, malty finish. ",69,https://untappd.akamaized.net/site/beer_logos/beer-10773_00c41_sm.jpeg,https://untappd.akamaized.net/site/beer_logos_hd/beer-10773_dd286_hd.jpeg,India Pale Ale (IPA),avery-brewing-co-india-pale-ale-ipa,IPA - American,10773,62,https://untappd.akamaized.net/site/brewery_logos/brewery-avery.jpg,Avery Brewing Co.,avery-brewing-co,Micro Brewery,https://www.facebook.com/AveryBrewingCo,AveryBrewingCo,http://www.averybrewing.com/,United States,Boulder,CO,40.0625,-105.205,,,"Wed, 24 Nov 2010 13:20:29 +0000",0,1,10773.0,"Thu, 01 Jan 1970 00:00:00 +0000",6502.0,73595,3.61762,,1367,115776,83089,0,,,,,,0.0,[],3.61775,False
0,5.2,A traditional European style ale handcrafted by the Samuel Adams brewers. Only available on-tap in select locations in and around Boston. See http://www.samueladams.com for a list of participating locations. ,0,https://untappd.akamaized.net/site/beer_logos/beer-SamuelAdamsBostonBrickRed_6503.jpeg,,Samuel Adams Boston Brick Red,boston-beer-company-samuel-adams-boston-brick-red,Red Ale - Irish,6503,157,https://untappd.akamaized.net/site/brewery_logos/brewery-157_6a2d2.jpeg,Boston Beer Company,boston-beer-company,Micro Brewery,https://www.facebook.com/SamuelAdams,SamuelAdamsBeer,http://www.samueladams.com,United States,Boston,MA,42.3144,-71.1034,,,"Wed, 13 Oct 2010 12:06:07 +0000",0,1,,,,19156,3.72232,,401,28687,21993,0,,,,,,0.0,[],3.7212,False
0,6.2,"Redhook Long Hammer IPA is a West Coast classic. The generous addition of hops during the brewing and fermentation process gives our India Pale Ale its characteristic bitterness and piney citrus aroma and flavor.  Piney aromas and citrus flavors come from a generous addition of hops during the boil and dry-hopping at the end of fermentation. Tracing its heritage from another Redhook classic beer, Ballard Bitter, Long Hammer IPA is one of America?s favorite IPAs and Seattle?s #1 local IPA.",44,https://untappd.akamaized.net/site/beer_logos/beer-6504_869af_sm.jpeg,https://untappd.akamaized.net/site/beer_logos_hd/beer-6504_2da4c_hd.jpeg,Long Hammer IPA,redhook-brewery-long-hammer-ipa,IPA - American,6504,1051,https://untappd.akamaized.net/site/brewery_logos/brewery-1051_681b0.jpeg,Redhook Brewery,redhook-brewery,Micro Brewery,http://www.facebook.com/RedhookAleBrewery,Redhook_Brewery,http://redhook.com/,United States,Woodinville,WA,47.7348,-122.149,,,"Wed, 13 Oct 2010 12:28:58 +0000",0,1,,,,129558,3.46577,,1833,221481,145549,0,,,,,,0.0,[],3.4662,False
0,4.5,"Our summer seasonal! Brewed with orange zest and coriander- dry, effervescent, refreshing with hints of spice and citrus!",0,https://untappd.akamaized.net/site/beer_logos/beer-_6505_sm_0fcbe555bd6bc0d419794250828017.jpeg,https://untappd.akamaized.net/site/beer_logos_hd/beer-_6505_hd_9ae84862923fca543485831cebda3c.jpeg,Saison,black-oak-brewing-company-saison,Saison / Farmhouse Ale,6505,1500,https://untappd.akamaized.net/site/brewery_logos/brewery-blackoakbrewingcompany_1500.jpeg,Black Oak Brewing Company,black-oak-brewing-company,Micro Brewery,http://www.facebook.com/blackoakbrewery,BlackOakBrewing,http://www.blackoakbeer.com/,Canada,Etobicoke,ON,43.6143,-79.5173,,,"Wed, 13 Oct 2010 12:53:28 +0000",0,0,,,,1333,3.47993,,0,2036,1497,0,,,,,,0.0,[],3.51154,False
0,6.0,"Broken Halo IPA is a beer produced in the spirit of traditional IPA products shipped from the UK to India in the late 1800s. The almost excessive amounts of Cascade and Columbus hops used in Broken Halo give it notable citrus and grapefruit aromas and flavors. The beer bitterness measures high but tastes smooth due to the full-bodied, Caramel malt sweetness.",0,https://untappd.akamaized.net/site/beer_logos/beer-BrokenHaloIPA_6506.jpeg,,Broken Halo IPA,widmer-brothers-brewing-broken-halo-ipa,IPA - American,6506,3028,https://untappd.akamaized.net/site/brewery_logos/brewery-3028_fdb36.jpeg,Widmer Brothers Brewing,widmer-brothers-brewing,Micro Brewery,http://www.facebook.com/WidmerBrothersBrewing,widmerbrothers,http://www.widmerbrothers.com,United States,Portland,OR,45.541,-122.676,,,"Wed, 13 Oct 2010 13:20:46 +0000",0,0,,,,292,3.33904,,0,584,466,0,,,,,,0.0,[],3.49799,False
0,0.0,Pink colored Belgian White,0,https://untappd.akamaized.net/site/assets/images/temp/badge-beer-default.png,,Thank You Mamm Belgian White,automatic-brewing-co-thank-you-mamm-belgian-white,Witbier,6507,1556,https://untappd.akamaized.net/site/brewery_logos/brewery-AutomaticBrewingCo_1556.jpeg,Automatic Brewing Co.,automatic-brewing-co,Micro Brewery,https://www.facebook.com/pages/AutomaticBrewingCo/114145628625452,AutomaticBrewCo,http://www.automaticbrewingco.com/,United States,San Diego,CA,32.7635,-117.12,,,"Wed, 13 Oct 2010 13:37:30 +0000",0,1,,,,13,3.23077,,0,29,28,0,,,,,,0.0,[],3.57554,False
0,3.8,"Our Even Keel is a hoppy ale designed for smooth sailing. A full-flavored beer with a silky malt backbone and a bright hop profile of herbs and citrus, it packs all the taste of an IPA in  a session able alchohol content. This ale is perfect for leisurely days on the water, when all you want are a few beers and a level ride. ",51,https://untappd.akamaized.net/site/beer_logos/beer-6508_7178e_sm.jpeg,https://untappd.akamaized.net/site/beer_logos_hd/beer-6508_ec7b9_hd.jpeg,Even Keel,ballast-point-brewing-and-spirits-even-keel,IPA - Session / India Session Ale,6508,68,https://untappd.akamaized.net/site/brewery_logos/brewery-ballastpointbrewingcompany_68.jpeg,Ballast Point Brewing & Spirits,ballast-point-brewing-spirits,Macro Brewery,http://www.facebook.com/BallastPoint,bpbrewing,http://www.ballastpoint.com/,United States,San Diego,CA,32.8882,-117.158,,,"Wed, 13 Oct 2010 14:20:04 +0000",0,1,,,,53360,3.65928,,607,76213,59015,0,,,,,,5.0,"[{'beer': {'bid': 593928, 'beer_label': 'https://untappd.akamaized.net/site/assets/images/temp/badge-beer-default.png', 'beer_slug': 'ballast-point-brewing-spirits-keel-reserve', 'beer_name': 'Keel Reserve', 'is_vintage': 0, 'is_variant': 1}}, {'beer': {'bid': 802825, 'beer_label': 'https://untappd.akamaized.net/site/assets/images/temp/badge-beer-default.png', 'beer_slug': 'ballast-point-brewing-and-spirits-even-keel-session-ale-with-rum-soaked-oak-spirals', 'beer_name': 'Even Keel Session Ale With Rum Soaked Oak Spirals', 'is_vintage': 0, 'is_variant': 1}}, {'beer': {'bid': 815094, 'beer_label': 'https://untappd.akamaized.net/site/assets/images/temp/badge-beer-default.png', 'beer_slug': 'ballast-point-brewing-and-spirits-simcoe-wet-hop-even-keel', 'beer_name': 'Simcoe Wet Hop Even Keel', 'is_vintage': 0, 'is_variant': 1}}, {'beer': {'bid': 952541, 'beer_label': 'https://untappd.akamaized.net/site/assets/images/temp/badge-beer-default.png', 'beer_slug': 'ballast-point-brewing-and-spirits-even-keel-cask-w-ginger-cilantro-and-lime', 'beer_name': 'Even Keel Cask W/ Ginger Cilantro & Lime', 'is_vintage': 0, 'is_variant': 1}}, {'beer': {'bid': 1139241, 'beer_label': 'https://untappd.akamaized.net/site/assets/images/temp/badge-beer-default.png', 'beer_slug': 'ballast-point-brewing-spirits-spiced-even-keel-session', 'beer_name': 'Spiced Even Keel Session', 'is_vintage': 0, 'is_variant': 1}}]",3.65923,False
0,6.5,The Dark Lager cousin of the famous Beer Lao,0,https://untappd.akamaized.net/site/beer_logos/beer-_251717_8a07eb9d5f78032b6505d196c939.jpeg,,Beerlao Dark,lao-brewery-beerlao-dark,Lager - Dark,251717,1558,https://untappd.akamaized.net/site/brewery_logos/brewery-1558_96fcb.jpeg,Lao Brewery,lao-brewery,Macro Brewery,,,http://www.beerlao.la/,Laos,,Vientiane,17.8702,102.655,,,"Wed, 24 Oct 2012 06:35:30 +0000",0,1,251717.0,"Thu, 07 Feb 2013 21:14:31 +0000",6509.0,6978,3.23169,,262,8989,7904,0,,,,,,0.0,[],3.2493,False
0,8.2,"Inspired by the centuries-old brewing practices of the Belgian Trappist monks, this burgundian brew gives off a variety of aromas, including plum and cinnamon, and packs in flavors such as caramel, toffee, and licorice.",20,https://untappd.akamaized.net/site/beer_logos/beer-6510_37e5f_sm.jpeg,https://untappd.akamaized.net/site/beer_logos_hd/beer-6510_491c7_hd.jpeg,Abbey Ale,brewery-ommegang-abbey-ale,Belgian Dubbel,6510,249,https://untappd.akamaized.net/site/brewery_logos/brewery-249_20027.jpeg,Brewery Ommegang,brewery-ommegang,Micro Brewery,http://www.facebook.com/ommegang,BreweryOmmegang,http://www.ommegang.com/,United States,Cooperstown,NY,42.6818,-74.9255,,,"Wed, 13 Oct 2010 14:27:32 +0000",0,1,,,,62907,3.80622,,577,89106,70958,0,,,,,,5.0,"[{'beer': {'bid': 32152, 'beer_label': 'https://untappd.akamaized.net/site/assets/images/temp/badge-beer-default.png', 'beer_slug': 'brewery-ommegang-abbey-ale-bourbon-barrel-aged', 'beer_name': 'Abbey Ale (Bourbon Barrel Aged)', 'is_vintage': 0, 'is_variant': 1}}, {'beer': {'bid': 210768, 'beer_label': 'https://untappd.akamaized.net/site/assets/images/temp/badge-beer-default.png', 'beer_slug': 'brewery-ommegang-abbey-ale-2008', 'beer_name': 'Abbey Ale (2008)', 'is_vintage': 1, 'is_variant': 0}}, {'beer': {'bid': 286905, 'beer_label': 'https://untappd.akamaized.net/site/assets/images/temp/badge-beer-default.png', 'beer_slug': 'brewery-ommegang-abbey-ale-2005', 'beer_name': 'Abbey Ale (2005)', 'is_vintage': 1, 'is_variant': 0}}, {'beer': {'bid': 1712347, 'beer_label': 'https://untappd.akamaized.net/site/assets/images/temp/badge-beer-default.png', 'beer_slug': 'brewery-ommegang-abbey-2003', 'beer_name': 'Abbey (2003)', 'is_vintage': 1, 'is_variant': 0}}, {'beer': {'bid': 1974313, 'beer_label': 'https://untappd.akamaized.net/site/assets/images/temp/badge-beer-default.png', 'beer_slug': 'brewery-ommegang-abbey-ale-2007', 'beer_name': 'Abbey Ale (2007)', 'is_vintage': 1, 'is_variant': 0}}]",3.80547,False
0,8.4,"Tripel Karmeliet is still brewed to an authentic beer recipe from 1679 originating in the former Carmelite monastery in Dendermonde. Written over 300 years ago, this recipe describes the use of three kinds of grain: wheat, oats and barley.

The name Tripel karmeliet thus refers both to its origin and its in-bottle refermentation. From many trial brews of multigrain tripels carried out at our brewery in the 90s, it appears that the particular historic combination of the 3 kinds of grain still remains the ideal blend.",16,https://untappd.akamaized.net/site/beer_logos/beer-TripelKarmeliet_6511.jpeg,,Tripel Karmeliet,brouwerij-bosteels-tripel-karmeliet,Belgian Tripel,6511,269,https://untappd.akamaized.net/site/brewery_logos/brewery-BrouwerijBosteels_269.jpeg,Brouwerij Bosteels,brouwerij-bosteels,Micro Brewery,https://www.facebook.com/Brouwerij-Bosteels-188127494594353,,http://www.bestbelgianspecialbeers.be,Belgium,Buggenhout,Oost-Vlaanderen,51.0137,4.2018,,,"Wed, 13 Oct 2010 16:07:24 +0000",0,1,,,,154670,4.04549,,5976,277066,171886,0,,,,,,5.0,"[{'beer': {'bid': 628860, 'beer_label': 'https://untappd.akamaized.net/site/beer_logos/beer-TripelKarmeliet_6511.jpeg', 'beer_slug': 'brouwerij-bosteels-tripel-karmeliet-1997', 'beer_name': 'Tripel Karmeliet (1997)', 'is_vintage': 1, 'is_variant': 0}}, {'beer': {'bid': 667875, 'beer_label': 'https://untappd.akamaized.net/site/beer_logos/beer-TripelKarmeliet_6511.jpeg', 'beer_slug': 'brouwerij-bosteels-tripel-karmeliet-2014', 'beer_name': 'Tripel Karmeliet (2014)', 'is_vintage': 1, 'is_variant': 0}}, {'beer': {'bid': 748729, 'beer_label': 'https://untappd.akamaized.net/site/beer_logos/beer-TripelKarmeliet_6511.jpeg', 'beer_slug': 'brouwerij-bosteels-tripel-karmeliet-2013', 'beer_name': 'Tripel Karmeliet (2013)', 'is_vintage': 1, 'is_variant': 0}}, {'beer': {'bid': 858500, 'beer_label': 'https://untappd.akamaized.net/site/beer_logos/beer-TripelKarmeliet_6511.jpeg', 'beer_slug': 'brouwerij-bosteels-tripel-karmeliet-2008', 'beer_name': 'Tripel Karmeliet (2008)', 'is_vintage': 1, 'is_variant': 0}}, {'beer': {'bid': 865245, 'beer_label': 'https://untappd.akamaized.net/site/beer_logos/beer-TripelKarmeliet_6511.jpeg', 'beer_slug': 'brouwerij-bosteels-tripel-karmeliet-2011', 'beer_name': 'Tripel Karmeliet (2011)', 'is_vintage': 1, 'is_variant': 0}}]",4.04471,False
0,6.0,,0,https://untappd.akamaized.net/site/beer_logos/beer-_6512_sm_b197d93316434eff110d3e3321e1e4.jpeg,https://untappd.akamaized.net/site/beer_logos_hd/beer-_6512_hd_73f234b7f516a87c432f1e0d0b4e50.jpeg,Winter Welcome Ale 2009-2010,samuel-smith-s-old-brewery-winter-welcome-ale-2009-2010,Winter Ale,6512,1099,https://untappd.akamaized.net/site/brewery_logos/brewery-SamuelSmithOldBreweryTadcaster_1099.jpeg,Samuel Smith's Old Brewery,samuel-smiths-old-brewery,Micro Brewery,https://www.facebook.com/Samuel-Smiths-Brewery-1399982133640570/,samsmithsbeer,http://www.samuelsmithsbrewery.co.uk,England,Tadcaster,North Yorkshire,53.8821,-1.26197,,,"Wed, 13 Oct 2010 16:28:33 +0000",0,0,,,,97,3.65206,,0,163,143,0,,,,,,0.0,[],3.65062,False
0,4.0,,0,https://untappd.akamaized.net/site/assets/images/temp/badge-beer-default.png,,Georg-Pils Hell,brauhaus-georgbraeu-georg-pils-hell,Pilsner - German,6513,1559,https://untappd.akamaized.net/site/brewery_logos/brewery-BrauhausGeorgbraeu_1559.jpeg,Brauhaus Georgbraeu,brauhaus-georgbraeu,Brew Pub,,,http://www.georgbraeu.de,Germany,10178 Berlin,,52.5166,13.4052,,,"Wed, 13 Oct 2010 18:14:43 +0000",0,1,,,,652,3.40951,,23,794,744,0,,,,,,0.0,[],3.4866,False
0,6.5,"In the Middle Ages, regular beer brewers were far more heavily taxed than abbeys. Therefore, the Grimbergen Fathers used refined raw materials of a higher quality. Combining exclusive ingredients with their brewing expertise, they created Grimbergen Double-Ambr?e, a dark-coloured amber ale with bittersweet flavours and hints of caramel, dried plums and double-fermented malts and hops. The beer was so delicious that people said it had ?double? the taste!",22,https://untappd.akamaized.net/site/beer_logos/beer-_343179_sm_152bc374be9a47bc0be81c6661deae.jpeg,https://untappd.akamaized.net/site/beer_logos_hd/beer-_343179_hd_05dbff3cd5643bea31ad1ac8278024.jpeg,Grimbergen Double Ambr?e,brasseries-kronenbourg-grimbergen-double-ambree,Belgian Dubbel,343179,203,https://untappd.akamaized.net/site/brewery_logos/brewery-203_6e794.jpeg,Kronenbourg,kronenbourg,Macro Brewery,https://www.facebook.com/Kronenbourg.SAS/,Kronenbourg_SAS,http://www.brasseries-kronenbourg.com,France,Obernai,Bas-Rhin,48.466,7.49557,,,"Wed, 10 Apr 2013 12:28:51 +0000",0,1,343179.0,"Mon, 25 Jul 2016 20:25:24 +0000",6514.0,20307,3.53363,,673,26536,22113,0,,,,,,0.0,[],3.53537,False
0,4.3,"Sweet, more malt-forward than many other American Pale Ales. Bright copper in color and brewed with fresh ginger root for a nice background spice. This beer is light in body, full in flavor and very easy to drink.",35,https://untappd.akamaized.net/site/beer_logos/beer-PorkslapPaleAle_6515.jpeg,,Porkslap Pale Ale,butternuts-beer-ale-porkslap-pale-ale,Pale Ale - American,6515,1560,https://untappd.akamaized.net/site/brewery_logos/brewery-1560_5089a.jpeg,Butternuts Beer & Ale,butternuts-beer-ale,Micro Brewery,https://www.facebook.com/ButternutsBeer/,ButternutsBeer,http://www.butternutsbeerandale.com,United States,Garrattsville,NY,42.6291,-75.1855,,,"Thu, 14 Oct 2010 05:37:24 +0000",0,1,,,,24483,3.20706,,330,34274,28336,0,,,,,,0.0,[],3.21254,False
0,6.2,"Hoss is based on the M?rzen lagers of Germany. Rich, layered malt notes, with hints of cherry and dark fruits, dominate, while the unique addition of rye imparts a slightly earthy, spicy character. Hoss finishes crisp and dry, and its brilliant red-orange color is a toast to the sunsets that make the perfect backdrop for this beer.",0,https://untappd.akamaized.net/site/beer_logos/beer-Hoss_6516.jpeg,,Hoss,great-divide-brewing-company-hoss,M?rzen,6516,604,https://untappd.akamaized.net/site/brewery_logos/brewery-604_621e5.jpeg,Great Divide Brewing Company,great-divide-brewing-company,Micro Brewery,http://www.facebook.com/greatdividebrew,greatdividebrew,http://greatdivide.com/,United States,Denver,CO,39.7538,-104.988,,,"Thu, 14 Oct 2010 07:04:20 +0000",0,1,,,,27162,3.51309,,48,37309,31122,0,,,,,,0.0,[],3.51462,False
0,0.0,,0,https://untappd.akamaized.net/site/assets/images/temp/badge-beer-default.png,,Copper Ale,water-street-brewery-wisconsin-copper-ale,Red Ale - American Amber / Red,6517,1339,https://untappd.akamaized.net/site/brewery_logos/brewery-WaterStreetBreweryWisconsin_1339.jpeg,Water Street Brewery (Wisconsin),water-street-brewery-wisconsin,Brew Pub,http://www.facebook.com/groups/41338662620/,waterstreetbrew,http://www.waterstreetbrewery.com/,United States,Milwaukee,WI,43.0448,-87.9112,,,"Thu, 14 Oct 2010 09:07:35 +0000",0,1,,,,0,0.0,,0,6,6,0,,,,,,0.0,[],3.59537,False
