auth_rating,beer_abv,beer_description,beer_ibu,beer_label,beer_label_hd,beer_name,beer_slug,beer_style,bid,brewery.brewery_id,brewery.brewery_label,brewery.brewery_name,brewery.brewery_slug,brewery.brewery_type,brewery.contact.facebook,brewery.contact.twitter,brewery.contact.url,brewery.country_name,brewery.location.brewery_city,brewery.location.brewery_state,brewery.location.lat,brewery.location.lng,collaborations_with.count,collaborations_with.items,created_at,is_homebrew,is_in_production,merge_details.master_bid,merge_details.merge_date,merge_details.requested_bid,rating_count,rating_score,rating_score_below,stats.monthly_count,stats.total_count,stats.total_user_count,stats.user_count,variant_parent.beer.beer_abv,variant_parent.beer.beer_name,variant_parent.beer.beer_slug,variant_parent.beer.bid,variant_parent.beer.type_id,vintages.count,vintages.items,weighted_rating_score,wish_list
0,8.2,A raging mouthful of fresh Hops and Malt. Caution: May remove enamel from teeth.,72,https://untappd.akamaized.net/site/beer_logos/beer-5771_1adab_sm.jpeg,https://untappd.akamaized.net/site/beer_logos_hd/beer-5771_ae57d_hd.jpeg,Maximus,lagunitas-brewing-company-maximus,IPA - Imperial / Double,5771,765,https://untappd.akamaized.net/site/brewery_logos/brewery-765_b53eb.jpeg,Lagunitas Brewing Company,lagunitas-brewing-company,Micro Brewery,https://www.facebook.com/LagunitasBrewingCo,lagunitasbeer,http://www.LAGUNITAS.com/,United States,Petaluma,CA,38.2724,-122.662,,,"Sat, 21 Aug 2010 09:26:35 +0000",0,1,5771.0,"Thu, 01 Jan 1970 00:00:00 +0000",16731.0,134261,3.93019,,2489,230482,147544,0,,,,,,5.0,"[{'beer': {'bid': 823573, 'beer_label': 'https://untappd.akamaized.net/site/assets/images/temp/badge-beer-default.png', 'beer_slug': 'lagunitas-brewing-company-sebasto-max', 'beer_name': 'Sebasto-Max', 'is_vintage': 0, 'is_variant': 1}}, {'beer': {'bid': 837880, 'beer_label': 'https://untappd.akamaized.net/site/assets/images/temp/badge-beer-default.png', 'beer_slug': 'lagunitas-brewing-company-maximus-w-mosaic', 'beer_name': 'Maximus (w/ Mosaic)', 'is_vintage': 0, 'is_variant': 1}}, {'beer': {'bid': 1203421, 'beer_label': 'https://untappd.akamaized.net/site/assets/images/temp/badge-beer-default.png', 'beer_slug': 'lagunitas-brewing-company-maximus-w-mango-puree', 'beer_name': 'Maximus (w/ Mango Puree)', 'is_vintage': 0, 'is_variant': 1}}, {'beer': {'bid': 1400130, 'beer_label': 'https://untappd.akamaized.net/site/assets/images/temp/badge-beer-default.png', 'beer_slug': 'lagunitas-brewing-company-maximus-w-citra', 'beer_name': 'Maximus (w/ Citra)', 'is_vintage': 0, 'is_variant': 1}}, {'beer': {'bid': 1993397, 'beer_label': 'https://untappd.akamaized.net/site/assets/images/temp/badge-beer-default.png', 'beer_slug': 'lagunitas-brewing-company-maximus-2017', 'beer_name': 'Maximus (2017)', 'is_vintage': 1, 'is_variant': 0}}]",3.92956,False
0,4.7,"Labelled as ""Dark"" when on draft.

Plunge the deep dark depths of this highly sessionable porter &
surface refreshed & ready for another. A spectrum of unusual roasted malts give a
deep, rich charcter of rum, raisin
& chocolate.",0,https://untappd.akamaized.net/site/beer_logos/beer-53026_cd2f9_sm.jpeg,https://untappd.akamaized.net/site/beer_logos_hd/beer-53026_c7124_hd.jpeg,Darkness London Porter,badlands-brewery-darkness-london-porter,Porter - English,53026,4322,https://untappd.akamaized.net/site/brewery_logos/brewery-BadlandsBrewery_4322.jpeg,Badlands Brewery,badlands-brewery,Micro Brewery,http://www.facebook.com/pages/Badlands-Brewery/114134468637271,BadlandsBrewery,http://www.badlandsbrewery.com.au,Australia,Orange,NSW,-33.2575,149.075,,,"Thu, 26 May 2011 21:08:17 +0000",0,1,53026.0,"Thu, 01 Jan 1970 00:00:00 +0000",16734.0,502,3.57819,,9,696,540,0,,,,,,0.0,[],3.60567,False
0,0.0,,0,https://untappd.akamaized.net/site/assets/images/temp/badge-beer-default.png,,Otto Bruckman Bavarian Bock,cold-spring-brewery-otto-bruckman-bavarian-bock,Bock,16737,392,https://untappd.akamaized.net/site/brewery_logos/brewery-ColdSpringBrewing_392.jpeg,Cold Spring Brewery,cold-spring-brewery,Micro Brewery,,ColdSpringBrew,http://www.coldspringbrewery.com,United States,Cold Spring,MN,45.4582,-94.4291,,,"Fri, 24 Dec 2010 15:28:59 +0000",0,1,,,,3,0.0,,0,4,4,0,,,,,,0.0,[],3.57418,False
0,8.15,"As a double IPA, this beast employs a sizable malt bill, but it is the crazy amount of hops added to the boil every 4 minutes, for 120 minutes, that really make this beer special. Fruity, floral, and piney hop flavors penetrate throughout the caramelized malt profile. Liberator is a well-balanced, full bodied brew that has a bitter finish due to the post fermentation addition of lemon and orange zest. The original batch brewed on the Bellaire system had 42lbs of hops in it, compared to Huma, which has around 20lbs of hops per batch. Today?s Elk Rapids batches have up to 138lbs of hops. The name, Liberator, came from Joe?s name for the Short?s employees who carry out our company?s mission statement as ?Beer Liberators?, freeing the masses from their misconceptions surrounding beer.",116,https://untappd.akamaized.net/site/beer_logos/beer-_12316_20b1fbcce6fe0e83c9378b0d354d.jpeg,,The Liberator,short-s-brewing-company-the-liberator,IPA - Imperial / Double,12316,1139,https://untappd.akamaized.net/site/brewery_logos/brewery-shortsbrewingcompany_1139.jpeg,Short's Brewing Company,short-s-brewing-company,Micro Brewery,http://www.facebook.com/ShortsBrewing,ShortsBrewing,http://www.shortsbrewing.com/,United States,Bellaire,MI,44.9763,-85.2104,,,"Thu, 02 Dec 2010 06:56:15 +0000",0,1,12316.0,"Thu, 01 Jan 1970 00:00:00 +0000",16742.0,6075,3.82979,,55,11204,6813,0,,,,,,0.0,[],3.82124,False
0,4.2,"Chili in the aroma. Chili on the palate. Chili. Pairs well with a ... chili.
Premium lager beer with a chili pepper added.",0,https://untappd.akamaized.net/site/beer_logos/beer-OriginalC_77737.jpeg,,Original C Cave Creek Chili Beer - Cerveza Con Chili,cerveceria-mexicana-original-c-cave-creek-chili-beer-cerveza-con-chili,Spiced / Herbed Beer,77737,3254,https://untappd.akamaized.net/site/brewery_logos/brewery-3254_4076a.jpeg,Cervecer?a Mexicana,cerveceria-mexicana,Macro Brewery,http://www.facebook.com/pages/Mexicali-Beer/107253925960047?ref=ts,mexicalibeer,http://mexicalibeer.com,Mexico,Tecate,Baja California,32.5749,-116.616,,,"Fri, 09 Sep 2011 17:11:20 +0000",0,1,77737.0,"Thu, 01 Jan 1970 00:00:00 +0000",16752.0,9440,2.75906,,123,12237,10835,0,,,,,,0.0,[],2.78697,False
0,7.8,,0,https://untappd.akamaized.net/site/assets/images/temp/badge-beer-default.png,,Spring Buck,old-dominion-brewing-co-spring-buck,Pale Ale - Belgian,16758,940,https://untappd.akamaized.net/site/brewery_logos/brewery-940_9079c.jpeg,Dominion Brewing Co.,dominion-brewing-co,Micro Brewery,https://www.facebook.com/pages/Old-Dominion-Brewing-Co/112009196447?ref=ts,FoDoBrewing,http://www.fordhamanddominion.com,United States,Dover,DE,39.154,-75.4884,,,"Fri, 24 Dec 2010 15:52:21 +0000",0,0,,,,10,3.1,,0,15,15,0,,,,,,0.0,[],3.62168,False
0,10.0,2010 Limited Edition.,0,https://untappd.akamaized.net/site/beer_logos/beer-DoubleBarrelOakAgedChristmalAle_16765.jpeg,,Double Barrel Oak Aged Christmal Ale,red-hill-brewery-double-barrel-oak-aged-christmal-ale,Belgian Strong Dark Ale,16765,2985,https://untappd.akamaized.net/site/brewery_logos/brewery-RedHillBrewery_2985.jpeg,Red Hill Brewery,red-hill-brewery,Nano Brewery,http://www.facebook.com/redhillbrewery,RedHillBrewery,http://redhillbrewery.com.au/,Australia,Red Hill South,VIC,-38.391,145.018,,,"Fri, 24 Dec 2010 15:59:51 +0000",0,1,,,,11,4.04545,,0,18,15,0,,,,,,0.0,[],3.65865,False
0,5.0,This bold black cherry cider is made from premium fruit sourced from the lush Okanagan Valley. It's a delicious blend with the refreshing taste of black cherries. It's Seriously Good Cider?.,0,https://untappd.akamaized.net/site/beer_logos/beer-392112_1ae95_sm.jpeg,https://untappd.akamaized.net/site/beer_logos_hd/beer-392112_8cf51_hd.jpeg,Black Cherry,okanagan-cider-company-black-cherry,Cider,392112,18453,https://untappd.akamaized.net/site/brewery_logos/brewery-18453_725e3.jpeg,Okanagan Cider Company,okanagan-cider-company,Cidery / Meadery,,,www.okanagancider.ca,Canada,Vancouver,BC,49.2659,-123.085,,,"Mon, 24 Jun 2013 21:49:31 +0000",0,1,392112.0,"Tue, 04 Aug 2015 17:01:13 +0000",16768.0,371,3.47642,,8,517,414,0,,,,,,0.0,[],3.55514,False
0,0.0,,0,https://untappd.akamaized.net/site/assets/images/temp/badge-beer-default.png,,Spindle Porter,mill-city-brewing-co-spindle-porter,Porter - Other,16771,5139,https://untappd.akamaized.net/site/assets/images/temp/badge-brewery-default.png,Mill City Brewing Co.,mill-city-brewing-co,Home Brewery,,,,United States,,,0.0,0.0,,,"Fri, 24 Dec 2010 16:06:21 +0000",1,1,,,,1,0.0,,0,4,3,0,,,,,,0.0,[],2.524,False
0,5.1,"Golden-yellow and bright, with 32 bitter units and quite hoppy compared to most of the other Pils our Weihenstephaner Pils comes up with a distinctive aroma of hops with a pleasant bitterness. This combination provides a balanced mix and guarantees great enjoyment. Brewed according to our centuries-old brewing tradition on the Weihenstephan hill.",32,https://untappd.akamaized.net/site/beer_logos/beer-16774_e3aa4_sm.jpeg,https://untappd.akamaized.net/site/beer_logos_hd/beer-16774_1d98a_hd.jpeg,Weihenstephaner Pils,bayerische-staatsbrauerei-weihenstephan-weihenstephaner-pils,Pilsner - German,16774,88,https://untappd.akamaized.net/site/brewery_logos/brewery-88_16162.jpeg,Bayerische Staatsbrauerei Weihenstephan,bayerische-staatsbrauerei-weihenstephan,Micro Brewery,http://www.facebook.com/weihenstephan,weihenstephan,http://www.weihenstephaner.de,Germany,85354 Freising,BY,48.3952,11.7289,,,"Fri, 24 Dec 2010 16:09:02 +0000",0,1,,,,13144,3.55742,,456,17144,14767,0,,,,,,0.0,[],3.55954,False
0,5.2,,0,https://untappd.akamaized.net/site/beer_logos/beer-_20997_sm_71342e9279b2363d281b7e9a832b5f.jpeg,,Gulder Lager,nigerian-breweries-plc-gulder-lager,Lager - Pale,20997,5948,https://untappd.akamaized.net/site/brewery_logos/brewery-5948_45242.jpeg,Nigerian Breweries PLC,nigerian-breweries-plc,Macro Brewery,,,http://nbplc.com,Nigeria,,,0.0,0.0,,,"Tue, 04 Jan 2011 09:47:29 +0000",0,1,20997.0,"Tue, 11 Jun 2013 09:52:22 +0000",16778.0,759,2.80336,,27,1032,876,0,,,,,,0.0,[],3.04631,False
0,5.5,"A proud and passionate Bavarian, Hermann was one of our original Brewmasters. He handcrafted this traditional German recipe to satisfy his longing for a local beer that reflected the true taste of his homeland. Consistently recognized as one of the world?s best dark lagers, this refreshing beer has a toasty malt body, yet is very smooth and finishes clean. We hope you enjoy our authentic Bavarian Dark Lager. Prost!",0,https://untappd.akamaized.net/site/beer_logos/beer-16785_5cb28_sm.jpeg,https://untappd.akamaized.net/site/beer_logos_hd/beer-16785_c81f3_hd.jpeg,Hermann's Dark Lager,vancouver-island-brewing-hermann-s-dark-lager,Lager - Dunkel Munich,16785,3676,https://untappd.akamaized.net/site/brewery_logos/brewery-3676_328aa.jpeg,Vancouver Island Brewing,vancouver-island-brewing,Micro Brewery,http://www.facebook.com/vibrewing,vibrewing,http://www.vibrewing.com,Canada,Victoria,BC,48.4349,-123.368,,,"Fri, 24 Dec 2010 16:21:44 +0000",0,0,,,,2005,3.63023,,11,3200,2234,0,,,,,,0.0,[],3.63296,False
0,5.5,"Piper?s Pale Ale was named in honour of Canadian war hero Piper James C. Richardson who was lost during the battle of the Somme during WWI. Awarded a Victoria Cross for his acts of bravery, we were inspired by his dedication and sacrifice to our country. In Piper?s memory, we salute his bravery and toast in his honour!",30,https://untappd.akamaized.net/site/beer_logos/beer-12132_99018_sm.jpeg,https://untappd.akamaized.net/site/beer_logos_hd/beer-12132_cb496_hd.jpeg,Piper's Pale Ale,vancouver-island-brewing-piper-s-pale-ale,Pale Ale - English,12132,3676,https://untappd.akamaized.net/site/brewery_logos/brewery-3676_328aa.jpeg,Vancouver Island Brewing,vancouver-island-brewing,Micro Brewery,http://www.facebook.com/vibrewing,vibrewing,http://www.vibrewing.com,Canada,Victoria,BC,48.4349,-123.368,,,"Wed, 01 Dec 2010 05:36:11 +0000",0,0,12132.0,"Thu, 01 Jan 1970 00:00:00 +0000",16786.0,1904,3.31355,,4,2975,2158,0,,,,,,0.0,[],3.36013,False
0,8.0,"For this inaugural installment of collaboration brews, we invited distinguished Belgian brewer Jean-Marie Rock to join our own Steven Pauwels for a zymological alliance. A starkly simple recipe combined with a painstakingly complex brewing process produce an Imperial Pilsner of subtle elegance and delicately balanced contrasts. First wort hopping, a very old technique in which hops normally added late in the boil are put in at the beginning, and allowed to steep for a much longer time, gives the beer an especially refined hop aroma and flavor. The 100% Pilsner malt makes a clear, yet restrained statement, answered by a stead, harmonious chorus of Saaz hop bitterness, echoes of which linger in the dry, crisp finish.",29,https://untappd.akamaized.net/site/beer_logos/beer-_16787_sm_a5dea58faf72b29933fa4e6d5f8e17.jpeg,,Collaboration No. 1 - Imperial Pilsner,boulevard-brewing-co-collaboration-no-1-imperial-pilsner,Pilsner - Imperial / Double,16787,1514,https://untappd.akamaized.net/site/brewery_logos/brewery-1514_2003e.jpeg,Boulevard Brewing Co.,boulevard-brewing-co,Micro Brewery,http://www.facebook.com/Boulevard,Boulevard_Beer,http://www.boulevard.com/,United States,Kansas City,MO,39.0812,-94.5954,1.0,"[{'brewery': {'brewery_id': 148339, 'brewery_name': 'Greenbrew SPRL', 'brewery_type': 'Micro Brewery', 'brewery_label': 'https://untappd.akamaized.net/site/brewery_logos/brewery-148339_b02b7.jpeg', 'country_name': 'Belgium', 'location': {'brewery_city': 'Florenville', 'brewery_state': 'Luxembourg'}}}]","Fri, 24 Dec 2010 16:27:49 +0000",0,0,,,,143,3.72902,,0,227,207,0,,,,,,0.0,[],3.67541,False
0,5.0,,0,https://untappd.akamaized.net/site/beer_logos/beer-16609_fb454_sm.jpeg,https://untappd.akamaized.net/site/beer_logos_hd/beer-16609_4fcf5_hd.jpeg,Bali Hai Draft Beer,pt-bali-hai-brewery-bali-hai-draft-beer,Lager - North American Adjunct,16609,3560,https://untappd.akamaized.net/site/brewery_logos/brewery-3560_e2270.jpeg,PT Bali Hai Brewery,pt-bali-hai-brewery,Micro Brewery,,,http://balihaibeer.com/,Indonesia,Pademangan Jakarta Utara,,-6.13075,106.831,,,"Fri, 24 Dec 2010 11:12:53 +0000",0,1,16609.0,"Thu, 01 Jan 1970 00:00:00 +0000",16788.0,508,2.54675,,26,692,616,0,,,,,,0.0,[],2.96098,False
0,6.5,"Mixture of 1 year old Lindemans lambic and 4 year old Girardin lambic. Fermented and ripened on oak barrels. Not filtered, refermented in the bottle. Blue ""male"" labels.",0,https://untappd.akamaized.net/site/beer_logos/beer-_16789_sm_900484df1674964bef0cf9a910f01c.jpeg,,J & J Oude Geuze Blauw,brouwerij-3-fonteinen-j-j-oude-geuze-blauw,Sour - Gueuze,16789,3562,https://untappd.akamaized.net/site/brewery_logos/brewery-3562_fd387.jpeg,Brouwerij 3 Fonteinen,brouwerij-3-fonteinen,Micro Brewery,https://www.facebook.com/Brouwerij3Fonteinen/,3fonteinen,http://www.3fonteinen.be,Belgium,1650 Beersel,,50.7667,4.30729,,,"Fri, 24 Dec 2010 16:43:27 +0000",0,0,,,,396,4.72727,,0,606,463,0,,,,,,0.0,[],4.25869,False
0,5.0,,0,https://untappd.akamaized.net/site/assets/images/temp/badge-beer-default.png,,Cidre Bouch? de Cru - Antoinette,cidrerie-duche-de-longueville-cidre-bouche-de-cru-antoinette,Cider,16790,4327,https://untappd.akamaized.net/site/brewery_logos/brewery-4327_8c875.jpeg,Cidrerie Duch? de Longueville,cidrerie-duche-de-longueville,Cidery / Meadery,,,,France,Anneville-sur-Scie,Seine-Maritime,49.8595,1.07011,,,"Fri, 24 Dec 2010 16:55:29 +0000",0,1,,,,181,3.55249,,2,215,198,0,,,,,,0.0,[],3.61425,False
0,8.0,"One of the first Black IPAs released into beer market. Collaboration of 3 brewers (2 of whom have won GABF medals) who wanted to remain secret, which is the reason for the 3 monkeys on the label. ",0,https://untappd.akamaized.net/site/beer_logos/beer-MenageaSingeBlackIPA_24484.jpeg,,Menage a Singe Black IPA,tied-house-brewery-cafe-menage-a-singe-black-ipa,IPA - Black / Cascadian Dark Ale,24484,1265,https://untappd.akamaized.net/site/brewery_logos/brewery-TiedHouseBreweryCafe_1265.jpeg,Tied House Brewery & Cafe,tied-house-brewery-cafe,Micro Brewery,http://www.facebook.com/TiedHouseBrewing,tiedhouse,http://www.tiedhouse.com,United States,Mountain View,CA,37.3946,-122.081,,,"Sat, 15 Jan 2011 23:14:27 +0000",0,0,24484.0,"Wed, 13 Jun 2012 21:30:17 +0000",16791.0,80,3.14687,,0,138,130,0,,,,,,0.0,[],3.54123,False
0,4.9,"Brewed specifically to compliment the spectacular food from the Yarra Valley region, where freshness, taste and purity are highly valued. This full flavoured real ale boasts a lively hop and very smooth malt finish. The striking label depicts the view from the Launching Place Home Hotel in the heart of the Yarra Valley. This hotel was recently owned and developed by Grand Ridge Brewery. Awarded numerous medals at the Australian and International beer awards and 2 in 2011 for both bottled and draught products. Drink with Venison, Roo, Quayle, Duck, pesto or buffalo sausages and bold summer salads.",31,https://untappd.akamaized.net/site/beer_logos/beer-16793_29ae2_sm.jpeg,https://untappd.akamaized.net/site/beer_logos_hd/beer-16793_f9e42_hd.jpeg,Yarra Valley Gold,grand-ridge-brewery-yarra-valley-gold,Red Ale - American Amber / Red,16793,4331,https://untappd.akamaized.net/site/brewery_logos/brewery-4331_22104.jpeg,Grand Ridge Brewery,grand-ridge-brewery,Micro Brewery,http://www.facebook.com/pages/Grand-Ridge-Brewery/149607794490,grandridgebeer,http://www.grand-ridge.com.au,Australia,Mirboo North,VIC,-38.4011,146.163,,,"Fri, 24 Dec 2010 17:33:12 +0000",0,1,,,,568,3.21567,,6,712,643,0,,,,,,0.0,[],3.36798,False
0,0.0,,0,https://untappd.akamaized.net/site/assets/images/temp/badge-beer-default.png,,Cider Jack,woodchuck-cidery-cider-jack,Cider,4525,611,https://untappd.akamaized.net/site/brewery_logos/brewery-611_068bd.jpeg,Woodchuck Cidery,woodchuck-cidery,Cidery / Meadery,http://www.facebook.com/WoodchuckCider,WoodchuckCider,http://www.woodchuck.com/,United States,Middlebury,VT,44.0358,-73.1662,,,"Sat, 21 Aug 2010 09:26:35 +0000",0,0,4525.0,"Thu, 01 Jan 1970 00:00:00 +0000",16794.0,30,3.26667,,0,104,100,0,,,,,,0.0,[],3.61563,False
0,4.4,"The ""Light"" and ""Ice"" versions of the beer are far more prevalent and readily available for retail across the United States. Though Keystone Premium exists, it appears much less than its ""Light"" variety on liquor store shelves.",0,https://untappd.akamaized.net/site/beer_logos/beer-KeystonePremium_5846.jpeg,,Keystone Premium,coors-brewing-company-keystone-premium,Lager - North American Adjunct,5846,399,https://untappd.akamaized.net/site/brewery_logos/brewery-coors.jpg,Coors Brewing Company,coors-brewing-company,Macro Brewery,,,http://www.coors.com,United States,Golden,CO,39.7591,-105.217,,,"Sat, 21 Aug 2010 07:55:50 +0000",0,1,5846.0,"Thu, 01 Jan 1970 00:00:00 +0000",16795.0,521,1.96257,,5,1503,986,0,,,,,,0.0,[],2.58599,False
0,5.5,,0,https://untappd.akamaized.net/site/beer_logos/beer-McSorleysIrishBlackLager_7373.jpeg,,McSorley's Irish Black Lager,pabst-brewing-company-mcsorley-s-irish-black-lager,Lager - Dark,7373,963,https://untappd.akamaized.net/site/brewery_logos/brewery-pbr.jpg,Pabst Brewing Company,pabst-brewing-company,Macro Brewery,https://www.facebook.com/PabstBrewingCo,pabstblueribbon,http://www.pabstbrewingco.com,United States,Woodridge,IL,41.7181,-88.009,,,"Fri, 05 Nov 2010 13:54:06 +0000",0,1,7373.0,"Thu, 01 Jan 1970 00:00:00 +0000",16796.0,6100,3.53193,,70,9377,7546,0,,,,,,0.0,[],3.53759,False
0,4.8,"Zun?chst frisch und spritzig im Antrunk, klassisch herb auf den zweiten Schluck dank seiner edlen Aromahopfennote. Passt perfekt zu vegetarischen Speisen, zu Meeresfr?chten und Wildspezialit?ten.",11,https://untappd.akamaized.net/site/assets/images/temp/badge-beer-default.png,,Teutsch Pils,allgauer-brauhaus-teutsch-pils,Pilsner - German,16797,4674,https://untappd.akamaized.net/site/brewery_logos/brewery-AllgauerBrauhaus_4674.jpeg,Allg?uer Brauhaus,allg-uer-brauhaus,Micro Brewery,,,http://www.allgaeuer-brauhaus.de,Germany,Kempten,,47.7237,10.3141,,,"Fri, 24 Dec 2010 17:47:56 +0000",0,1,,,,239,3.14958,,11,389,335,0,,,,,,0.0,[],3.43065,False
0,5.6,This traditional style German Wheat beer (pronounced) Hah-fuh-vite-zen) remains unfiltered to preserve it's natural smooth flavor and aroma. Don't be alarmed by its cloudy appearance or noticeable sediment. The slight banana and clove aroma comes from the authentic German Hefeweizen yeast. It has a light refreshing finish.,0,https://untappd.akamaized.net/site/beer_logos/beer-1431_a7b9a_sm.jpeg,https://untappd.akamaized.net/site/beer_logos_hd/beer-1431_abac3_hd.jpeg,Saranac Hefeweizen,the-matt-brewing-company-saranac-saranac-hefeweizen,Hefeweizen,1431,2783,https://untappd.akamaized.net/site/brewery_logos/brewery-themattbrewingcompanysaranac_2783.jpeg,The Matt Brewing Company (Saranac),the-matt-brewing-company-saranac,Micro Brewery,http://www.facebook.com/Saranac,saranacbrewery,http://www.saranac.com,United States,Utica,NY,43.1033,-75.2442,,,"Sat, 21 Aug 2010 09:26:35 +0000",0,1,1431.0,"Thu, 01 Jan 1970 00:00:00 +0000",16798.0,764,3.10831,,3,1478,1218,0,,,,,,0.0,[],3.26312,False
0,6.8,"Featuring a distinct Belgian yeast that reveals a hint of clove and fresh orange peel, this Belgian Blonde Ale embodies notes of banana and a delicate pepper spice.
",26,https://untappd.akamaized.net/site/beer_logos/beer-16799_8faa7_sm.jpeg,https://untappd.akamaized.net/site/beer_logos_hd/beer-16799_44d1e_hd.jpeg,Monkshine Organic Belgian Style Golden Ale,uinta-brewing-company-monkshine-organic-belgian-style-golden-ale,Pale Ale - Belgian,16799,1304,https://untappd.akamaized.net/site/brewery_logos/brewery-1304_8f419.jpeg,Uinta Brewing Company,uinta-brewing-company,Micro Brewery,https://www.facebook.com/uintabrewing/?rf=253113611428604,uintaBrewing,http://www.uintabrewing.com/,United States,Salt Lake City,UT,40.7326,-111.954,,,"Fri, 24 Dec 2010 17:56:49 +0000",0,1,,,,10073,3.53787,,64,12797,11264,0,,,,,,0.0,[],3.5412,False
0,0.0,,0,https://untappd.akamaized.net/site/assets/images/temp/badge-beer-default.png,,Boxcar Pils,gilded-otter-boxcar-pils,Pilsner - Other,16800,2820,https://untappd.akamaized.net/site/brewery_logos/brewery-GildedOtter_2820.jpeg,Gilded Otter,gilded-otter,Brew Pub,,,http://www.gildedotter.com,United States,New Paltz,NY,41.7479,-74.0897,,,"Fri, 24 Dec 2010 18:12:54 +0000",0,1,,,,1,0.0,,0,5,5,0,,,,,,0.0,[],3.57953,False
0,0.0,,0,https://untappd.akamaized.net/site/assets/images/temp/badge-beer-default.png,,Blue and Gold Strong Ale,21st-amendment-brewery-blue-and-gold-strong-ale,Strong Ale - American,16801,4339,https://untappd.akamaized.net/site/brewery_logos/brewery-4339_203d1.jpeg,21st Amendment Brewery,21st-amendment-brewery,Micro Brewery,http://www.facebook.com/21stAmendment,21stAmendment,http://21st-amendment.com/,United States,San Francisco,CA,37.7824,-122.393,,,"Fri, 24 Dec 2010 18:51:32 +0000",0,1,,,,5,0.0,,1,16,14,0,,,,,,0.0,[],3.59202,False
0,8.0,,0,https://untappd.akamaized.net/site/beer_logos/beer-_16802_sm_afee39ca09bcf0c746ce7d82fa2e8e.jpeg,,Imper Ale Maior Nera,fabbrica-della-birra-tenute-collesi-imper-ale-maior-nera,Belgian Strong Dark Ale,16802,4340,https://untappd.akamaized.net/site/brewery_logos/brewery-BirraCollesi_4340.jpeg,Fabbrica della Birra Tenute Collesi,fabbrica-della-birra-tenute-collesi,Micro Brewery,,,www.collesi.com/,Italy,Apecchio,PU,43.5371,12.4267,,,"Fri, 24 Dec 2010 19:26:33 +0000",0,1,,,,798,3.58803,,20,962,914,0,,,,,,0.0,[],3.60542,False
0,9.5,Heavily hopped tripel,0,https://untappd.akamaized.net/site/assets/images/temp/badge-beer-default.png,,Duvel Tripel Hop,duvel-moortgat-duvel-tripel-hop,IPA - Belgian,8370,167,https://untappd.akamaized.net/site/brewery_logos/brewery-DuvelMoortgat_167.jpeg,Duvel Moortgat,duvel-moortgat,Macro Brewery,https://www.facebook.com/Duvel.beer/,,http://www.duvel.com/en,Belgium,Puurs,Antwerpen,51.0421,4.32601,,,"Wed, 10 Nov 2010 13:11:46 +0000",0,1,8370.0,"Thu, 01 Jan 1970 00:00:00 +0000",16803.0,0,0.0,True,0,0,0,0,,,,,,0.0,[],0.0,False
0,6.0,,0,https://untappd.akamaized.net/site/beer_logos/beer-BieredeNoel_103421.jpeg,,Bi?re de No?l,desperados-nl-biere-de-noel,Lager - Winter,103421,1429,https://untappd.akamaized.net/site/brewery_logos/brewery-1429_0ae34.jpeg,Desperados NL,desperados-nl,Macro Brewery,,,,France,Schiltigheim,Bas-Rhin,48.6052,7.74845,,,"Sun, 27 Nov 2011 11:50:43 +0000",0,0,103421.0,"Mon, 30 Sep 2013 10:12:40 +0000",16804.0,378,3.01455,,5,489,427,0,,,,,,0.0,[],3.29872,False
0,0.0,Non alcoholic wheat beer,0,https://untappd.akamaized.net/site/beer_logos/beer-Bavaria00Wit_16805.jpeg,,0.0% Wit,bavaria-brouwerij-0-0-wit,Non-Alcoholic,16805,109,https://untappd.akamaized.net/site/brewery_logos/brewery-BavariaBrouwerijNetherlands_109.jpeg,Bavaria Brouwerij,bavaria-brouwerij,Macro Brewery,https://www.facebook.com/Bavaria,bavaria,http://www.bavaria.com,Netherlands,Lieshout,Noord-Brabant,51.5171,5.60823,,,"Fri, 24 Dec 2010 20:22:10 +0000",0,1,,,,3716,2.48762,,153,5742,4092,0,,,,,,0.0,[],2.57586,False
0,4.2,"""A satisfying bright copper coloured English premium ale, with a white creamy head. The beer has a good balance between malt and fruity bitterness, derived from English aroma hop varieties, which gives the beer a high drinkability.""",0,https://untappd.akamaized.net/site/beer_logos/beer-1047444_b03e6_sm.jpeg,https://untappd.akamaized.net/site/beer_logos_hd/beer-1047444_c4149_hd.jpeg,Original,davenports-original,English Bitter,1047444,9843,https://untappd.akamaized.net/site/brewery_logos/brewery-9843_ca512.jpeg,Davenports,davenports,Micro Brewery,,Davenports1829,http://www.davenports.co.uk/,England,Birmingham,,52.4964,-1.96353,,,"Mon, 13 Apr 2015 17:24:17 +0000",0,1,1047444.0,"Sat, 16 Apr 2016 23:23:13 +0000",16806.0,113,3.1792,,6,136,125,0,,,,,,0.0,[],3.52338,False
