auth_rating,beer_abv,beer_description,beer_ibu,beer_label,beer_label_hd,beer_name,beer_slug,beer_style,bid,brewery.brewery_id,brewery.brewery_label,brewery.brewery_name,brewery.brewery_slug,brewery.brewery_type,brewery.contact.facebook,brewery.contact.twitter,brewery.contact.url,brewery.country_name,brewery.location.brewery_city,brewery.location.brewery_state,brewery.location.lat,brewery.location.lng,created_at,is_homebrew,is_in_production,merge_details.master_bid,merge_details.merge_date,merge_details.requested_bid,rating_count,rating_score,rating_score_below,stats.monthly_count,stats.total_count,stats.total_user_count,stats.user_count,vintage_parent.beer.beer_abv,vintage_parent.beer.beer_name,vintage_parent.beer.beer_slug,vintage_parent.beer.bid,vintage_parent.beer.type_id,vintages.count,vintages.items,weighted_rating_score,wish_list
0,8.0,"Hazy, golden yellow color, with a big white head. Bread, tart hints, orange, yeast and clove. Sour, with soft yeast and white-bread malts, unexpected sour, compared to the other flavors of the beer. Citraic notes with unripe orange, also an noteable fzziness, due to the dominating sourness. Lively carbonation creates a fruity, slightly spiced refreshing beer, with an unusual, well fitting sourness. Decent body, soft, pleasant mouthfeel. Has a refreshing, fruity aftertaste, with a subtle bitterness.",0,https://untappd.akamaized.net/site/beer_logos/beer-WestoekX6ABV_19306.jpeg,,Westoek XX,de-struise-brouwers-westoek-xx,Belgian Tripel,19306,433,https://untappd.akamaized.net/site/brewery_logos/brewery-DeStruiseBrouwers_433.jpeg,De Struise Brouwers,de-struise-brouwers,Micro Brewery,https://www.facebook.com/pages/De-Struise-Brouwers/58796459632,struise,http://struise.com,Belgium,Oostvleteren,West-Vlaanderen,50.932,2.73755,"Thu, 30 Dec 2010 21:54:15 +0000",0,1,,,,2941,3.47671,,60,3605,3246,0,,,,,,3.0,"[{'beer': {'bid': 529389, 'beer_label': 'https://untappd.akamaized.net/site/assets/images/temp/badge-beer-default.png', 'beer_slug': 'de-struise-brouwers-westoek-xx-2010', 'beer_name': 'Westoek XX (2010)', 'is_vintage': 1, 'is_variant': 0}}, {'beer': {'bid': 1252012, 'beer_label': 'https://untappd.akamaized.net/site/assets/images/temp/badge-beer-default.png', 'beer_slug': 'de-struise-brouwers-westoek-xx-2014', 'beer_name': 'Westoek Xx (2014)', 'is_vintage': 1, 'is_variant': 0}}, {'beer': {'bid': 1951765, 'beer_label': 'https://untappd.akamaized.net/site/beer_logos/beer-WestoekX6ABV_19306.jpeg', 'beer_slug': 'de-struise-brouwers-westoek-xx-2015', 'beer_name': 'Westoek XX (2015)', 'is_vintage': 1, 'is_variant': 0}}]",3.49308,False
0,0.0,,0,https://untappd.akamaized.net/site/assets/images/temp/badge-beer-default.png,,Dry Fusion Lemon,carlton-united-breweries-fosters-group-dry-fusion-lemon,Fruit Beer,19308,4045,https://untappd.akamaized.net/site/brewery_logos/brewery-4045_ce45d.jpeg,Carlton & United Breweries,carlton-united-breweries,Macro Brewery,,,http://www.cub.com.au,Australia,Abbotsford,VIC,-37.8094,145.003,"Thu, 30 Dec 2010 22:06:23 +0000",0,1,,,,11,2.0,,0,30,28,0,,,,,,0.0,[],3.576,False
0,7.0,,0,https://untappd.akamaized.net/site/assets/images/temp/badge-beer-default.png,,India Pale Ale SCCANS,the-kernel-brewery-india-pale-ale-sccans,IPA - English,922271,3376,https://untappd.akamaized.net/site/brewery_logos/brewery-TheKernelBrewery_3376.jpeg,The Kernel Brewery,kernel-brewery,Micro Brewery,https://www.facebook.com/pages/The-Kernel-Brewery/203846429748027,kernelbrewery,http://www.thekernelbrewery.com,England,London,,51.4957,-0.0685276,"Wed, 24 Dec 2014 21:19:32 +0000",0,1,922271.0,"Mon, 29 Dec 2014 21:11:34 +0000",19309.0,0,0.0,True,0,0,0,0,,,,,,0.0,[],0.0,False
0,5.2,"Pours a deep mahogany brown - opaque like a chocolate liqueur - there's plenty of foam banana and some malty sweetness rising from its thick brown head. In the mouth, there's milk chocolate, cola, some burnt toffee and, of course, more of those bananas. There's plenty to chew on in a pretty creamy mouthfeel too, all rounded off with a gently lingering roast bitterness.",0,https://untappd.akamaized.net/site/beer_logos/beer-19310_83cd2_sm.jpeg,https://untappd.akamaized.net/site/beer_logos_hd/beer-19310_7fc9d_hd.jpeg,Chevalier Hefe Weizen Dunkel,bridge-road-brewers-chevalier-hefe-weizen-dunkel,Dunkelweizen,19310,3174,https://untappd.akamaized.net/site/brewery_logos/brewery-3174_296f5.jpeg,Bridge Road Brewers,bridge-road-brewers,Micro Brewery,https://www.facebook.com/BridgeRoadBrewers,NakedNed,http://www.bridgeroadbrewers.com.au,Australia,Beechworth,VIC,-36.3609,146.685,"Thu, 30 Dec 2010 22:33:36 +0000",0,0,,,,111,3.59009,,0,185,155,0,,,,,,0.0,[],3.61689,False
0,7.0,,0,https://untappd.akamaized.net/site/assets/images/temp/badge-beer-default.png,,Holiday Ale (2010),kern-river-brewing-company-holiday-ale-2010,Rye Beer,19311,1498,https://untappd.akamaized.net/site/brewery_logos/brewery-KernRiverBrewingCompany_1498.jpeg,Kern River Brewing Company,kern-river-brewing-company,Micro Brewery,https://www.facebook.com/Kern-River-Brewing-Company-332092754207/,kernriverbrewin,http://www.kernriverbrewingcompany.com/,United States,Kernville,CA,35.7575,-118.419,"Thu, 30 Dec 2010 22:41:05 +0000",0,0,,,,0,0.0,,0,3,3,0,7.0,Holiday Ale,kern-river-brewing-company-holiday-ale,12585.0,68.0,,,3.59537,False
0,8.0,,40,https://untappd.akamaized.net/site/assets/images/temp/badge-beer-default.png,,Sint Niklaas Jule Dubbel,bryghuset-kragelund-sint-niklaas-jule-dubbel,Winter Warmer,285948,27279,https://untappd.akamaized.net/site/brewery_logos/brewery-27279_48378.jpeg,Bryghuset Kragelund,bryghuset-kragelund,Micro Brewery,https://www.facebook.com/bryghusetkragelund,,http://www.bryghusetkragelund.dk/,Denmark,Silkeborg,,56.1943,9.40941,"Fri, 28 Dec 2012 12:57:18 +0000",0,1,285948.0,"Wed, 08 Apr 2015 07:46:33 +0000",19312.0,36,3.15972,,0,47,41,0,,,,,,0.0,[],3.598,False
0,3.5,"Brewed under license for CUB Australia.
Born of the 1963 Nastro Azzurro beer, Peroni Leggera is an expertly brewed lager using the same unique, quality Italian ingredients. Peroni Leggera, light in colour and body and has a clean, refreshing taste, with an added bitter note to provide a balanced flavour, while its effervescent sparkle acts as a great thirst quencher.",0,https://untappd.akamaized.net/site/beer_logos/beer-19313_901d9_sm.jpeg,https://untappd.akamaized.net/site/beer_logos_hd/beer-19313_7b528_hd.jpeg,Leggera,birra-peroni-leggera,Lager - Pale,19313,1921,https://untappd.akamaized.net/site/brewery_logos/brewery-BirraPeroniSpA_1921.jpeg,Birra Peroni,birra-peroni,Macro Brewery,http://www.facebook.com/birraperoni,Birra_Peroni,www.peroni.it,Italy,Roma,RM,41.9028,12.5991,"Thu, 30 Dec 2010 23:09:27 +0000",0,1,,,,1812,2.80726,,63,2788,2090,0,,,,,,0.0,[],2.9288,False
0,4.5,Skrimshander is an aromatic copper coloured pale ale brewed from the finest malted barley and Kentish hops.,0,https://untappd.akamaized.net/site/beer_logos/beer-SkrimshanderIPA_155182.jpeg,,Skrimshander IPA,hopdaemon-brewery-skrimshander-ipa,IPA - English,155182,5278,https://untappd.akamaized.net/site/brewery_logos/brewery-HopdaemonBrewery_5278.jpeg,Hopdaemon Brewery,hopdaemon-brewery,Micro Brewery,,hopdaemon,http://www.hopdaemon.com/index.html,England,Sittingbourne,"ME9 0NA,",52.3555,-1.17432,"Fri, 06 Apr 2012 14:44:52 +0000",0,1,155182.0,"Tue, 18 Dec 2012 23:25:06 +0000",19314.0,1826,3.17442,,55,2244,1987,0,,,,,,0.0,[],3.24262,False
0,9.5,"Brewed in the style of a Russian Imperial Stout. Strong, chocolatety and aggressively hopped with finest English hops.",0,https://untappd.akamaized.net/site/beer_logos/beer-Dragonslayer_2028.jpeg,,Dragonslayer,middle-ages-brewing-dragonslayer,Stout - Russian Imperial,2028,857,https://untappd.akamaized.net/site/brewery_logos/brewery-857_96666.jpeg,Middle Ages Brewing,middle-ages-brewing,Micro Brewery,https://www.facebook.com/MiddleAgesBrewing/,MiddleAgesBeer,http://middleagesbrewing.com,United States,Syracuse,NY,43.0513,-76.1616,"Sat, 21 Aug 2010 09:26:35 +0000",0,1,2028.0,"Sun, 24 Jun 2012 11:24:16 +0000",19315.0,2413,3.72959,,33,3226,2763,0,,,,,,0.0,[],3.72076,False
0,5.0,A classic pale ale. This version of Bass for the North American market at 5% to comply with USA ale regulations.,49,https://untappd.akamaized.net/site/beer_logos/beer-BassPaleAle_5872.jpeg,,Bass Pale Ale,bass-brewers-abinbev-bass-pale-ale,Pale Ale - English,5872,85,https://untappd.akamaized.net/site/brewery_logos/brewery-BassBrewers_85.jpeg,Bass Brewers,bass-brewers,Macro Brewery,https://www.facebook.com/abinbev,abinbevnews,http://www.ab-inbev.co.uk,England,Shamlesbury,Lancashire,53.7622,-2.6113,"Sun, 19 Sep 2010 15:38:40 +0000",0,1,5872.0,"Thu, 01 Jan 1970 00:00:00 +0000",19316.0,79282,3.31424,,1377,124856,92144,0,,,,,,0.0,[],3.31553,False
0,5.1,"Apricot Ale perfectly combines the taste and aroma of fresh apricot with the smooth finish of a traditional wheat beer. It?s refreshingly unfiltered character and fruit flavor make it an ale worth savoring.

Malts:
2-Row Pale Barley & Malted Wheat

Hops:
Nugget",11,https://untappd.akamaized.net/site/beer_logos/beer-6798_d8413_sm.jpeg,,Apricot Ale,pyramid-breweries-apricot-ale,Fruit Beer,6798,1663,https://untappd.akamaized.net/site/brewery_logos/brewery-PyramidBreweries_1663.jpeg,Pyramid Breweries,pyramid-breweries,Micro Brewery,http://www.facebook.com/PyramidBrew,pyramidbrew,http://www.pyramidbrew.com/,United States,Seattle,WA,47.5924,-122.335,"Sat, 23 Oct 2010 12:47:50 +0000",0,1,6798.0,"Thu, 01 Jan 1970 00:00:00 +0000",19317.0,27628,3.49938,,294,41113,31850,0,,,,,,0.0,[],3.50103,False
0,3.4,"Brewed using the original Henley Brakspear brewing plant, including the famous ?double-drop? fermentation system, the original Copper, and the Victorian fermenting vessels. Amber in colour with a good fruit, hop, and malt nose. The initial taste of malt and well-hopped bitterness dissolves into a bitter-sweet and fruity finish.",0,https://untappd.akamaized.net/site/beer_logos/beer-19318_412ec_sm.jpeg,https://untappd.akamaized.net/site/beer_logos_hd/beer-19318_e794e_hd.jpeg,Bitter,brakspear-brewing-company-bitter,English Bitter,19318,1353,https://untappd.akamaized.net/site/brewery_logos/brewery-WHBrakspearSons_1353.jpeg,Brakspear Brewing Company,brakspear-brewing-company,Micro Brewery,http://www.facebook.com/pages/Brakspear-Beer/122175544521430,Oxfordshirebeer,http://www.brakspear-beers.co.uk,England,Witney,"Oxfordshire, OX28 4DP",51.7826,-1.48842,"Thu, 30 Dec 2010 23:58:26 +0000",0,1,,,,9230,3.10902,,339,13099,10232,0,,,,,,0.0,[],3.12635,False
0,0.0,,0,https://untappd.akamaized.net/site/assets/images/temp/badge-beer-default.png,,Punk'n the Trunk,proletariat-homebrew-punk-n-the-trunk,Spiced / Herbed Beer,19319,4451,https://untappd.akamaized.net/site/assets/images/temp/badge-brewery-default.png,Proletariat Homebrew,proletariat-homebrew,Home Brewery,,,,United States,,,0.0,0.0,"Thu, 30 Dec 2010 23:58:30 +0000",1,1,,,,0,0.0,,0,1,1,0,,,,,,0.0,[],3.786,False
0,0.0,,0,https://untappd.akamaized.net/site/assets/images/temp/badge-beer-default.png,,Derweizenteuful,proletariat-homebrew-derweizenteuful,Weizenbock,19320,4451,https://untappd.akamaized.net/site/assets/images/temp/badge-brewery-default.png,Proletariat Homebrew,proletariat-homebrew,Home Brewery,,,,United States,,,0.0,0.0,"Thu, 30 Dec 2010 23:59:38 +0000",1,1,,,,0,0.0,,0,0,0,0,,,,,,0.0,[],3.786,False
0,0.0,,0,https://untappd.akamaized.net/site/assets/images/temp/badge-beer-default.png,,Cranberry Cornucopia,proletariat-homebrew-cranberry-cornucopia,Fruit Beer,19321,4451,https://untappd.akamaized.net/site/assets/images/temp/badge-brewery-default.png,Proletariat Homebrew,proletariat-homebrew,Home Brewery,,,,United States,,,0.0,0.0,"Fri, 31 Dec 2010 00:00:31 +0000",1,1,,,,0,0.0,,0,1,1,0,,,,,,0.0,[],3.786,False
0,6.5,"An ale inspired by the style of a German Maibock, brewed using our proprietary Pacman yeast, Dead Guy Ale is deep honey in color with a malty aroma, rich hearty flavor and a well balanced finish.

History: In the early 1990s Dead Guy Ale was created as a private tap sticker to celebrate the Mayan Day of the Dead (November 1st, All Souls Day) for Casa U Betcha in Portland, Oregon. The Dead Guy design proved so popular with consumers and especially Grateful Dead fans, that we made it the label for our Maierbock ale. Even though the association with the Grateful Dead band is pure coincidence, we have gratefully dedicated Dead Guy Ale to the Rogue in each of us.

The Dead Guy packaging remained unchanged for 25 years until 2017 when we updated the labels with our new design.",40,https://untappd.akamaized.net/site/beer_logos/beer-4172_52115_sm.jpeg,https://untappd.akamaized.net/site/beer_logos_hd/beer-4172_b507f_hd.jpeg,Dead Guy Ale,rogue-ales-and-spirits-dead-guy-ale,Maibock / Heller (Helles) Bock,4172,4565,https://untappd.akamaized.net/site/brewery_logos/brewery-rogue.jpg,Rogue Ales & Spirits,rogue-ales-spirits,Micro Brewery,https://www.facebook.com/RogueAlesSpirits/,rogueales,http://www.rogue.com/,United States,Newport,OR,44.6202,-124.052,"Sat, 21 Aug 2010 09:26:35 +0000",0,1,4172.0,"Thu, 01 Jan 1970 00:00:00 +0000",19322.0,203819,3.72888,,4952,335514,229282,0,,,,,,0.0,[],3.72876,False
0,4.8,This wonderful Pale Ale is crafted from a complex grist of roasted malts and Sussex grown hops delivering a full flavour ale with a traditional Sussex hoppy nose to the finish. ,0,https://untappd.akamaized.net/site/beer_logos/beer-19323_ced0f_sm.jpeg,https://untappd.akamaized.net/site/beer_logos_hd/beer-19323_7c0b8_hd.jpeg,Iron Horse Best Bitter / Premium Ale,hepworth-and-co-iron-horse-best-bitter,Gluten-Free,19323,5282,https://untappd.akamaized.net/site/brewery_logos/brewery-HepworthCo_5282.jpeg,Hepworth & Co,hepworth-co,Micro Brewery,,,http://www.hepworthbrewery.co.uk/,England,,,51.0687,-0.319329,"Fri, 31 Dec 2010 00:13:20 +0000",0,1,,,,2002,3.16583,,66,2300,2160,0,,,,,,0.0,[],3.22996,False
0,5.0,"Our take on an English amber ale is packed full of flavour. Malty and nutty with floral hops, fruity Yorkshire yeast and a background caramel sweetness.

Its fiery colour inspired us to name this beer after Hellfire Gully, which is an exhilarating drop off Mt Feathertop for the more adventurous backcountry skier.",30,https://untappd.akamaized.net/site/beer_logos/beer-19324_82a8d_sm.jpeg,https://untappd.akamaized.net/site/beer_logos_hd/beer-19324_619a2_hd.jpeg,Hellfire Amber,bright-brewery-hellfire-amber,English Bitter,19324,3678,https://untappd.akamaized.net/site/brewery_logos/brewery-3678_56053.jpeg,Bright Brewery,bright-brewery,Micro Brewery,http://www.facebook.com/brightbrewery,brightbrewery,http://www.brightbrewery.com.au,Australia,Bright,VIC,-36.7296,146.979,"Fri, 31 Dec 2010 00:22:23 +0000",0,1,,,,530,3.46038,,26,1005,590,0,,,,,,0.0,[],3.52997,False
0,7.0,"Brewed with Munich, Wheat, Xtra Special and Midnight Wheat Malt, this Dunkel Doppel Weizenbock has a rich, velvety malt body with notes of milk chocolate. Higher carbonation levels give this beer a full bodied mouth feel and a fluffy, creamy head with a banana and clove aroma.",0,https://untappd.akamaized.net/site/beer_logos/beer-15204_51dd3_sm.jpeg,https://untappd.akamaized.net/site/beer_logos_hd/beer-15204_5a02f_hd.jpeg,Schell's Snowstorm,august-schell-brewing-company-schell-s-snowstorm,Doppelbock ,15204,4905,https://untappd.akamaized.net/site/brewery_logos/brewery-4905_3cfb7.jpeg,August Schell Brewing Company,august-schell-brewing-company,Micro Brewery,http://www.facebook.com/pages/August-Schell-Brewing-Company/47056987065,schellsbrewery,http://www.schellsbrewery.com/,United States,New Ulm,MN,44.2896,-94.449,"Fri, 17 Dec 2010 14:41:30 +0000",0,1,15204.0,"Sun, 06 Nov 2011 17:25:24 +0000",19325.0,3945,3.38042,,19,5904,4621,0,,,,,,5.0,"[{'beer': {'bid': 102278, 'beer_label': 'https://untappd.akamaized.net/site/beer_logos/beer-Snowstorm2011_102278.jpeg', 'beer_slug': 'august-schell-brewing-company-schell-s-snowstorm-2011', 'beer_name': ""Schell's Snowstorm (2011)"", 'is_vintage': 1, 'is_variant': 0}}, {'beer': {'bid': 251532, 'beer_label': 'https://untappd.akamaized.net/site/beer_logos/beer-_251532_aa27b4d314bcb2ccc40af571a254.jpeg', 'beer_slug': 'august-schell-brewing-company-schell-s-snowstorm-2012', 'beer_name': ""Schell's Snowstorm (2012)"", 'is_vintage': 1, 'is_variant': 0}}, {'beer': {'bid': 278638, 'beer_label': 'https://untappd.akamaized.net/site/assets/images/temp/badge-beer-default.png', 'beer_slug': 'august-schell-brewing-company-schell-s-snowstorm-2009', 'beer_name': ""Schell's Snowstorm (2009)"", 'is_vintage': 1, 'is_variant': 0}}, {'beer': {'bid': 474213, 'beer_label': 'https://untappd.akamaized.net/site/beer_logos/beer-474213_fb198_sm.jpeg', 'beer_slug': 'august-schell-brewing-company-schell-s-snowstorm-2013', 'beer_name': ""Schell's Snowstorm (2013)"", 'is_vintage': 1, 'is_variant': 0}}, {'beer': {'bid': 621974, 'beer_label': 'https://untappd.akamaized.net/site/assets/images/temp/badge-beer-default.png', 'beer_slug': 'august-schell-brewing-company-schell-s-snowstorm-2010', 'beer_name': ""Schell's Snowstorm (2010)"", 'is_vintage': 1, 'is_variant': 0}}]",3.39983,False
0,5.91,"Schell Anniversary Draft Series #6, commemorating the day August Schell Brewing was found Not Guilty of Violating the 18th Amendment of the US Constitution. The 1924 Deer Brand incorporates two important indigenous American ingredients to create a unique version of the classic German Pilsner: 6-row Barley and Flaked Maize. Early American brewers discovered that by adding a portion of Maize to the high protein 6-row Barley a more palatable and stable beer could be produced. The 1924 Deer Brand is a recreation of the full-flavored American Lager your grandparents used to enjoy before and immediately following prohibition, exhibiting moderate maltiness, the complex character of our 1860 Schell yeast and a well-defined hop bitterness and flavor",0,https://untappd.akamaized.net/site/assets/images/temp/badge-beer-default.png,,"""Not Guilty"" 1924 Deer Brand (Anniversary Draft Series No.6)",august-schell-brewing-company-not-guilty-1924-deer-brand-anniversary-draft-series-no-6,Lager - North American Adjunct,19326,4905,https://untappd.akamaized.net/site/brewery_logos/brewery-4905_3cfb7.jpeg,August Schell Brewing Company,august-schell-brewing-company,Micro Brewery,http://www.facebook.com/pages/August-Schell-Brewing-Company/47056987065,schellsbrewery,http://www.schellsbrewery.com/,United States,New Ulm,MN,44.2896,-94.449,"Fri, 31 Dec 2010 00:30:51 +0000",0,1,,,,0,0.0,,0,0,0,0,,,,,,0.0,[],3.59537,False
0,4.8,"Schell's Deer Brand was developed prior to Prohibition and has been Schell's flagship beer ever since. Brewed from 70 percent barley malt, 30 percent corn, and our unique 'Schell' yeast, Deer Brand is full flavored American Lager.",0,https://untappd.akamaized.net/site/beer_logos/beer-14009_aed84_sm.jpeg,https://untappd.akamaized.net/site/beer_logos_hd/beer-14009_3af99_hd.jpeg,Schell's Deer Brand,august-schell-brewing-company-schell-s-deer-brand,Lager - North American Adjunct,14009,4905,https://untappd.akamaized.net/site/brewery_logos/brewery-4905_3cfb7.jpeg,August Schell Brewing Company,august-schell-brewing-company,Micro Brewery,http://www.facebook.com/pages/August-Schell-Brewing-Company/47056987065,schellsbrewery,http://www.schellsbrewery.com/,United States,New Ulm,MN,44.2896,-94.449,"Sat, 11 Dec 2010 00:58:28 +0000",0,1,14009.0,"Wed, 26 Oct 2011 03:57:16 +0000",19327.0,1854,3.08711,,48,3507,2204,0,,,,,,0.0,[],3.16676,False
0,5.8,"Schell Anniversary Draft Series #5, featuring Hopfenmalz. It is an amalgam of our favorite beer styles: the elegant drinkablity of a Pilsner, the bready maltiness of a Vienna Lager, and the hopping of a Pale Ale. The malt backbone was created using a large amount of Vienna coupled with judicious amounts of Caramunich and Caravienne. In the kettle, we agressively hopped it with Cascade and Tettnang from the Pacific Northwest. Finally, just to ensure we used enough hops, we dry hopped it also. Hopfenmalz was fermented with one of our old world lager yeasts at a higher temperature to add some flavor complexities. Finally, we aged it for six weeks to provide the crispness that is only found in a lager. Prost!",0,https://untappd.akamaized.net/site/beer_logos/beer-10453_db6d0_sm.jpeg,https://untappd.akamaized.net/site/beer_logos_hd/beer-10453_a260a_hd.jpeg,Schell's Hopfenmalz (Anniversary Draft Series No.5),august-schell-brewing-company-schell-s-hopfenmalz-anniversary-draft-series-no-5,Lager - Vienna,10453,4905,https://untappd.akamaized.net/site/brewery_logos/brewery-4905_3cfb7.jpeg,August Schell Brewing Company,august-schell-brewing-company,Micro Brewery,http://www.facebook.com/pages/August-Schell-Brewing-Company/47056987065,schellsbrewery,http://www.schellsbrewery.com/,United States,New Ulm,MN,44.2896,-94.449,"Mon, 22 Nov 2010 08:51:06 +0000",0,1,10453.0,"Wed, 26 Oct 2011 03:57:29 +0000",19328.0,310,3.22177,,0,648,475,0,,,,,,0.0,[],3.43447,False
0,5.1,"The Stag Series draws upon our 150 years of brewing knowledge at the August Schell Brewery to create a collection of innovative, limited edition beers. The first release is our Schmaltz?s Alt beer that has been aged in red wine barrels.",0,https://untappd.akamaized.net/site/beer_logos/beer-18117_411b1_sm.jpeg,https://untappd.akamaized.net/site/beer_logos_hd/beer-18117_0f277_hd.jpeg,Schell's Stag Series #1 Barrel Aged Schmaltz's Alt,august-schell-brewing-company-schell-s-stag-series-1-barrel-aged-schmaltz-s-alt,Altbier,18117,4905,https://untappd.akamaized.net/site/brewery_logos/brewery-4905_3cfb7.jpeg,August Schell Brewing Company,august-schell-brewing-company,Micro Brewery,http://www.facebook.com/pages/August-Schell-Brewing-Company/47056987065,schellsbrewery,http://www.schellsbrewery.com/,United States,New Ulm,MN,44.2896,-94.449,"Mon, 27 Dec 2010 23:45:24 +0000",0,1,18117.0,"Thu, 27 Oct 2011 01:54:02 +0000",19329.0,54,3.75,,1,80,73,0,,,,,,0.0,[],3.66561,False
0,5.5,Draft/Cask and bottles were finished production in March 2014.,0,https://untappd.akamaized.net/site/beer_logos/beer-15431_50c3f_sm.jpeg,https://untappd.akamaized.net/site/beer_logos_hd/beer-15431_977d8_hd.jpeg,Malt's Beer,suntory-beer-limited-malt-s-beer,Lager - Pale,15431,1893,https://untappd.akamaized.net/site/brewery_logos/brewery-Suntory_1893.jpeg,Suntory Beer Limited,suntory-beer-limited,Macro Brewery,https://www.facebook.com/suntorygroup,suntory,http://www.suntory.com/,Japan,Minato-ku,Tokyo,35.629,139.779,"Sat, 18 Dec 2010 14:09:41 +0000",0,1,15431.0,"Wed, 14 Dec 2011 18:17:54 +0000",19330.0,867,2.88524,,25,1713,1079,0,,,,,,0.0,[],3.08449,False
0,7.0,"Kriek de Ranke is an unsweetened  cherry beer of mixed fermentation. It arises from a blend of old Flemish ale, lambic and 25 kilos of sour cherries/Hl.",0,https://untappd.akamaized.net/site/beer_logos/beer-KriekDeRanke_19331.jpeg,,Kriek De Ranke,brouwerij-de-ranke-kriek-de-ranke,Fruit Beer,19331,277,https://untappd.akamaized.net/site/brewery_logos/brewery-277_35c5e.jpeg,Brouwerij De Ranke,brouwerij-de-ranke,Micro Brewery,https://www.facebook.com/brouwerij.deranke/,bierenderanke,http://deranke.be,Belgium,Dottignies,Hainaut,50.7342,3.29951,"Fri, 31 Dec 2010 00:39:27 +0000",0,1,,,,4839,3.96973,,163,6116,5498,0,,,,,,5.0,"[{'beer': {'bid': 30785, 'beer_label': 'https://untappd.akamaized.net/site/beer_logos/beer-KriekDeRanke2005_30785.jpeg', 'beer_slug': 'brouwerij-de-ranke-kriek-de-ranke-2005', 'beer_name': 'Kriek De Ranke (2005)', 'is_vintage': 1, 'is_variant': 0}}, {'beer': {'bid': 283044, 'beer_label': 'https://untappd.akamaized.net/site/beer_logos/beer-283044_4db37_sm.jpeg', 'beer_slug': 'brouwerij-de-ranke-kriek-de-ranke-2010', 'beer_name': 'Kriek De Ranke (2010)', 'is_vintage': 1, 'is_variant': 0}}, {'beer': {'bid': 404732, 'beer_label': 'https://untappd.akamaized.net/site/beer_logos/beer-404732_d5cdf_sm.jpeg', 'beer_slug': 'brouwerij-de-ranke-kriek-de-ranke-2013', 'beer_name': 'Kriek De Ranke (2013)', 'is_vintage': 1, 'is_variant': 0}}, {'beer': {'bid': 404742, 'beer_label': 'https://untappd.akamaized.net/site/beer_logos/beer-404742_ea2c7_sm.jpeg', 'beer_slug': 'brouwerij-de-ranke-kriek-de-ranke-2008', 'beer_name': 'Kriek De Ranke (2008)', 'is_vintage': 1, 'is_variant': 0}}, {'beer': {'bid': 470801, 'beer_label': 'https://untappd.akamaized.net/site/beer_logos/beer-470801_8452a_sm.jpeg', 'beer_slug': 'brouwerij-de-ranke-kriek-de-ranke-2006', 'beer_name': 'Kriek De Ranke (2006)', 'is_vintage': 1, 'is_variant': 0}}]",3.95082,False
0,5.0,"A premium lager beer brewed from the finest ingredients, Singha is a full-bodied 100% barley malt beer that is distinctively rich in taste with strong hop characters. Brewed with three hops: Saaz, Perle and Hallertau. 

Editor?s Note: Recipe scaled down from 6% to 5% in 2007.",20,https://untappd.akamaized.net/site/beer_logos/beer-6344_f8359_sm.jpeg,https://untappd.akamaized.net/site/beer_logos_hd/beer-6344_b1561_hd.jpeg,Singha,boon-rawd-brewery-singha,Lager - Pale,6344,152,https://untappd.akamaized.net/site/brewery_logos/brewery-BoonRawdBrewery_152.jpeg,Boon Rawd Brewery,boon-rawd-brewery,Micro Brewery,https://www.facebook.com/SINGHAofficial,singhaclub,http://www.boonrawd.co.th/,Thailand,10300 Bangkok,,13.787,100.515,"Fri, 08 Oct 2010 09:07:44 +0000",0,1,6344.0,"Wed, 27 Mar 2013 21:28:29 +0000",19332.0,94271,3.026,,3794,139718,107400,0,,,,,,0.0,[],3.02802,False
0,4.5,Brewed by Brouwerij Huyghe for Marks & Spencers stores UK.,0,https://untappd.akamaized.net/site/beer_logos/beer-MarksandSpencerBelgianWheatorangeandcorianderBeer_69074.jpeg,,Belgian Wheat Beer,brouwerij-huyghe-belgian-wheat-beer,Witbier,69074,285,https://untappd.akamaized.net/site/brewery_logos/brewery-BrouwerijHuyghe_285.jpeg,Brouwerij Huyghe,brouwerij-huyghe,Micro Brewery,http://www.facebook.com/Deliriumbrewery,Deliriumbrewery,http://www.delirium.be,Belgium,Melle,Oost-Vlaanderen,51.0002,3.80523,"Thu, 04 Aug 2011 13:28:14 +0000",0,1,69074.0,"Tue, 13 Dec 2011 14:22:14 +0000",19333.0,1144,3.46176,,32,1393,1266,0,,,,,,0.0,[],3.50157,False
