auth_rating,beer_abv,beer_description,beer_ibu,beer_label,beer_label_hd,beer_name,beer_slug,beer_style,bid,brewery.brewery_id,brewery.brewery_label,brewery.brewery_name,brewery.brewery_slug,brewery.brewery_type,brewery.contact.facebook,brewery.contact.twitter,brewery.contact.url,brewery.country_name,brewery.location.brewery_city,brewery.location.brewery_state,brewery.location.lat,brewery.location.lng,created_at,is_homebrew,is_in_production,merge_details.master_bid,merge_details.merge_date,merge_details.requested_bid,rating_count,rating_score,stats.monthly_count,stats.total_count,stats.total_user_count,stats.user_count,vintage_parent.beer.beer_abv,vintage_parent.beer.beer_name,vintage_parent.beer.beer_slug,vintage_parent.beer.bid,vintage_parent.beer.type_id,vintages.count,vintages.items,weighted_rating_score,wish_list
0,6.7,"Scratch #27-2010 begins a new fold in the Scratch series. For the next several batches individual Troegs brewers will create recipes of their choice. First up, The Ticeman had a hankering for a sweet stout, so the Troegs brothers and all the brewers met with Scharffen Berger Chocolate Company engineers to eat ridiculous amounts of cocoa nibs and chocolates over a few pints of beer.

This collaboration resulted in the delivery of a special blend of cocoa nibs that were added during the boiling process. In addition to the nibs, lactose was added at the end of the boil to give a little sweetness in the body. The addition of Galena and Simcoe hops lends a subtle fruity balance. After primary fermentation, the beer was aged for three weeks on a blend of cocoa nibs and Ugandan vanilla beans.

Dubbed Cocaoabunga, this unfiltered beer has a pleasant cocoa aroma, a subtle sweetness in the mouthfeel, a full-bodied flavor, and hints of vanilla. Enjoy!",0,https://untappd.akamaized.net/site/beer_logos/beer-Scratch27Cacaoabunga_5744.jpeg,,Scratch 27 - Cacaoabunga,troegs-brewing-company-scratch-27-cacaoabunga,Stout - Milk / Sweet,5744,2583,https://untappd.akamaized.net/site/brewery_logos/brewery-2583_bfb6f.jpeg,Tr?egs Independent Brewing,troegs-independent-brewing,Micro Brewery,https://www.facebook.com/troegsbrewingco,TroegsBeer,http://www.troegs.com/,United States,Hershey,PA,40.2933,-76.6576,"Sat, 21 Aug 2010 09:26:35 +0000",0,0,,,,59,3.92373,0,100,89,0,,,,,,0.0,[],3.69462,False
0,5.5,,45,https://untappd.akamaized.net/site/beer_logos/beer-FreshChesterPaleAle_10920.jpeg,,Freshchester Pale Ale,captain-lawrence-brewing-company-freshchester-pale-ale,Pale Ale - American,10920,341,https://untappd.akamaized.net/site/brewery_logos/brewery-CaptainLawrenceBrewingCompany_341.jpeg,Captain Lawrence Brewing Company,captain-lawrence-brewing-company,Micro Brewery,http://www.facebook.com/CaptainLawrence,cptlawrencebeer,http://captainlawrencebrewing.com,United States,Elmsford,NY,41.07,-73.8152,"Thu, 25 Nov 2010 09:42:20 +0000",0,1,10920.0,"Thu, 01 Jan 1970 00:00:00 +0000",5745.0,19564,3.48468,317,30714,22568,0,,,,,,0.0,[],3.48724,False
0,10.0,"This beer is the result of the marriage between two very distinct beer styles; the Belgian Tripel & American IPA. We have taken the best qualities from both styles and allowed them to shine through. The fruity and spicy notes from the imported Belgian yeast strain & the pungent flavors and aromas of the American grown Amarillo hops flow seamlessly together to create this flavorful ale.  Straight from the Captain???s cellar to yours, we hope you enjoy.",45,https://untappd.akamaized.net/site/beer_logos/beer-_5746_sm_a3fec28ac3633fc5ef2e76bddfd828.jpeg,https://untappd.akamaized.net/site/beer_logos_hd/beer-_5746_hd_fe67b199ba0ea140b6c73582353821.jpeg,Xtra Gold,captain-lawrence-brewing-company-xtra-gold,Belgian Tripel,5746,341,https://untappd.akamaized.net/site/brewery_logos/brewery-CaptainLawrenceBrewingCompany_341.jpeg,Captain Lawrence Brewing Company,captain-lawrence-brewing-company,Micro Brewery,http://www.facebook.com/CaptainLawrence,cptlawrencebeer,http://captainlawrencebrewing.com,United States,Elmsford,NY,41.07,-73.8152,"Sat, 21 Aug 2010 09:26:35 +0000",0,1,,,,1907,3.75184,5,2642,2321,0,,,,,,2.0,"[{'beer': {'bid': 853581, 'beer_label': 'https://untappd.akamaized.net/site/assets/images/temp/badge-beer-default.png', 'beer_slug': 'captain-lawrence-brewing-company-xtra-gold-2010', 'beer_name': 'Xtra Gold (2010)', 'is_vintage': 1, 'is_variant': 0}}, {'beer': {'bid': 1456553, 'beer_label': 'https://untappd.akamaized.net/site/assets/images/temp/badge-beer-default.png', 'beer_slug': 'captain-lawrence-brewing-company-xtra-gold-2014', 'beer_name': 'Xtra Gold (2014)', 'is_vintage': 1, 'is_variant': 0}}]",3.73787,False
0,6.5,"Don't let the golden color fool you - this isn't your father's lite beer!

Brewed with imported German malts and US-grown hops, this beer is a full-flavored introduction to craft-brewed beer. We add the hops late in the boil, allowing you to enjoy the flavor and aroma of the hops without an aggressive bitterness.",15,https://untappd.akamaized.net/site/beer_logos/beer-LiquidGold_5747.jpeg,,Liquid Gold,captain-lawrence-brewing-company-liquid-gold,Pale Ale - Belgian,5747,341,https://untappd.akamaized.net/site/brewery_logos/brewery-CaptainLawrenceBrewingCompany_341.jpeg,Captain Lawrence Brewing Company,captain-lawrence-brewing-company,Micro Brewery,http://www.facebook.com/CaptainLawrence,cptlawrencebeer,http://captainlawrencebrewing.com,United States,Elmsford,NY,41.07,-73.8152,"Sat, 21 Aug 2010 09:26:35 +0000",0,1,,,,15170,3.48596,156,22134,17632,0,,,,,,0.0,[],3.48922,False
0,6.4,"A complex beer, with layers of flavors unfolding as this beer slides down your throat. Before the introduction of indirect-fired malt kilns, all beers had a smoky flavor. Today only a handful of brewers produce beer reminiscent of those of the past. We use imported German smoked malt to add depth and complexity to our Smoked Porter.",45,https://untappd.akamaized.net/site/beer_logos/beer-_5748_2bc281730f9cf401146f6d11c3c3.jpeg,,Smoked Porter,captain-lawrence-brewing-company-smoked-porter,Smoked Beer,5748,341,https://untappd.akamaized.net/site/brewery_logos/brewery-CaptainLawrenceBrewingCompany_341.jpeg,Captain Lawrence Brewing Company,captain-lawrence-brewing-company,Micro Brewery,http://www.facebook.com/CaptainLawrence,cptlawrencebeer,http://captainlawrencebrewing.com,United States,Elmsford,NY,41.07,-73.8152,"Sat, 21 Aug 2010 09:26:35 +0000",0,1,,,,3416,3.62485,4,4572,4006,0,,,,,,0.0,[],3.62699,False
0,9.0,"This beer is a salute to the ingenuity and creativity of the American craft brewers. A uniquely American style of beer, the Double or Imperial IPA, has become the calling card of many craft brewers who aren't afraid to push the limits of what hops can add to a beer. This beer is big and hoppy - not for the faint of heart! Be prepared to experience sensory overload as you savor this Imperial IPA.",90,https://untappd.akamaized.net/site/beer_logos/beer-CaptainsReserveImperialIPA_5749.jpeg,,Captain's Reserve Imperial IPA,captain-lawrence-brewing-company-captain-s-reserve-imperial-ipa,IPA - Imperial / Double,5749,341,https://untappd.akamaized.net/site/brewery_logos/brewery-CaptainLawrenceBrewingCompany_341.jpeg,Captain Lawrence Brewing Company,captain-lawrence-brewing-company,Micro Brewery,http://www.facebook.com/CaptainLawrence,cptlawrencebeer,http://captainlawrencebrewing.com,United States,Elmsford,NY,41.07,-73.8152,"Sat, 21 Aug 2010 09:26:35 +0000",0,0,,,,11007,3.87599,1,16412,12670,0,,,,,,0.0,[],3.86989,False
0,4.5,"This beer was created as a summer thirst quencher, because we all know how hot and humid it can get in New York during the summer. We brewed this beer using both coriander and orange peel in the boil to increase both the aroma and flavor of this beer. Make sure you don???t get burned this summer, drink your Sun Block.",0,https://untappd.akamaized.net/site/beer_logos/beer-_5750_sm_9d788b44d641f6470ab6266fa40ad6.jpeg,,Sun Block Witte,captain-lawrence-brewing-company-sun-block-witte,Pale Wheat Ale - American,5750,341,https://untappd.akamaized.net/site/brewery_logos/brewery-CaptainLawrenceBrewingCompany_341.jpeg,Captain Lawrence Brewing Company,captain-lawrence-brewing-company,Micro Brewery,http://www.facebook.com/CaptainLawrence,cptlawrencebeer,http://captainlawrencebrewing.com,United States,Elmsford,NY,41.07,-73.8152,"Sat, 21 Aug 2010 09:26:35 +0000",0,1,,,,9148,3.28924,62,12686,10453,0,,,,,,0.0,[],3.30095,False
0,5.0,,0,https://untappd.akamaized.net/site/beer_logos/beer-BrownBird_40176.jpeg,,Brown Bird,captain-lawrence-brewing-company-brown-bird,Brown Ale - American,40176,341,https://untappd.akamaized.net/site/brewery_logos/brewery-CaptainLawrenceBrewingCompany_341.jpeg,Captain Lawrence Brewing Company,captain-lawrence-brewing-company,Micro Brewery,http://www.facebook.com/CaptainLawrence,cptlawrencebeer,http://captainlawrencebrewing.com,United States,Elmsford,NY,41.07,-73.8152,"Sun, 27 Mar 2011 14:54:30 +0000",0,1,40176.0,"Mon, 06 May 2013 04:22:11 +0000",5751.0,3249,3.5404,57,4592,3846,0,,,,,,0.0,[],3.5499,False
0,12.0,"This is a truly unique brew, combining some unusual elements to create a powerful, yet flavorful brew. I brewed a similar beer to this one back in 1998, while I was home brewing out in California. Only this time around I decided to age it in bourbon barrels to add a new element to the already rich sensory profile. The combination of dark malt, elderberries and bourbon barrels makes for an interesting tasting experience. This is a sippin??? beer, so sit back by the fire and enjoy. 12% alcohol by volume.",32,https://untappd.akamaized.net/site/beer_logos/beer-NorEaster_5752.jpeg,,Nor' Easter,dogfish-head-craft-brewery-nor-easter,Belgian Strong Dark Ale,5752,459,https://untappd.akamaized.net/site/brewery_logos/brewery-459_b3e4d.jpeg,Dogfish Head Craft Brewery,dogfish-head-craft-brewery,Micro Brewery,http://www.facebook.com/dogfishheadbeer,dogfishbeer,http://www.dogfish.com/,United States,Milton,DE,38.7776,-75.3099,"Sat, 21 Aug 2010 09:26:35 +0000",0,1,,,,268,3.77612,0,459,412,0,,,,,,0.0,[],3.70934,False
0,11.0,"There's nothing quite likes Mom's apple pie? But I am willing to bet this beer is pretty darn close.  An American Tripel, dry-hoped with Amarillo hops and aged in Apple Brandy barrels from one of this country's oldest distilleries.  The tropical aroma of the hops and the delicate apple aroma from the barrels are a perfect match.  Straight from the Captain's cellar to yours, we hope you enjoy.",0,https://untappd.akamaized.net/site/beer_logos/beer-5753_e7dad_sm.jpeg,https://untappd.akamaized.net/site/beer_logos_hd/beer-5753_ab01d_hd.jpeg,Golden Delicious,captain-lawrence-brewing-company-golden-delicious,Belgian Tripel,5753,341,https://untappd.akamaized.net/site/brewery_logos/brewery-CaptainLawrenceBrewingCompany_341.jpeg,Captain Lawrence Brewing Company,captain-lawrence-brewing-company,Micro Brewery,http://www.facebook.com/CaptainLawrence,cptlawrencebeer,http://captainlawrencebrewing.com,United States,Elmsford,NY,41.07,-73.8152,"Sat, 21 Aug 2010 09:26:35 +0000",0,1,,,,6998,3.72642,71,9659,8168,0,,,,,,5.0,"[{'beer': {'bid': 152762, 'beer_label': 'https://untappd.akamaized.net/site/assets/images/temp/badge-beer-default.png', 'beer_slug': 'captain-lawrence-brewing-company-golden-delicious-2008', 'beer_name': 'Golden Delicious (2008)', 'is_vintage': 1, 'is_variant': 0}}, {'beer': {'bid': 511300, 'beer_label': 'https://untappd.akamaized.net/site/assets/images/temp/badge-beer-default.png', 'beer_slug': 'captain-lawrence-brewing-company-golden-delicious-2009', 'beer_name': 'Golden Delicious (2009)', 'is_vintage': 1, 'is_variant': 0}}, {'beer': {'bid': 581620, 'beer_label': 'https://untappd.akamaized.net/site/assets/images/temp/badge-beer-default.png', 'beer_slug': 'captain-lawrence-brewing-company-golden-delicious-2012', 'beer_name': 'Golden Delicious (2012)', 'is_vintage': 1, 'is_variant': 0}}, {'beer': {'bid': 816047, 'beer_label': 'https://untappd.akamaized.net/site/beer_logos/beer-GoldenDelicious_5753.jpeg', 'beer_slug': 'captain-lawrence-brewing-company-golden-delicious-2014', 'beer_name': 'Golden Delicious (2014)', 'is_vintage': 1, 'is_variant': 0}}, {'beer': {'bid': 930465, 'beer_label': 'https://untappd.akamaized.net/site/assets/images/temp/badge-beer-default.png', 'beer_slug': 'captain-lawrence-brewing-company-golden-delicious-2011', 'beer_name': 'Golden Delicious (2011)', 'is_vintage': 1, 'is_variant': 0}}]",3.72326,False
0,5.0,"Brewed with New York State Blueberries and Brettanomyces, Le Bleu is a blend of barrels filled in 2007, 2008, and 2009. It's finished in the bottle with Champagne yeast.  

Enjoy the dusty rose appearance, mouthwatering aroma of ripe berries, piquant flavor and quick finish.",0,https://untappd.akamaized.net/site/beer_logos/beer-ExcelsiorLeBleu_5754.jpeg,,Excelsior! Le Bleu,ithaca-beer-company-excelsior-le-bleu,Sour - American Wild Ale,5754,705,https://untappd.akamaized.net/site/brewery_logos/brewery-705_f05a6.jpeg,Ithaca Beer Company,ithaca-beer-company,Macro Brewery,http://www.facebook.com/pages/Ithaca-NY/Ithaca-Beer-Company/24844294928,ithacabeer,http://ithacabeer.com/,United States,Ithaca,NY,42.4165,-76.5351,"Sat, 21 Aug 2010 09:26:35 +0000",0,0,,,,953,4.28778,5,1644,1259,0,,,,,,0.0,[],4.13294,False
0,10.6,"Canadian Breakfast Stout is an Imperial Stout brewed with a blend of coffees and imported chocolates, then aged in spent bourbon barrels that have most recently been aging pure Michigan maple syrup.",0,https://untappd.akamaized.net/site/beer_logos/beer-CanadianBreakfastStout_5755.jpeg,,Canadian Breakfast Stout (CBS),founders-brewing-co-canadian-breakfast-stout-cbs,Stout - American Imperial / Double,5755,549,https://untappd.akamaized.net/site/brewery_logos/brewery-foundersbrewingcompany_549.jpeg,Founders Brewing Co.,founders-brewing-co,Micro Brewery,http://www.facebook.com/foundersbrewing,foundersbrewing,http://www.foundersbrewing.com/,United States,Grand Rapids,MI,42.9585,-85.6735,"Sat, 21 Aug 2010 09:26:35 +0000",0,1,,,,18295,4.69627,179,27002,20646,0,,,,,,5.0,"[{'beer': {'bid': 95872, 'beer_label': 'https://untappd.akamaized.net/site/beer_logos/beer-_95872_sm_182c27de50b2135babda63bf4b199f.jpeg', 'beer_slug': 'founders-brewing-co-canadian-breakfast-stout-cbs-2011', 'beer_name': 'Canadian Breakfast Stout (CBS) (2011)', 'is_vintage': 1, 'is_variant': 0}}, {'beer': {'bid': 904797, 'beer_label': 'https://untappd.akamaized.net/site/beer_logos/beer-CanadianBreakfastStout_5755.jpeg', 'beer_slug': 'founders-brewing-co-canadian-breakfast-stout-cbs-2014', 'beer_name': 'Canadian Breakfast Stout (CBS) (2014)', 'is_vintage': 1, 'is_variant': 0}}, {'beer': {'bid': 1439655, 'beer_label': 'https://untappd.akamaized.net/site/assets/images/temp/badge-beer-default.png', 'beer_slug': 'founders-brewing-co-canadian-breakfast-stout-cbs-2015', 'beer_name': 'Canadian Breakfast Stout (CBS) (2015)', 'is_vintage': 1, 'is_variant': 0}}, {'beer': {'bid': 1460987, 'beer_label': 'https://untappd.akamaized.net/site/beer_logos/beer-CanadianBreakfastStout_5755.jpeg', 'beer_slug': 'founders-brewing-co-canadian-breakfast-stout-2016', 'beer_name': 'Canadian Breakfast Stout (2016)', 'is_vintage': 1, 'is_variant': 0}}, {'beer': {'bid': 1687134, 'beer_label': 'https://untappd.akamaized.net/site/assets/images/temp/badge-beer-default.png', 'beer_slug': 'founders-brewing-co-canadian-breakfast-stout-cbs-2013', 'beer_name': 'Canadian Breakfast Stout (CBS) (2013)', 'is_vintage': 1, 'is_variant': 0}}]",4.67907,False
0,8.3,This bitch has a lot going on. Its sweet malt body is contrasted by pine and grapefruit hop flavors and exotic fruit notes from the Belgian yeast.,60,https://untappd.akamaized.net/site/beer_logos/beer-5756_58e81_sm.jpeg,https://untappd.akamaized.net/site/beer_logos_hd/beer-5756_0748f_hd.jpeg,Raging Bitch Belgian IPA,flying-dog-brewery-raging-bitch-belgian-ipa,IPA - Belgian,5756,540,https://untappd.akamaized.net/site/brewery_logos/brewery-540_27433.jpeg,Flying Dog Brewery,flying-dog-brewery,Micro Brewery,http://www.facebook.com/flyingdog,flyingdog,http://flyingdogbrewery.com,United States,Frederick,MD,39.3627,-77.4265,"Sat, 21 Aug 2010 09:26:35 +0000",0,1,,,,141880,3.68626,3081,227132,159352,0,,,,,,0.0,[],3.68618,False
0,7.0,"If there were ever a beer that so quintessentially captures the spirit of the primordial past on planet Earth, it has to be the Hop Nest Monster. Bursting with the aroma of the American Amarillo hop, like the eruption of a great and tempestuous volcano, the Monster makes a bold and intimidating impression even before it reaches the palate. As an all-malt American IPA, over an entire pound per barrel of fragrant and floral Amarillo hops are added to the brew kettle during the final minutes of the boil. This process is known as late-kettle hopping.",0,https://untappd.akamaized.net/site/beer_logos/beer-5757_45bb3_sm.jpeg,https://untappd.akamaized.net/site/beer_logos_hd/beer-5757_9e839_hd.jpeg,Lilja's Hop Nest Monster,pangaea-beer-company-lilja-s-hop-nest-monster,IPA - American,5757,3220,https://untappd.akamaized.net/site/assets/images/temp/badge-brewery-default.png,Pangaea Beer Company,pangaea-beer-company,Micro Brewery,,,http://www.pangaeabeers.com/,United States,Wisconsin Rapids,WI,44.4082,-89.854,"Sat, 21 Aug 2010 09:26:35 +0000",0,1,,,,2685,3.2675,12,3647,3079,0,,,,,,0.0,[],3.30672,False
0,8.2,"Chaotic yet hypnotic, Mayhem is a deliberate Double IPA, brewed and conditioned with a special Belgian yeast that contributes complexity and spice. Abundant American hops offer grapefruit, pine, must and mint, which play off the fullness and sweetness of pale malts then provide a biting yet enticing finish.

Mayhem Double IPA accents the complex spice combinations found in Thai, Indian, Cajun, Morrocan, Mexican and Southwest American cuisines as well as BBQ marinades, dry rubs and sauces.

Mayhem creates MAYHEM.",100,https://untappd.akamaized.net/site/beer_logos/beer-MayhemBelgianstyleDoubleIPA_5758.jpeg,,Mayhem Belgian-style Double IPA,midnight-sun-brewing-co-mayhem-belgian-style-double-ipa,IPA - Belgian,5758,858,https://untappd.akamaized.net/site/brewery_logos/brewery-MidnightSunBrewingCo_858.jpeg,Midnight Sun Brewing Co.,midnight-sun-brewing-co,Micro Brewery,https://www.facebook.com/midnightsunbrewingcompany,MidSunBrewing,http://midnightsunbrewing.com/,United States,Anchorage,AK,61.1473,-149.844,"Sat, 21 Aug 2010 09:26:35 +0000",0,1,,,,113,3.57743,0,219,209,0,,,,,,0.0,[],3.63045,False
0,10.0,"This double bock provides smooth sailin' in rough seas. The fact that this luscious lager was aged in rum barrels creates the illusion that the open sea is a safe place. And while riding out these waves of grain, you may fall victim to the dangers of pirates, rum, bock. OK...maybe the beach is a bit over-rated.",30,https://untappd.akamaized.net/site/beer_logos/beer-_5759_24b46f5c328bb47de4fa327a8eec.jpeg,,Rumbah,midnight-sun-brewing-co-rumbah,Doppelbock ,5759,858,https://untappd.akamaized.net/site/brewery_logos/brewery-MidnightSunBrewingCo_858.jpeg,Midnight Sun Brewing Co.,midnight-sun-brewing-co,Micro Brewery,https://www.facebook.com/midnightsunbrewingcompany,MidSunBrewing,http://midnightsunbrewing.com/,United States,Anchorage,AK,61.1473,-149.844,"Sat, 21 Aug 2010 09:26:35 +0000",0,0,,,,7,0.0,0,11,11,0,,,,,,0.0,[],3.54205,False
0,8.0,"This gruit ale was inspired by the Phish song of the same name. A traditional gruit in style, Bathtub Gin was brewed without hops. Instead Ben spiced his beer with botanicals typically used to flavor gin: juniper berries, orris root, angelica root, grains of paradise, lemon peel, orange peel and coriander. The result is intensely fragrant, flavorful and fabulous.",0,https://untappd.akamaized.net/site/beer_logos/beer-_5760_569505775f96c0d4fa09feb0f84b.jpeg,,Bathtub Gin,midnight-sun-brewing-co-bathtub-gin,Spiced / Herbed Beer,5760,858,https://untappd.akamaized.net/site/brewery_logos/brewery-MidnightSunBrewingCo_858.jpeg,Midnight Sun Brewing Co.,midnight-sun-brewing-co,Micro Brewery,https://www.facebook.com/midnightsunbrewingcompany,MidSunBrewing,http://midnightsunbrewing.com/,United States,Anchorage,AK,61.1473,-149.844,"Sat, 21 Aug 2010 09:26:35 +0000",0,1,,,,26,3.60577,0,42,40,0,,,,,,0.0,[],3.64666,False
0,4.6,"When the sun hangs high overhead and the stars don?t glimmer until well into the evening, there?s nothing better than grabbing another beer. We specially crafted Farmer?s Tan to be the beer you enjoy on those long summer days. At 4.6% abv, it?s one of our lightest, with a smooth body and easy finish. We carefully limited the ingredients to two types of hops and two types of malts for a perfectly balanced, ?sessional? India Pale Ale. 

We?ve got the beer covered. It?s up to you to keep the sunscreen on.

FOOD PAIRINGS: Particularly tasty when paired with hot dogs, burgers and grilled foods. Cheddar and derby cheeses, pizza and summer fare.

AVAILABILITY: Spring/summer / 12oz (6pk and 24 bottle cases) / ? keg, 1/6 keg",0,https://untappd.akamaized.net/site/beer_logos/beer-608898_645e0_sm.jpeg,https://untappd.akamaized.net/site/beer_logos_hd/beer-608898_a5784_hd.jpeg,Farmer's Tan Session IPA (2014),southern-tier-brewing-company-farmer-s-tan-session-ipa-2014,IPA - Session / India Session Ale,608898,4586,https://untappd.akamaized.net/site/brewery_logos/brewery-4586_47eba.jpeg,Southern Tier Brewing Company,southern-tier-brewing-company,Micro Brewery,http://www.facebook.com/SouthernTierBrewingCompany,stbcbeer,http://www.stbcbeer.com/,United States,Lakewood,NY,42.0889,-79.3482,"Thu, 06 Mar 2014 22:51:53 +0000",0,0,608898.0,"Tue, 02 Feb 2016 21:15:37 +0000",5761.0,13438,3.43024,1,17927,15093,0,9.0,Farmer's Tan,southern-tier-brewing-company-farmer-s-tan,5761.0,156.0,,,3.43513,False
0,7.2,"The latest in our Brewers??? Select One-offs, India is a West Coast style IPA at [7.2%] ABV, with incredibly delicious hoppiness! Golden in color, this beer is tilted way over toward the hops by way of less specialty malts used in the mash. Draft will be going out to select wholesalers in PA, NJ, FL, and MD.??? 70+ IBU???s.",0,https://untappd.akamaized.net/site/beer_logos/beer-India_5762.jpeg,,India,weyerbacher-brewing-company-india,IPA - American,5762,1352,https://untappd.akamaized.net/site/brewery_logos/brewery-weyerbacherbrewingcompany_1352.jpeg,Weyerbacher Brewing Company,weyerbacher-brewing-company,Micro Brewery,http://www.facebook.com/WeyerbacherBrewing?ref=ts,weyerbacher,http://weyerbacher.com,United States,Easton,PA,40.6733,-75.2252,"Sat, 21 Aug 2010 09:26:35 +0000",0,1,,,,9,0.0,0,27,26,0,,,,,,0.0,[],3.54515,False
0,5.1,"(aka Scrumptious Spring Lager)
Vinyl sails in on her shining wings as the spinning sun returns. She is the season-shifter, bursting from her cocoon to sing the ancient song of vernal yearning and to summon spring's sweet green return... Her metamorphosis becomes our own. Her thirsts are shared by all. Drink in her mysterious elixir as the revolution blooms again... ",20,https://untappd.akamaized.net/site/beer_logos/beer-5763_7dc83_sm.jpeg,https://untappd.akamaized.net/site/beer_logos_hd/beer-5763_59659_hd.jpeg,Vinyl,magic-hat-brewing-company-vinyl,Lager - American Amber / Red,5763,812,https://untappd.akamaized.net/site/brewery_logos/brewery-812_78347.jpeg,Magic Hat Brewing Company,magic-hat-brewing-company,Micro Brewery,http://facebook.com/magichatbrewing,magichat,http://www.magichat.net/,United States,South Burlington,VT,44.429,-73.2135,"Sat, 21 Aug 2010 09:26:35 +0000",0,0,,,,9032,3.3404,8,13654,11113,0,,,,,,0.0,[],3.35057,False
0,9.0,"An unfiltered and 100% bottle-conditioned version of 90 Minute IPA that's dry-hopped with Palisade, Amarillo, Simcoe, Cascade, CTZ, and Willamette hops. Brewed to honor the Rogue Gallery in Portland, Maine, who will also be releasing a DFH designed clothing line in the summer of '09.",90,https://untappd.akamaized.net/site/beer_logos/beer-5764_94e80_sm.jpeg,https://untappd.akamaized.net/site/beer_logos_hd/beer-5764_3d784_hd.jpeg,Squall IPA,dogfish-head-craft-brewery-squall-ipa,IPA - Imperial / Double,5764,459,https://untappd.akamaized.net/site/brewery_logos/brewery-459_b3e4d.jpeg,Dogfish Head Craft Brewery,dogfish-head-craft-brewery,Micro Brewery,http://www.facebook.com/dogfishheadbeer,dogfishbeer,http://www.dogfish.com/,United States,Milton,DE,38.7776,-75.3099,"Sat, 21 Aug 2010 09:26:35 +0000",0,1,,,,11911,3.98726,14,15221,13919,0,,,,,,5.0,"[{'beer': {'bid': 100173, 'beer_label': 'https://untappd.akamaized.net/site/assets/images/temp/badge-beer-default.png', 'beer_slug': 'dogfish-head-craft-brewery-squall-ipa-2009', 'beer_name': 'Squall IPA (2009)', 'is_vintage': 1, 'is_variant': 0}}, {'beer': {'bid': 100178, 'beer_label': 'https://untappd.akamaized.net/site/assets/images/temp/badge-beer-default.png', 'beer_slug': 'dogfish-head-craft-brewery-squall-ipa-2010', 'beer_name': 'Squall IPA (2010)', 'is_vintage': 1, 'is_variant': 0}}, {'beer': {'bid': 102679, 'beer_label': 'https://untappd.akamaized.net/site/assets/images/temp/badge-beer-default.png', 'beer_slug': 'dogfish-head-craft-brewery-squall-ipa-2011', 'beer_name': 'Squall IPA (2011)', 'is_vintage': 1, 'is_variant': 0}}, {'beer': {'bid': 1095234, 'beer_label': 'https://untappd.akamaized.net/site/beer_logos/beer-1095234_6ab7a_sm.jpeg', 'beer_slug': 'dogfish-head-craft-brewery-squall-ipa-2015', 'beer_name': 'Squall IPA (2015)', 'is_vintage': 1, 'is_variant': 0}}, {'beer': {'bid': 1472841, 'beer_label': 'https://untappd.akamaized.net/site/beer_logos/beer-1472841_20ae1_sm.jpeg', 'beer_slug': 'dogfish-head-craft-brewery-squall-ipa-2016', 'beer_name': 'Squall IPA (2016)', 'is_vintage': 1, 'is_variant': 0}}]",3.97883,False
